ID,Название приложения,Магазин,Рейтинг,Заголовок,Содержание,Автор,Дата,Регион,Версия,Полезность
d32d589a-9fb8-46d6-850e-56d279952429,Medisafe Pill & Med Reminder,Google Play,5,,"extremely useful for ADHD, immediately became a permanent part of my routine, hot tip let it send you smartwatch notifications",EpicTurtle,08.08.2025,us,9.48.2,0
5f6c51f3-ca76-4755-a8b5-1ed5f93cb465,Medisafe Pill & Med Reminder,Google Play,5,,one of the best 👌,Reza Bunchy,08.08.2025,us,9.48.2,0
2d7f4c27-d7f4-4651-9d3e-ea88de8f2668,Medisafe Pill & Med Reminder,Google Play,5,,great app and best options,XaNii Le',07.08.2025,us,,0
306215a9-8cc5-44be-bea3-5688ed1d0e42,Medisafe Pill & Med Reminder,Google Play,5,,Very good app. Able to keep track of all my meds in one place. Especially like the individual med SUSPEND & RESORE feature which allows me to archive a med when it is no longer needed and restore the med when I need to restart it.,Jud Bleser,07.08.2025,us,9.48.2,0
fa4b3a0e-7daf-4874-a601-9fab9f60e3a2,Medisafe Pill & Med Reminder,Google Play,5,,great app,john w,07.08.2025,us,9.48.2,0
e557bbbe-19af-4e9b-93d2-8191eabdae99,Medisafe Pill & Med Reminder,Google Play,5,,Great,Joseph Brown,07.08.2025,us,9.48.2,0
07452c24-4d46-452c-8f7c-ad64083d896f,Medisafe Pill & Med Reminder,Google Play,1,,"USE MEDTIMER INSTEAD. Premium subscription required to track more than one medication. I used this for a long time and was happy with it until I needed help with more than one medication and found this ridiculous limitation. I understand developers want steady income but this is just greedy, especially considering this is a healthcare app. Please support and use the fully free and open source MedTimer app instead!!",Josh Davis,07.08.2025,us,9.48.2,0
9385c7bd-292c-4b02-9421-d3165c170933,Medisafe Pill & Med Reminder,Google Play,5,,Great tool! keeps me on track 👍🏼,Armando Esteban Espinosa Diaz,06.08.2025,us,9.48.2,0
1d01573c-984a-4c51-83f9-1983a5ca9f30,Medisafe Pill & Med Reminder,Google Play,4,,приложение хорошее и удобное. минусов почти нет,Дядя Стрейд,06.08.2025,ru,9.48.2,0
b6865ce0-9ce9-46b1-9b7c-977ce88b8cdb,Medisafe Pill & Med Reminder,Google Play,5,,"I looked at 2 other apps before selecting this one. Very easy to set up your meds and reminders to take them, then quickly and easily mark them as taken or skipped when the reminder pops up.",Mike Sheppard,06.08.2025,us,9.48.2,0
dd36ad5a-3c84-4c78-b421-cc3fb5ad29e5,Medisafe Pill & Med Reminder,Google Play,5,,A life-changer. I went from forgetting my meds 1 or 2 times a week to forgetting them 1 or 2 times a year.,Richard Braakman,05.08.2025,us,9.48.2,0
0ad33810-b45a-4d3a-8302-dafd574877ca,Medisafe Pill & Med Reminder,Google Play,5,,"в целом очень удобно, только после нескольких уведомлений приложение сдается, а я хочу, чтобы настойчиво мне их присылали",pikotarou8,04.08.2025,ru,9.48.2,0
cfb54fd9-28a2-449b-b2c8-62563924f466,Medisafe Pill & Med Reminder,Google Play,5,,"I use this app already for a couple of months and very satisfied! It helps me not to forget about my pills. Reminders work very efficiently, notifications are being sent until you confirm that you took a pill.",Julia Lebedkina,04.08.2025,ru,9.48.2,0
e8c69d2b-7712-44d0-bd98-378e3f0c869e,Medisafe Pill & Med Reminder,Google Play,5,,very helpful. a great app to have,Lola Roseé,04.08.2025,us,9.48.2,0
33260397-b5de-42c8-ad25-06ca9768f630,Medisafe Pill & Med Reminder,Google Play,3,,"die App ist gut , nur mir ist Aufgefallen dass es keine optión gibt um für wassertrinken Erinnerung das ist schlecht .Bitte Ändert das schnell möglich. Deswegen wollte ich die App am Anfang gleich löschen .",Sharon Serrano Völker,04.08.2025,de,9.48.2,0
d086e4f9-d5c3-43cf-89e2-a713d91fd097,Medisafe Pill & Med Reminder,Google Play,4,,"Works well, changes time zones when you travel and reminds you of refills. It's all just what I needed.",Rick Bender,04.08.2025,us,9.48.2,0
677a1786-b171-4ed1-8f4f-9d28f7ed1552,Medisafe Pill & Med Reminder,Google Play,5,,reminder when I need them. Also a great way to have my list of medications.,Melissa Franklin,04.08.2025,us,9.48.2,0
2fd53a71-6475-4232-81f3-9d526372f419,Medisafe Pill & Med Reminder,Google Play,2,,Cela devient indispensable lorsqu'on a plusieurs cachets ou personnes (enfants) a gérer ! 2025 la limitation payante est dur à avaler. après 10ans de loyaux services. par chance je ne prends plus autant de médicaments sinon je l'aurai désinstallée.,Marc-Antoine Pelletier,04.08.2025,fr,9.48.2,0
ebf8ce33-b357-4e12-879f-641b1c6006c8,Medisafe Pill & Med Reminder,Google Play,5,,great way to stay on track with medicine and Dr. Very help full.,Debbie Dufour,04.08.2025,us,9.48.2,0
d743b852-e925-4a76-8b08-de8e779e86a1,Medisafe Pill & Med Reminder,Google Play,2,,"Not great for those who are on dozens of medications, some of which are occasional but require a schedule, like antibiotics or steroids, or for PRN meds. The longer you use the app the less access to your long term data is available. Also you can't see all the instances of when a short term med on a schedule has been taken, or initial creation/start date - just last taken date. Still experiencing a bug where meds marked as taken show as snoozed so you accidentally take it twice.",Rachael Swiss,03.08.2025,us,9.48.2,0
a4db9603-8a05-4dbe-8d8c-d2f76a45781b,Medisafe Pill & Med Reminder,Google Play,5,,help me to be more organized with my medications and helps me to remember to take them better. give me useful information on my diseases too.,The Bag Lady 103167,03.08.2025,us,9.48.2,0
d452f7cd-290f-4b47-aaa5-2d91a6aa4650,Medisafe Pill & Med Reminder,Google Play,4,,amazing with all the features that it has,Ouss Lover,03.08.2025,us,,0
1b84ff8d-d9d0-4e8f-aef6-257d0eb771d1,Medisafe Pill & Med Reminder,Google Play,5,,Love it.. I really appreciate this app for my medication,De'Lois West,03.08.2025,us,9.47.1,0
ac006b99-dcfa-4d84-8fc1-c98b420b2fff,Medisafe Pill & Med Reminder,Google Play,5,,super pour médicaments à prendre toutes les 72 heures,zeste caron,03.08.2025,fr,9.48.2,0
ae275bc1-df73-4e85-9384-c36c611037a3,Medisafe Pill & Med Reminder,Google Play,1,,"MAJ au 3 août 2025 : C'est ignoble, maintenant si on veut enregistrer un médicament c'est une obligation de prendre la version payante Le rappel de la prise des médicaments ne se fait plus. L'aide est en anglais. Dommage car jusqu'à maintenant ça allait super bien mais depuis 1 mois c'est plus du tout ça. Remedies y et je mettrais 5 étoiles 🤷‍♀️",Sabine Cardon-Brachet,03.08.2025,fr,9.48.2,0
499c2616-5ca1-4480-9ffe-b30179a41349,Medisafe Pill & Med Reminder,Google Play,5,,muy buena app,Benjamin Novillo Linares,03.08.2025,us,9.48.2,0
9efec8ba-e6b9-4d9d-9917-c9d800d55f34,Medisafe Pill & Med Reminder,Google Play,5,,Gut 👍,Jurij Schischko,03.08.2025,de,9.48.2,0
655431b8-43d1-41b2-8329-9c69d7f39938,Medisafe Pill & Med Reminder,Google Play,5,,Great app helps keep a scheduled,Antonio Gil,02.08.2025,us,9.48.2,0
512ffa2c-7978-4c77-b02b-5738d57fe204,Medisafe Pill & Med Reminder,Google Play,5,,Great Reminder,Adam Ant,02.08.2025,us,9.48.2,0
9e64c096-28e1-407f-b586-1f140d37f2e0,Medisafe Pill & Med Reminder,Google Play,5,,"This app is practical and flexible for Med scheduling and tracking. The fact that I can easily postpone a reminder, or easily reschedule it, is convenient. It effectively keeps me on track with meds. This is a very practical app.",David Vita,02.08.2025,us,9.48.2,0
87c91f70-7b82-45f9-8d38-8a462bc965a9,Medisafe Pill & Med Reminder,Google Play,1,,bad,M J,02.08.2025,us,,0
1bc9ebc8-3a11-4c8b-844c-c6ae38c13571,Medisafe Pill & Med Reminder,Google Play,5,,Functional in a basic but efficacious user interface experience.,Mike Nestor,02.08.2025,us,9.48.2,0
28a9a310-8d6f-430d-b007-9cefe1bf3a57,Medisafe Pill & Med Reminder,Google Play,5,,Medisafe is a life saver and I recommend it to literally everyone I know.,Daniel Gray,01.08.2025,us,9.48.2,0
3078f637-15f3-4a5f-9044-d392aeb8831e,Medisafe Pill & Med Reminder,Google Play,1,,"you can only see 1 week at a time, free version only includes 2 meds, and if you're editing the notes on the meds, you can't see what you're typing because the keyboard covers the note box",Paola Nace,01.08.2025,us,9.48.2,0
13909260-8b6e-4c64-8cc7-ccf61657b15b,Medisafe Pill & Med Reminder,Google Play,5,,keeps accurate records,Keith Strozewski,01.08.2025,us,9.48.2,0
6e1122bc-d280-427e-9c16-f7ca81f986b0,Medisafe Pill & Med Reminder,Google Play,5,,تطبيق ممتاز لتذكيري لأخذ أدويتي.,Fatema Al rubayee,01.08.2025,us,9.48.2,0
c1de3157-6884-4c6c-997b-2df426c2f6a6,Medisafe Pill & Med Reminder,Google Play,5,,super helpful and the new premium features seem like a great idea outlining conflicting meds and supplements,Jonathan Love,01.08.2025,us,9.48.2,0
7b446673-1aeb-43c0-b195-efd6b38805a4,Medisafe Pill & Med Reminder,Google Play,5,,The app is very helpful for maintaining all my doctors contact info and appointments as well as getting med reminders. The best feature is having a med friend to help keep me accountable for taking my meds.,Tia Stroop,31.07.2025,us,9.48.2,0
16a15cae-721c-486f-b27b-b4480735dd00,Medisafe Pill & Med Reminder,Google Play,1,,"Kein testen möglich, nur kaufen. Ohne Test kein Kauf. Macht man beim Auto-Kauf auch so, ihr wahrscheinlich nicht. Böse Falle",Emmerlein,31.07.2025,de,9.48.2,0
a9488459-07d0-4c69-b034-20eec3caa19c,Medisafe Pill & Med Reminder,Google Play,1,,Subscription to add more than 2 meds? DELETED.,Eugene Bortolin,31.07.2025,us,,0
eb6b25e9-d343-499d-8823-625ed30889f8,Medisafe Pill & Med Reminder,Google Play,5,,"I would be lost without this app. It reminds me when my medication is due, so I never miss a dose.",N Kro,31.07.2025,us,9.48.2,0
4a739bdd-91b6-4abc-8e5d-2cf219724871,Medisafe Pill & Med Reminder,Google Play,5,,je suis très satisfait de cette application de médicaments et je remercie les développeurs pour leurs travail et je recommande cette application pour les personnes qui prennent des médicaments pour leurs santé.,Marcel Petremann,31.07.2025,fr,9.48.2,0
cd3cc4d2-1e73-429a-b74e-f43b59ef58a0,Medisafe Pill & Med Reminder,Google Play,5,,the app helps me take my shot every 2 weeks. thanks,Dre,30.07.2025,us,9.48.2,0
08a578fe-1140-49db-9c9d-97fa2ae23d66,Medisafe Pill & Med Reminder,Google Play,4,,"I like the features so far, but I wish it was possible to set different reminder settings for each med; i.e., really nag me about the weekly one I always forget, but not so much for my nightly meds I usually remember on my own. Also - I like the health trackers, but cannot track my seizures. A seizure tracker or a custom tracker would be nice to see. Otherwise it seems very good, and like it'll help with long term med consistency.",Julien Mieirs,30.07.2025,us,9.48.2,0
ac368834-b47c-4363-9666-22d903a9dbef,Medisafe Pill & Med Reminder,Google Play,1,,Only 2 meds on the free version is diabolical. As someone with many conditions i dont have the money to spare for a pill tracking up.,Hako,30.07.2025,us,,0
18e86a15-f900-48d0-8e6d-50830ad4be1c,Medisafe Pill & Med Reminder,Google Play,5,,"this app is great! I use it to track Peptides, HRT, meds. Tons of flexibility.",Steve C,30.07.2025,us,9.48.2,0
81bdc22d-0446-447c-9d7a-e9f442a44dde,Medisafe Pill & Med Reminder,Google Play,4,,Does a Good job at managing your meds.. Editing is a little frustrating @ first..no ads.,Greg Geuss,30.07.2025,us,9.48.2,0
d00ca483-0ff2-413d-b3e2-bc9b0a3eaa81,Medisafe Pill & Med Reminder,Google Play,2,,"пока было бесплатное, пользовалась. сейчас нет, т к оплатить подписку не могу по причине технической ошибки из-за моего местоположения",Дарья Абрамова,29.07.2025,ru,9.48.2,0
74e8e08b-abc3-4f8d-a119-f86e83ce39b7,Medisafe Pill & Med Reminder,Google Play,4,,I got this to help track ADHD medication after late adulthood diagnosis. I've never had to take meds long term so I looked online & saw this app suggested by others. I haven't missed a pill & the reporting features made my follow up go smoothly. I really like it.,Samantha Hernandez,29.07.2025,us,9.48.2,0
58da904c-e8cb-4e77-a0c4-fc8f87f921b4,Medisafe Pill & Med Reminder,Google Play,5,,helps me take my doses at the right time daily,Amanda Krcha Lesikar,29.07.2025,us,9.48.2,0
3fc6a860-a357-41e2-8797-28d985a1841f,Medisafe Pill & Med Reminder,Google Play,2,,Not sure what's going on with this app but it hasn't had a update for a while. And today some of my entries are not activated. My reminders come but it won't let me enter the time 😭 Help can you fix this. Thanks Monday 07/28/2025 Did a update but some entries are not there.,Patricia Curry,28.07.2025,us,9.48.2,0
cd9831d6-4bc6-4c0c-a9a3-708de1089a32,Medisafe Pill & Med Reminder,Google Play,5,,super application que j'utilise depuis longtemps et que je ne peux plus m'en passer,Didier Guichard,28.07.2025,fr,9.48.2,0
37d8a12a-4bb0-436f-8380-8c79a6c66069,Medisafe Pill & Med Reminder,Google Play,4,,"Хорошее приложение. Но есть проблемы с напоминанием. Не всегда срабатывает, хотя все настройки выставлены.",Nikola Al,28.07.2025,ru,9.48.2,0
0a6c8065-d423-4bd3-9206-208bcaa8fff4,Medisafe Pill & Med Reminder,Google Play,2,,it won't accept a time change,JoeRobin Ellerman,27.07.2025,us,9.48.2,0
ab226bd2-5958-4316-891c-41428eceb54a,Medisafe Pill & Med Reminder,Google Play,5,,"Great app. once I started HRT for perimenopause, I needed something to help me keep track of my prescriptions & when to take everything. The alerts are so helpful even though they can be annoying. No one likes something nagging you to do something ;) but if it weren't for this app, I'd be missing doses all the time.",Alison Bockman,27.07.2025,us,9.48.2,0
b17ea079-1d5d-4686-ad5d-79da16f62013,Medisafe Pill & Med Reminder,Google Play,5,,I love it.,Amanda Vieira,26.07.2025,us,9.48.2,0
e7361ba9-a7f0-49da-b147-f2fcd65adf79,Medisafe Pill & Med Reminder,Google Play,5,,"I tried another medication reminder (for several days) because it came with a higher review & came back to this one. In my opinion this is the most ""user friendly"" reminder. Try it, you won't be sorry.",Katy Martinez-Medina,26.07.2025,us,9.48.2,0
94d304ba-dc13-4843-87c8-69858a0a684a,Medisafe Pill & Med Reminder,Google Play,4,,Really good at reminders & having a buddy that can be contacted if you do forget is great. I would like more flexibility with setting routines. I have medication that is 14 days taken & 14 days off & I can't set that in the app,Michelle Twigg,25.07.2025,us,9.48.2,0
90ae6b96-b842-459a-93a6-8c9ffb8b7078,Medisafe Pill & Med Reminder,Google Play,1,,Why does the reminder not play the notification sound for android 15?,Ruby Sapphire,25.07.2025,us,9.48.2,0
fb3843bc-1529-4077-94db-7fb9ef0170e9,Medisafe Pill & Med Reminder,Google Play,5,,I can call and get map from app,jacksepickeeyes s,25.07.2025,us,9.47.1,0
1fc47692-f168-4341-892f-5e9fbff1dc52,Medisafe Pill & Med Reminder,Google Play,5,,Really works well for me and my family. Med friend option worked great when we needed it,Beth Prince,25.07.2025,us,9.48.2,0
5d2df4f0-deeb-449a-a400-b166d25372a4,Medisafe Pill & Med Reminder,Google Play,5,,"отлично,помогает",Рустэм Аюпов,24.07.2025,ru,9.47.1,0
fb375d25-5df8-425d-849c-b24fa8d92ef1,Medisafe Pill & Med Reminder,Google Play,1,,Used to be a five. remeders to take meds good. too much other stuff reminding me of news or info is too much and annoying.,Donald Williams,23.07.2025,us,9.48.2,0
6e7222c0-83c9-4439-8eaa-46e3bc2df5ef,Medisafe Pill & Med Reminder,Google Play,5,,Medisafe is an invaluable tool for medication and vitals. Simple and effective.,Orion Roeder,23.07.2025,us,9.48.2,0
07a165a0-35e6-4772-9f21-748f4c43c260,Medisafe Pill & Med Reminder,Google Play,5,,much better than many app on this niche,Paul Walker,23.07.2025,us,9.48.2,0
1d36c9de-ed51-49af-a0c3-1db45a99b898,Medisafe Pill & Med Reminder,Google Play,5,,This is a really great app that helps keep me on schedule with my pain meds.,Sue Wilson,23.07.2025,us,9.48.2,0
f0968abf-a033-45de-bb59-e94b65320177,Medisafe Pill & Med Reminder,Google Play,5,,"Very good for scheduling. For example, I have a mouthwash my dentist prescribed that I have use for one week then three weeks off and then repeat. I haven't found another app that can do that. And it has a ton of other useful stuff too, and that is just the free version.",Andrew N,23.07.2025,us,9.48.2,0
893a37d8-2fb2-45af-80fd-b3471702cc1f,Medisafe Pill & Med Reminder,Google Play,4,,"it's a really good reminder app but it doesn't let teenagers (like myself) who need to take medicine use the app, I have to be an adult to use it which I think is dumb because the medicine I take keeps me alive",Leighla Marie,22.07.2025,us,9.48.2,0
d2c065a0-95d4-40a3-85fb-336ceaec2971,Medisafe Pill & Med Reminder,Google Play,1,,Recent update broke the app,Jonathan Marmont,22.07.2025,us,9.48.2,0
75e03e1c-b4ec-4c7c-a034-b09536cf5268,Medisafe Pill & Med Reminder,Google Play,3,,it works. one thing I am not fond of is it reminding you to take medication when you have already taken it!!,Mysquishy,22.07.2025,us,9.48.2,0
930ae5ac-be04-4984-a040-4d022f0baee0,Medisafe Pill & Med Reminder,Google Play,1,,"I liked this app, I really did. But then I turned on tracking detection on my phone and in less than a day, this app made 16,000 tracking requests to bugsnag, branch metrics, and Google. that's simple unacceptable ESPECIALLY for something that contains my medical data. As I write this it's ticking up, sending about one request every 1-2 seconds. if you care about your privacy, this probably isn't the app for you.",Tim W,22.07.2025,us,9.48.2,0
34ee4bbf-62ec-4ff7-ab35-db140dcdbd75,Medisafe Pill & Med Reminder,Google Play,5,,This is a superb App- well thought out & designed. It has a section making medication details easy at hand when Medics of any kind need it. It is also got some lovely icons & colours to it making different drugs easily identifiable. It is pretty easy to get to grips with. Even though it has a lot of useful information & functions such as medical clintitions etc. Try it I am sure you will not be disappointed especially with it's fantastic customer service alongside this incredible App-🔔😄👍🏻👍,Darren Brewer,21.07.2025,us,9.48.2,0
ed2b12b0-9065-4e58-bd00-53951e44e203,Medisafe Pill & Med Reminder,Google Play,5,,Great!,Nate Wilson,21.07.2025,us,9.48.2,0
b117ae72-8106-46d1-b770-427047ffc892,Medisafe Pill & Med Reminder,Google Play,5,,has helped me keep track of the many meds I take,Dottie Murdock,21.07.2025,us,9.48.2,0
e15eb945-05fd-46db-97b7-6bcee233dd74,Medisafe Pill & Med Reminder,Google Play,5,,"Ich nutze die App seit 2017, und verstehe nicht, wieso die Sprache nicht mittlerweile geändert wurde. Ich verstehe mit meinem Schulenglisch leider nur einen Bruchteil. Die Handhabung und die tolle grafische Darstellung machen es wirklich einfach, mit der app umzugehen. Es gibt so viele verschiedene Möglichkeiten, alles persönlich auf meine Wünsche einzustellen. Das einzigst negative: die Erläuterungen zu Medikamenten und die faq's sind in englisch. Ich hoffe, das ändert sich bald.",susanne1967e,21.07.2025,de,9.48.2,0
bf27231a-9938-4dda-92d0-79b319d18c5d,Medisafe Pill & Med Reminder,Google Play,5,,This app is great because I was able to set the reminders and it worked great with my watch and phone. Thank you for making a great app.,Christine Geck,20.07.2025,us,9.48.2,0
ec2d645f-5e75-45d2-bf8a-c732fd6d8d6a,Medisafe Pill & Med Reminder,Google Play,5,,"very, very helpful!",ward kimmel,20.07.2025,us,9.48.2,0
e78bb500-07d0-4607-8eb9-ae65cec41713,Medisafe Pill & Med Reminder,Google Play,5,,I love medisafe. It is so convenient to have all of your med info at your fingertips. The reminder to take your meds is awesome for busy mornings when it is easy to forget,Pam Wilson,20.07.2025,us,9.48.2,0
b2645e15-53a0-4344-aad3-b098788593db,Medisafe Pill & Med Reminder,Google Play,1,,"Начала регистрацию и тут же решила сменить тухлый синий цвет темы на другой . Но каково было мое разочарование , что смена темы по подписке . Клоуны , даже не стала завершать регистрацию . Del",Anna Kulikova,20.07.2025,ru,9.44.2,0
56c8bd3d-115d-4cc3-aafb-c276ba8b9469,Medisafe Pill & Med Reminder,Google Play,1,,App does not allow Landscape Mode. Worthless for us who need this option.,Michael Cortese,20.07.2025,us,,0
96895703-5834-42af-938b-601727a0f5ed,Medisafe Pill & Med Reminder,Google Play,1,,kostenlos nur 2 Medikamente,Waldemar Schäfer,19.07.2025,de,9.41.1,0
a3f3ddd9-b218-4f23-aae3-16d82d4442fc,Medisafe Pill & Med Reminder,Google Play,4,,"Easily a 5-star app, the best I've seen, with many settings you can adjust. I gave it 4 starts is for multi-device sync. It's installed and logged in on both my phone (for while I'm away) and my tablet (while at home). If I log something on one device, the other will not reflect the change, and will continue to remind you about a missed med YOU ALREADY TOOK. Whether you wait 10 minutes or 10 hours, they will NOT sync up, and must be closed and reopened. Should be real-time sync, not manual.",Richard James,19.07.2025,us,9.48.2,0
2d6eb154-4fa9-4ec5-b6d3-119cbf3fd734,Medisafe Pill & Med Reminder,Google Play,4,,"Keeps you on track, especially after surgery for your multiple pills.",music4lfe,19.07.2025,us,9.48.2,0
e4462e98-1031-44f7-b5a4-f2d6a542797b,Medisafe Pill & Med Reminder,Google Play,5,,Great app for medicine intake remind. Now I don't have to try to remember the last time I took the medicine or worry about the next intake,kodzo saviour,19.07.2025,us,9.48.2,0
253b3593-28aa-4ec4-8d3a-06927ebff9bb,Medisafe Pill & Med Reminder,Google Play,4,,"This app is pretty, customizable, and overall very awesome and useful.. helps me remember to take my meds, and pretty much everything I wanted in a med reminder, except that there's no way to easily print the current med list to bring with me to the doctor.",Christa Segers,19.07.2025,us,9.48.2,0
7c28714d-15d9-4f6e-9ff5-e9631afe9516,Medisafe Pill & Med Reminder,Google Play,5,,"Does a great job. Initially only gave 4 stars because the reminders we a bit unpredictable, but easily accounted for by setting an alarm a minute earlier in Android itself. Now the alerts seem to have been fixed, so one extra star.",Jon Slack-Smith,19.07.2025,us,9.48.2,0
a2bc9894-e5fb-49d7-acae-1350d22f5e27,Medisafe Pill & Med Reminder,Google Play,5,,все прекрасно. посоветовал вас джипити) не ошибся,Алис такая-то,18.07.2025,ru,9.48.2,0
68e1d2ea-c90d-400c-aac1-25d69a8bc0be,Medisafe Pill & Med Reminder,Google Play,5,,I love it very good app,Morris Abraham,18.07.2025,us,,0
7fbf06dc-510a-4154-96d5-f556b71fd5c2,Medisafe Pill & Med Reminder,Google Play,5,,Sehr zuverlässig und hilfreich,Rolf Strohbach,18.07.2025,de,9.48.2,0
aed60bef-17fb-4961-a72f-08f2bda171de,Medisafe Pill & Med Reminder,Google Play,5,,There is no chance of forgetting your medication with this App. Reliable and easy to use. A must for anyone taking regular daily medications.,Jay Bee,18.07.2025,us,9.48.2,0
593572ee-c6cd-4745-a434-1996598bf321,Medisafe Pill & Med Reminder,Google Play,2,,"Приложение предназначено для напоминания. Но оно не напоминает! Вопрос - зачем такое приложение? Все танцы с бубном были исполнены: включен автозапуск, исключено из экономии энергии и т.д. Вообще приложение должно быть полнофункциональным, а не требовать дополнительных действий. Остаётся только догадываться, какие ещё ритуальные обряды нужно выполнить, чтобы оно заработало?",Basso Ostinato,18.07.2025,ru,9.48.2,0
89211d4c-9d1c-4d7e-8132-788594bbdac3,Medisafe Pill & Med Reminder,Google Play,5,,The app rocks. I use it everyday. I like that you can mark that you've taken individual meds but not all of them and it will still send you reminders to remind you to take the rest. I like that!,Laura Lewis,18.07.2025,us,9.48.2,0
7d462f69-5042-4266-be38-8be602beb9f4,Medisafe Pill & Med Reminder,Google Play,5,,"Fantastic app to not only remember to take meds, but to have a list of meds and supplements to list off to the doctor when I go!",Andrea A,18.07.2025,us,9.48.2,0
85fdd445-6ee0-4197-b61a-b984df4e714b,Medisafe Pill & Med Reminder,Google Play,5,,Very useful for me to keep track of the various meds I need throughout the day. Helps to ensure that I take what I need when I need it. Customization and additional health information such as potential negative med interactions are great to have.,Lisa Schreiber,18.07.2025,us,9.48.2,0
5cec230d-af95-4241-a240-2a58f06f47c2,Medisafe Pill & Med Reminder,Google Play,5,,отличное приложение. при приёме таблеток пользуюсь только им. меню осень понятное и доступное.,Юлия Вчерашнева,18.07.2025,ru,9.48.2,0
