ID,Название приложения,Магазин,Рейтинг,Заголовок,Содержание,Автор,Дата,Регион,Версия,Полезность
12019038134,Bearable - Symptom Tracker,App Store,5,Best app on my phone,"I never thought about how I can use my phone to help me manage my chronic illness. This tool is invaluable. It allows me to track my symptoms because Bearable makes me want to come back and fill it in. I love it because of how awesome the insights are. It generates weekly reports on all kinds of things (mood, symptoms, sleep quality) as well as longer reports. This helps me communicate my needs with my doctors. I also use it as a way to remember to take my medications!",MacJett13,03.12.2024,us,1.0.530,0
12017828126,Bearable - Symptom Tracker,App Store,5,Game changer,This app is amazing! It’s been a game changer for my drs appts. It’s wonderful to have data to show progression of symptoms and to track effects on my health. My drs are now recommending it to other patients!,PZ1717,02.12.2024,us,1.0.530,0
12017455930,Bearable - Symptom Tracker,App Store,5,Dream app,"For years I dreamed of an app that would help me track all my disparate health issues. This is efficient, cute, and friendly. I’ve recommended it to two friends with very different post-Covid heath issues and they both found it helpful. It’s great to prepare for doctor’s appointments.",Treetalker99,02.12.2024,us,1.0.530,0
12015654998,Bearable - Symptom Tracker,App Store,5,Excellent App!,"I am a picky app user and it takes maybe 10 minutes of exploring and I know whether I will use it or not - most get deleted.

The evening I downloaded Bearable, I found it easy to dive into which I did enthusiastically!

So relieved to have somewhere to document and track these myriad symptoms! No more carrying them in my scared and confused brain!

Such a relief.

I am a newbie, beginning to learn about trends & what affects my health.

The developer emailed contact info inviting questions I may have! I just might! Yet the app is user friendly, being intuitive, so further exploration on my part may remedy possible questions.

I wondered, who developed this excellent tool? Someone who also experiences the scary and mysteriously baffling world of Autoimmune Disease.

From the bottom of my heart, Thank you for reaching beyond illness to share with others this tool you initially created for yourself.    
This app has given me the first experience of having some measure of control and understanding  over my definitely but not specific diagnosis (so frustrating!)

I am not alone.",knitgnat,02.12.2024,us,1.0.530,0
12003544140,Bearable - Symptom Tracker,App Store,1,Confusing,I had this app for less than 5 min before deleting it. It doesn’t tell you how you use it.,Leapfrog83,29.11.2024,us,1.0.530,0
12001985855,Bearable - Symptom Tracker,App Store,5,Self-Acountability,"I recommend browsing the Bearable subreddit, or possibly their discord prior to set-up.

 I personally set mine up kinda Willy-Nilly in the beginning, and while still acting as a  good self-accountability tool, I was not using the features of the app to my fullest advantage. After I saw what others were doing, it really gave me better framework for setting things up to BECOME what would be utilization of the features to my full-advantage. So that was very helpful!

Left to my own devices, I nearly can NOT will myself to do the most basic of tasks. But caring about maintaining my insights accurately has truly added that little “oomph” I needed to hold myself accountable. 

I am stoked to move forward and see if my mental health improves as a result of accountability. More so than that, I am eager to draw a line between my actions and my state of being.",Icameasgold,28.11.2024,us,1.0.530,0
12000048186,Bearable - Symptom Tracker,App Store,4,Life changing,The #1 best app for people who need to track their health for chronic conditions. Bearable is customizable to your particular new so you only have to track what’s important to you. The generated insights make it easy to know how to maximize good days and prevent bad ones.,Morgan_730,28.11.2024,us,1.0.530,0
11989218231,Bearable - Symptom Tracker,App Store,5,So helpful in understanding and coping with chronic illness!,"Since I was diagnosed a year ago, I've been using this app. It has helped me to distinguish between the symptoms of my condition and the side effects of the powerful drugs I take to treat it. For example, the app syncs with Apple Health so I can see patterns between my symptoms, the meds, and how well I sleep. I use it at the end of the day to rate them and then the app analyzes and reports weekly on what factors most affect my mood, symptoms and sleep. I especially appreciate the new Self discoveries section where I can reflect on what improves or triggers my symptoms, all supported with ""hints"" of correlations and trends from the data I have recorded. This app has helped me learn what affects my condition and gain a sense of agency to live well with it. Thanks Bearable devs!",FormerWonk,25.11.2024,us,1.0.528,0
11979387105,Bearable - Symptom Tracker,App Store,5,Simply amazing!,"Have been using this app for a while. Love how easy it is to customize and use. Wish the sleep section were able to record multiple sleep intervals and combine those as total sleep for the day, but other than that no complaints.",SailingSmitty,22.11.2024,us,1.0.528,0
11962768478,Bearable - Symptom Tracker,App Store,5,This App Can Save Lives,I just downloaded it but I know already this is the best app to track your health!,@CabeAmornaMochila,18.11.2024,us,1.0.528,0
11961519814,Bearable - Symptom Tracker,App Store,4,Definitely helpful,"This is the most customizable health app I’ve come across. Even using the unpaid version there are so many options and factors to track if you choose.
So far the only feature it doesn’t have that I really need is the ability to input side effects from specific medications. I don’t want to track side effects under the symptoms categories because it becomes too confusing to differentiate and make informed decisions about medications.",gabrielle27,17.11.2024,us,1.0.528,0
11955048867,Bearable - Symptom Tracker,App Store,5,so helpful and thoughtfully made,this is the tracker I have been looking for! I love the breadth of symptoms and lifestyle factors you are able to track. the design is intuitive and good looking. I feel like this app understands me. thank you!!,voteforeleni,16.11.2024,us,1.0.528,0
11942125591,Bearable - Symptom Tracker,App Store,5,Best health tracking app. Worth the money,"Small team of developers working on this app, that really care and it shows. Been a subscriber for a few years now, I’ve lost count but could check the app to know for sure :)

I used this app to help me figure out the source of migraines and it led me to getting a late diagnosis for adhd. It was really helpful having so much data to show my health care providers to support what I’ve always known intuitively.",Bread Pirate,12.11.2024,us,1.0.527,0
11940317616,Bearable - Symptom Tracker,App Store,5,Love this app!,Great app. Super thorough and easy to customize.,Ishymyfishy,12.11.2024,us,1.0.526,0
11938053865,Bearable - Symptom Tracker,App Store,5,This app is the best I’ve found….,"Being diagnosed last March with RA, OA and Fibromyalgia my life went completely upside down and I didn’t understand what was going on with my body AND my mind/brain! I started writing every down but that was complete agony on my fingers and shoulders so I had to quit. Well scrolling on FB I saw a Reel for this app so I checked into and and downloaded it (one day I pray I can pay for 1 year premium!!!!!) this app is a life changer for ppl with chronic pain and 3 autoimmune diseases and getting worse! TRUST ME YOU WANT THIS APP! My pain management Dr was happy to hear of this app and that I have it! I have told others of it and they thank me!!!!",Shan-Trouble,11.11.2024,us,1.0.526,0
11935739974,Bearable - Symptom Tracker,App Store,5,Really insightful,Trying to find the discipline to track has been the hardest part the app helps simplify things and stream line the process can’t wait to see what else I learn about myself from this app,Raekoz,10.11.2024,us,1.0.526,0
11922519073,Bearable - Symptom Tracker,App Store,1,Poorly Designed,"Bearable could be great app, but they won’t listen to users about designing gen flaws that make it unusable. I couldn’t remember whether I signed in with Google or email and password and am now stuck on the privacy agreement page. The app doesn’t reset to the login/Home Screen on force quitting or even on uninstall! I can’t use it, and I can’t get past the gatekeeper who doesn’t understand the problem.",Brillianteden,07.11.2024,us,1.0.526,0
11920863420,Bearable - Symptom Tracker,App Store,5,Wow!,So in depth. An easy way to figure out your body!,Marrzia,07.11.2024,us,1.0.525,0
11915682289,Bearable - Symptom Tracker,App Store,3,Lots of potential but not quite there,"I have been using this app every day for 4 months now. It has been ok for keeping track of things (although I’d like to track my symptom onset time with more specificity than 6 hour blocks), but not great for insights. First of all, their correlations grid does not give correlation values, and while that probably doesn’t bother most people, the results and conclusions can be misleading. Also, the 6 hour blocks in which things are tracked make it impossible to discover / distinguish for example migraine symptoms vs. migraine warning signs vs. migraine triggers because I don’t know in what order they happened, just that they all happened in “MID”. The data will still be good for analyzing other larger daily patterns though, like whether my migraines are related to allergies. ~~ I finally downloaded all my data to analyze it myself, and discovered there’s no way to get *all* of your data because it doesn’t export when you marked a symptom as “none” (even they know that unmeasured is not the same as 0, which is why their “Insights” analysis page encourages you to mark symptoms as none when they’re not active instead of leaving them blank). I tried to ask about how to get all of my data using the “Ask support” button under FAQs, but the button doesn’t work. I tried to report this as a bug, but it turns out the “Report a bug” button doesn’t work either 🤣",sweetnsour1826,05.11.2024,us,1.0.525,0
11909219970,Bearable - Symptom Tracker,App Store,5,Love it!,This has helped so much. Love the symptom pattern recognition I’ve been doing this manually for years. Wish it had a widget for the home screen though. Thats my only complaint.,lavendermoonrise,04.11.2024,us,1.0.525,0
11905728019,Bearable - Symptom Tracker,App Store,5,Surprisingly detailed,"I love this app because the free version is surprisingly detailed! Also, the options for a range as the answer, as opposed to a yes/no, makes this app unique from most symptom tracker apps I’ve used before. This app is obviously designed for us chronic health/pain having people with several co-morbidities which is super rare and for that I’m grateful!",Echo Starre,03.11.2024,us,1.0.525,0
11896733274,Bearable - Symptom Tracker,App Store,4,"Good, not close to great (yet)","I think this app is the best in its class, but I think it still has quite a ways to go before I would consider it a great app. So many little (and big) things that make you scratch your head at how the app has gone so long without x feature. 

One big redeeming factor is the free tier is decently generous, and I think the discounted yearly price (which is offered like 24/7) is reasonable.",Thompsons Gazelle,31.10.2024,us,1.0.524,0
11893870244,Bearable - Symptom Tracker,App Store,5,Best I’ve used,Hard to overstate how great this feels to use. I’ve just started and it feels very intuitive and has so many customizable features. Highly recommend.,The Omega Necro,31.10.2024,us,1.0.524,0
11872628291,Bearable - Symptom Tracker,App Store,5,Lovable Bear,"There are a great base of options to start tracking your health well. Then you realize just how customizable this bear is, helping you track any condition you are experiencing. 🤍☑️",nycbone,25.10.2024,us,1.0.524,0
11865873474,Bearable - Symptom Tracker,App Store,5,Amazing,"This app is awesome. The one thing I needed that was missing, I emailed the devs about and a month later it was in the app. That’s incredible and I’m extremely grateful.",MatthiasIam,23.10.2024,us,1.0.522,0
11851352678,Bearable - Symptom Tracker,App Store,1,Used to love this app but for probably over a year now it just crashes,"Thought it was because I do betas, but even when I'm on a public release, it just crashes on startup. 

I have reinstalled countless times and it only ever crashes. 

Really really disappointing.",uhauljoe,19.10.2024,us,1.0.522,0
11830454764,Bearable - Symptom Tracker,App Store,5,"Easy to customize, easy to use","I use the app to stay on top of a chronic illness. I started with the free version, tracking all my symptoms, meds and possible triggers. Then I paid for a subscription, because I wanted to support this remarkable resource. Now that I have a better understanding of my illness, I’ve streamlined my usage so I can track symptoms and meds with just a few clicks each day. Bearable is a lifesaver!",IN User,13.10.2024,us,1.0.521,0
11829610094,Bearable - Symptom Tracker,App Store,3,How to use,I’m still not sure how to use this for the greatest benefits.,Great Sleep 2023,13.10.2024,us,1.0.521,0
11827561107,Bearable - Symptom Tracker,App Store,5,"Customizable, pro is reasonable price",Best app I’ve seen that can track all the health things in one place. And the pro version is so much more reasonably priced than most apps that do way less. It’s been so useful for me and a positive experience.,twentyseven111,13.10.2024,us,1.0.521,0
11821429737,Bearable - Symptom Tracker,App Store,3,Health Tracker for General Wellness,"This health tracker is a great option for individuals without severe health conditions, such as cancer, as it doesn't offer comprehensive coverage in this area and the pain tracking feature may not be effective for those of us with cancer. However, it excels in other aspects and is an excellent choice for those without such specific needs. 🧡🎗️🧡",LeukemiaSuckz,11.10.2024,us,1.0.521,0
11795211398,Bearable - Symptom Tracker,App Store,5,Fantastic App!,"I have a chronic health condition as well some behaviors I’m trying to change. This app really helps me keep track of what I’m doing so I can make adjustments and refine what works for me. On another note, this app is beautiful! Kudos to your UX Designers and developers!",Severman,04.10.2024,us,1.0.519,0
11764245716,Bearable - Symptom Tracker,App Store,1,App Is Broken,"The app nav bar is in the unsafe area around the notch, I cannot tap menu or back button etc.",Kettleandstring,25.09.2024,us,1.0.519,0
11761647463,Bearable - Symptom Tracker,App Store,5,Amazing,"Very helpful and insightful, I ended up purchasing premium!",Ivyjane420,25.09.2024,us,1.0.519,0
11753465669,Bearable - Symptom Tracker,App Store,5,Perfect,"I have had the honor of using this app since they first launched it, before the paid subscription. It has been worth every penny and so much more. The developers are always listening and making it better and better. I honestly can’t think of any negative issues  I have ever had with the app. I have chronic conditions and it helped my doctors finally diagnose an autoimmune disease. I have been able to manage symptoms and navigate away from certain conditions that makes it worse. This has changed my life. It is awesome. This app is a lifesaver. Everyone should use it.",CorvetteTaylor,22.09.2024,us,1.0.518,0
11739869700,Bearable - Symptom Tracker,App Store,3,Life saver!!!,"I LOVE this app!!! It has seriously made keeping track of my laundry list of health problems so much easier. It’s also helped me improve other areas of my life that I didn’t anticipate when I first downloaded the app, I feel so much more aware and on track with the things in my day to day life. My lifestyle habits have improved, I am able to keep track of everything my doctors need, and I have found correlations in my habits and health that have made me more aware/able to improve my health! Aside from that, it has taken SO much stress out of my health tracking due to it being easy to use, insightful, and reliable. I would recommend this to anyone looking to improve their well being! 

The only reasons I gave this app 3 stars are;

1) The app isn’t the best when you are stuck behind a paywall. After paying, the app is stellar! I just hate subscriptions though and I wish I could pay once and be done with it. I don’t mind paying to support the creators of such a great app, it’s just not ideal that I am going to need to budget over $30+ for this for years. Considering that it’s a yearly payment instead of a monthly, that does help! However, as a girl on a tight budget, it’s not the easiest for me. 

2) This app doesn’t include menstrual cycle tracking, which would be SOOOO incredibly useful! My cycle/hormones have a BIG affect on my other health problems. It’s hard to keep track of the correlations between my health problems and where I am at in my cycle, and it would save me a lot of time if Bearable had a cycle tracking section that could show insights and correlations to/with everything else I track in the app. I use Stardust instead for cycle tracking (awesome app btw) but it is time consuming and somewhat difficult to go through each app and dig through entires to find correlations. I would feel much better about paying for this app if it included cycle tracking (especially since it affects around 50% of the populations health).",Kennedy Orange,19.09.2024,us,1.0.518,0
11693120485,Bearable - Symptom Tracker,App Store,1,Sadly Cannot Enjoy,The app is actually really helpful but the steep cost and short trial time really screwed me. I was in and out of the hospital and my stepsister downloaded it for me to help with my CHF symptoms… wasn’t able to keep track of cancelling it and im out my money. I was unable to get a refund. Really steep cost for a time where everything counts. Wish someone could help,dibmembrane,06.09.2024,us,1.0.518,0
11688262668,Bearable - Symptom Tracker,App Store,5,Awesome,Very helpful in seeing trends in my Long Covid.,nursnan,04.09.2024,us,1.0.518,0
11685971953,Bearable - Symptom Tracker,App Store,5,Customizable!,Easy to track custom made symptoms.,LesyaGTC,04.09.2024,us,1.0.518,0
11681471144,Bearable - Symptom Tracker,App Store,3,Can only track 2 pain symptoms,Not good for tracking multiple pain areas.,PhishyMama,02.09.2024,us,1.0.518,0
11678680647,Bearable - Symptom Tracker,App Store,1,Not free,Have to pay to use it after 7 day trial wish it said that up front before I gave them all my info 🤦🏼‍♀️,mel2cool4u,02.09.2024,us,1.0.517,0
11673023133,Bearable - Symptom Tracker,App Store,5,Great for keeping track of daily activities,"I have been using Bearable to track my water intake, sleep, medication, mood, and symptoms. I love how I can track various things without having to use multiple apps or pay extra.  Even without the subscription this app is amazing and worth downloading. It would be nice if they could add a widget for the iPhone home screen or lock-screen. Other than that this app is user friendly and colorful and I look forward to using it everyday. 🤍",Arctozolt,31.08.2024,us,1.0.517,0
11662763038,Bearable - Symptom Tracker,App Store,4,Great app but badge notifications not working,"I just paid for this app to track my medication, symptoms, moods, etc. It’s great for tracking as I get the hand of it.

However, I’m not getting the badge notifications (yes, they’re enabled on my settings). I get the initial notification but without the badge notifications for my medication, I forget to do it.",Eleasha_00,28.08.2024,us,1.0.517,0
11648626029,Bearable - Symptom Tracker,App Store,4,I love this app,I have Lupus and it has been hard to keep track of my symptoms. Not only does this app keep track of it. It also shows you trends. Helps you take control of your chronic illness. I love this app.,FrannyJM,24.08.2024,us,1.0.517,0
11604321462,Bearable - Symptom Tracker,App Store,5,Life changer,"I was very nervous at first. Since a lot of these apps say one thing but don’t entirely have what I need. I knew I needed something less generalized and vague but couldn’t put my finger on it until I saw a Instagram ad for this and was like “that might be what I’m looking for “ 
Surprisingly it is. Especially with my heart condition to my hormones being wack. Tracking it and having more detailed options help me organize and manage clearly. 
It even helped when I tried advocating for myself at the doctors with proof I’m not being dramatic.",Hattie1298,13.08.2024,us,1.0.515,0
11586350504,Bearable - Symptom Tracker,App Store,5,The Best Health App,This app is ANAZING! So many features and I’m still on the free version. This has helped my physical and mental health so so much. I’m suggesting this app to everyone I know. Especially if you are chronically I’ll and/or disabled.,Dippin Pippin,08.08.2024,us,1.0.515,0
11564800982,Bearable - Symptom Tracker,App Store,5,So far so good,I’ve tried a few similar apps but so far this is my favorite. Easy to use while still able to track a lot of different things.,Lizzy405,02.08.2024,us,1.0.513,0
11561082140,Bearable - Symptom Tracker,App Store,5,yes!,completely worth the money as someone with chronic health issues :) amazing!,Sarahhhhhhxx,02.08.2024,us,1.0.513,0
11560836720,Bearable - Symptom Tracker,App Store,1,Mehh,"Besides the “Upgrade” feature, if you go with free app it seems to go based off inky what you put in the intake forms. Wasnt able to change or add symptoms which defeats the purpose of the app. My symptoms are all over the place so if I can only pick from limited choices theres no point.",AddyMM,01.08.2024,us,1.0.513,0
11545307429,Bearable - Symptom Tracker,App Store,1,Can’t create account,"I tried two different email accounts and the confirmation emails never came. Can’t even sign in without confirming. I am choosing to use my email instead of the Apple, Google, or Facebook log in.  Never had this issue with any other apps.",J9ssica,28.07.2024,us,1.0.512,0
11530186754,Bearable - Symptom Tracker,App Store,4,Really good but missing symptom correlation with food,"I’ve been searching for a good symptom tracker app for years and this comes pretty close. I love that you can track so many different things (exercise, caffeine, sleep, mood, physical symptoms, and so much more). However, I really need an app that will correlate symptoms with the food I eat. If that feature gets added I will definitely subscribe again!",Teeetwo,24.07.2024,us,1.0.511,0
11519943952,Bearable - Symptom Tracker,App Store,5,This is good,"For a mood tracker I really like this app. It hard to get a habit out of it but that’s a me thing lol!! I like that it tracks your mood out of 1 - 10 scale because for me it’s easier to be honest with myself by picking a number than saying good or okay or bad (cause we are all normalized to saying “hi I’m good” even if your not) I like that it tracks medication and when you take it I would use this but instead I text myself that I took my meds because that’s more automatic to me. Also the symptoms are a big thing!!! I enjoy that you can add different things to track, though I wish I gave you ideas because sometimes I want to track things similar to energy for example but I don’t know what I could put. They put an update it recently and I like it!! I looks more new and modern. The one thing I wish they had a better grip on is the design because I know I would be more encouraged to use it, it feels kinda bland if that makes sense :) that’s not a big deal whatsoever just a suggestion to make it even better! This is the best app I found for mood tracking the is compatible with how my brain works!!",Saruh2swag,22.07.2024,us,1.0.511,0
11507636532,Bearable - Symptom Tracker,App Store,5,I love this app!,"This app has already been a huge help in managing my PTSD symptoms, it’s great to see that even on tough brain days the bad doesn’t last for ever, and it’s an amazing way to see what works and what doesn’t to help me feel better- can’t recommend enough!",EdTeachCrow,18.07.2024,us,1.0.509,0
11499546064,Bearable - Symptom Tracker,App Store,4,Give this app a try!,I’m very happy my therapist recommended me this app. I’m 19 and have an autoimmune disorder and mental health issues and I tend to just ignore my symptoms and deal with it but it is nice that I can review my progress and aim for positive goals. Just give it a try!,Kinzie.exe,16.07.2024,us,1.0.507,0
11466734178,Bearable - Symptom Tracker,App Store,5,Perfect,I was about to investigate ways to design my own chronic illness app until I found Bearable. It does exactly what I want and is so customizable. I love how easy it is to input important health data and remove things I don’t need to track. I highly recommend even if you are only tracking a few key symptoms.,Sydyrae,07.07.2024,us,1.0.506,0
11462720221,Bearable - Symptom Tracker,App Store,5,Great app!,Have been absolutely loving this app. It’s extremely useful for someone with undiagnosed chronic illness(es).,Chawitte,06.07.2024,us,1.0.506,0
11457080024,Bearable - Symptom Tracker,App Store,5,Extremely helpful,Excellent for tracking lifestyle and symptoms. It is especially helpful with tracking my auto immune issues. I highly recommend it. I am also very grateful it is affordable.,Abcd28!,05.07.2024,us,1.0.506,0
