ID,Название приложения,Магазин,Рейтинг,Заголовок,Содержание,Автор,Дата,Регион,Версия,Полезность
10583141892,Bearable - Symptom Tracker,App Store,5,Revised Review - Amazing Support. Great app.,I love this app. Support is speedy and the app is thoughtfully laid out. I had an issue with the app freezing which the developer fixed in under 12 hours. A week later and it’s working perfectly fine.,Aaronjbach,14.11.2023,us,1.0.473,0
10579806133,Bearable - Symptom Tracker,App Store,5,Best app for chronic conditions.,I think my favourite part about bearable is the experiments tab.,saucisquip,13.11.2023,us,1.0.473,0
10576448527,Bearable - Symptom Tracker,App Store,5,Excellent - 5 stars,"This app replaces three others I had, is much smoother to use, and includes easy to document, easy to access details. You can individualize your information in endless ways and it has genuinely helped me have a better quality of life.",Rikenazu,12.11.2023,us,1.0.473,0
10570335681,Bearable - Symptom Tracker,App Store,5,Concept is Life Changing,Excellent product built on vision to improve quality of life.  I’ve seen dramatic results in last 6 weeks simply due to the awareness and discipline of tracking mood etc.  Support team was very responsive in helping me resolve a technical issue.   Probably an abundance of similar tools - of the ones I tried - I liked this the best.,Gregggers,10.11.2023,us,1.0.473,0
10560089338,Bearable - Symptom Tracker,App Store,4,Great!,I just downloaded this app to help me take better care of my self care as well as be able to track my mental health and boost it up with the progression of time. I would love to be able to have a widget so i can see some of my goals/tasks that i need to get done!,Mojom00n,07.11.2023,us,1.0.473,0
10540345572,Bearable - Symptom Tracker,App Store,4,Worth every penny,"If you’re like me and you’re dealing with health problems, you’re probably doing so many things all at once just to see if something helps and find some relief. Medications, exercise, therapy, fill in the blank. And then you experience a setback and you think “Are any of the things I’m doing even helping? Am I making any progress?” This app takes care of that for you. The premium version is so customizable. You can input any habit, activity, symptom, medication, etc. that you want. And the automatic correlations that the app finds between your habits and outcomes is so helpful. I’ve only been using the app for two weeks, and I can already see that when I go for walks, my weird leg pain improves. So that motivates me to go for more walks. I probably wouldn’t have figured that out on my own because there are just so many variables that go into my day. It’s just little things like that, and having that knowledge, that makes a huge difference in your health journey. I’m withholding one star because wish I could track my cycle. I manually created factors for each phase of the cycle, but I wish it was a built in feature. Our hormones really have a huge impact on every aspect of our life, and it would help me and a lot of women to have that data. And it’s something we could easily show our GYN too for them to be able to say “yeah, that’s normal,” or “you get extremely depressed when you’re menstruating, that’s not healthy and we need to look into that.” But other than that I love the app and know that it’s going to be very beneficial the more I use it.",@katiemowery,02.11.2023,us,1.0.472,0
10538186360,Bearable - Symptom Tracker,App Store,5,One of the best I've found,"With a long-term, chronic condition that really needs a lot of tracking to see patterns and to discern what is helping, Bearable is about the best app around to track EVERYTHING in one place.  Even the free version is very robust, so you can really use it and not just try it out. I really appreciate this app.",stumplm,01.11.2023,us,1.0.472,0
10512508197,Bearable - Symptom Tracker,App Store,4,I LOVE this app,It’s very useful and very helpful. My problem though is with the insights section. It doesn’t seem easy to read and it’s just very confusing in general. I think it has improved lately but I still have some trouble with it. Maybe I just need an update how to read them?,CurlyButtTomatoNose,25.10.2023,us,1.0.472,0
10507277162,Bearable - Symptom Tracker,App Store,1,Lacks cycle tracking,"Useless without menstrual cycle tracking. Need ability to see days since start of last period, phase, and ability to correlate factors to the phase",TeamSpacer,23.10.2023,us,1.0.472,0
10499661404,Bearable - Symptom Tracker,App Store,5,couldn’t ask for a better app,"i was recently hit by a car… would not recommend. anyway, my mental and physical health have been at lows, and i was looking for a way to track how i’m doing and how my habits affect my health. this app has been perfect for that, i love it so much!",lilsgraces,21.10.2023,us,1.0.472,0
10483107756,Bearable - Symptom Tracker,App Store,5,very thorough,"it has pretty much everything I need in one place and there are multiple different ways to add details that can help capture symptoms and factors thoroughly. I like the scales, situational factor options, and notes sections.",E 7724,17.10.2023,us,1.0.472,0
10475307058,Bearable - Symptom Tracker,App Store,5,awesome app,i’ve been using bearable for over a year and it’s a great way to keep track of my symptoms and keep an eye on trends. my only request would be to add a feature where we can upload photos in the notes section that way we can record if one of our symptoms is visibly worse than usual.,edimi0711,15.10.2023,us,1.0.471,0
10466115608,Bearable - Symptom Tracker,App Store,5,"Able to track pollen, food and more","Great ap! Easy to use and I can track things like pollen, mold, food and fatigue for histimine intolerance. Thanks! And love the reminders","iPhone183&-""@",12.10.2023,us,1.0.471,0
10455593027,Bearable - Symptom Tracker,App Store,1,Not a good food tracker,"I’ve been trying multiple apps to track food, symptoms, and medications. This one seemed like it had all these features but it doesn’t let you track basics like protein, fat, and carb intake. 

It has all these weird things to add to the foods, like high sodium, high protein, little eaten, etc. but nothing that makes it easy to track actual meals and correlation to symptoms.",JuniperMarie,09.10.2023,us,1.0.470,0
10450228406,Bearable - Symptom Tracker,App Store,5,I love this app,Trying to maintain my weight while on Wegovy and correlating symptoms and dosage is easy with this app. It’s so informative,sssssarah,08.10.2023,us,1.0.470,0
10446817699,Bearable - Symptom Tracker,App Store,5,I love this app! It has everything!,"I love the Bearable allows me to track physical and mental health symptoms all in one app, as well as to track and remind me to take medications, and also has gratitude journaling built-in. The ability to view graphs of my symptoms and create experiments to see what is working and what isn’t has been invaluable. I recommend this app to anyone living with any sort of diagnosis, especially if you have multiple like I do.",Cococat54321,07.10.2023,us,1.0.469,0
10434913496,Bearable - Symptom Tracker,App Store,4,Widget,Bearable is awesome to keep track of mental health. Wish the app had a cool WIDGET!!,BearableUser,03.10.2023,us,1.0.469,0
10431190415,Bearable - Symptom Tracker,App Store,5,Intuitive!,"I haven’t used this for long but it’s the first time I’ve felt like tracking a lot of information about my health and wellness is pretty easy to do. It’s very customizable so you can stay general or get really granular if you want, and it also has a few different ways to interpret the results which makes it easy to understand. Looking forward to what I find out once I have more data!",chaosdonkey87,02.10.2023,us,1.0.469,0
10409571297,Bearable - Symptom Tracker,App Store,2,Dark-pattern Onboarding Process,Makes you fill in numerous personal details and once it’s all done it finally tells you the pricing (which is high). It should tell me the pricing at the beginning.,Oliver773134,26.09.2023,us,1.0.467,0
10409431905,Bearable - Symptom Tracker,App Store,5,Download it. It’s incredible.,"I never write reviews when they ask for it. I’m sick. I don’t have the time or energy to write reviews. If you’re here reading this review, I’m sure you’re in the same boat. You’re sick too. You are weak and tired too. You don’t have time or energy. But this app is incredible. It doesn’t take time. It saves time. It makes time. It makes joy. It makes ease. It makes me smile. It has a bear on it. Trust me. It’s well executed and brilliantly thought out, even the free version which is what I’m using. I’ve used it for a week and even with my cognitive impairments it’s incredibly intuitive and easy to use. I LOVE it. Genuinely. It’s so easy to use, to customize and personalize, to track, to make your own for any and all your health needs. I’ve shown it to everyone. In one week it’s made all 3 of my doctors appointments go so much smoother. It’s made taking and tracking all 15 daily medications go by so much easier. Tracking my food too to make sure I eat despite forgetting and the nausea and the appetite being gone. It has the ability to remind you to do things. Take medicine for example. Tracking my many symptoms too. Even the little gratitude tracker is a nice bonus. And the mood tracker is a nice bonus to have me consciously think about how I’m feeling emotionally not just physically. All of it is brilliant. I love that I can add in my own symptoms and my own emotions, for when I feel ennui or emotionally energized or on fire or proud, or symptoms like ‘senility’ or other things that don’t come pre-set. It’s all just so incredible and I could go on and on. I wish I could pay for it to use all its goodness but the free version is nice too. Just to track what I do. Do yourself a favor and just download this, if there’s anything at all up with your health. Yeah, just do it. Make yourself beary happy.",Bellamichellea,26.09.2023,us,1.0.467,0
10392696172,Bearable - Symptom Tracker,App Store,1,Disgusting,"The most disgusting, unholy example of a modern 2023 subscription based app gone wrong. Main feature of this app (correlation based “insights”) can’t even be used without paying. Every nook and cranny filled with nagware, “Upgrade now!”, “Get pro”! Ewwww.",カズハ！,21.09.2023,us,1.0.467,0
10388704496,Bearable - Symptom Tracker,App Store,5,Best symptom tracking app for chronic illness,I’ve been using this app for months now and I’m a big fan. The team behind it is super responsive (check out their discord) and the design is really thoughtful. It’s helped me figure out what might be causing issues and I love that I can create an “experiment” when I start a new medication to see how it’s impacting me. Highly recommended.,Adrosss,20.09.2023,us,1.0.467,0
10385787290,Bearable - Symptom Tracker,App Store,5,Symptom tracking made easy,"Love this app for symptom tracking! I have long COVID and CFS and Bearable helps me manage my health and figure out which foods, medications, and pacing strategies are the most beneficial for me. Premium is definitely worth it for the customization and advanced analytics. The devs are very responsive and are constantly improving the app which is great.",jubilee_juice,19.09.2023,us,1.0.467,0
10381441198,Bearable - Symptom Tracker,App Store,5,Helpful for chronic illness,"I have been trying to track all the factors, symptoms, and nutritional needs for my chronic illness by hand for months. This app makes it so much easier to keep track of everything and provides fantastic insight. I would definitely recommend it.",terimae,18.09.2023,us,1.0.467,0
10375423946,Bearable - Symptom Tracker,App Store,3,Its good! but..,"I like this app, it helps me track my fainting and my joint pain but this app doesnt do much unless you pay for it! most of us disabled folks have a hard time getting extra money due to our conditions anyway so this app is sort of useless.",lauranceisarat,16.09.2023,us,1.0.467,0
10344204836,Bearable - Symptom Tracker,App Store,3,Glitchy,When you try to edit your symptoms and you hit save it deletes them entirely. Did not bother to continue using the app when u couldn’t set it up so the rest of it might be fine…,annacraft3466,07.09.2023,us,1.0.464,0
10330939665,Bearable - Symptom Tracker,App Store,5,Mind blown by this app,"I NEVER review apps, ever. But I downloaded this app last week and have been LOVING it. So far it has met all of my needs and I have yet to identify a feature it is lacking. I am incredibly ADHD and horrible at creating new habits, but there is such a dopamine hit in logging my daily symptoms / factors that it hasn’t been hard for me to keep up with it at all. Also, they make logging things SO easy. I love that there is a Reddit community where the product developers appear to actively be engaging with users, addressing concerns and sharing new features. This is an example of technology being used for good. I am really excited to keep using this app and very happy I found it. I’d give it 10 stars if I could.",galefacekillah,03.09.2023,us,1.0.464,0
10304842690,Bearable - Symptom Tracker,App Store,5,Must have for tracking overall health,"This app is a must. It has all the features and customizations needed to track every aspect of your health from mental to physical to emotional. It can give you insights on how ever small decision of your day can affect even the smallest aspect of your life. And the best part is that it is all free. Yes you can pay extra for them to do all the cross data analysis but you can figure it out on your own. The main thing is tracking and that is all free. Cannot go wrong with this app and I love the overall thought put into the design and feels like the people who built this app genuinely care that people are able to discover hidden things about their health and not just forcing an app out to make money. 

Can’t say enough good things about it. I wish everyone uses it.",Rishabh9508,27.08.2023,us,1.0.464,0
10298946922,Bearable - Symptom Tracker,App Store,5,I have been waiting so long for something like this!,"I have multiple autoimmune conditions and have never been able to find an app, journal, or sheet to help me accurately manage or track my daily routine, life changes, and symptoms. Anyone with chronic illness knows that being able to see the correlations and changes in your lifestyle, medications, etc is everything. For me it’s always been a headache to do so… but honestly this makes it enjoyable and simple for me. I can’t recommend it enough, it’s exactly what I needed!",MadiG13,25.08.2023,us,1.0.464,0
10276061035,Bearable - Symptom Tracker,App Store,5,Highly Recommended,I’m 37 years old and experiencing an unexpected health crisis. Bearable has been such a great tool to keep track of my symptoms and see what is affecting it. A great way to show your doctors what’s going on as well. They make it very easy to watch health patterns and correlations. Definitely worth the small monthly fee.,Lox072311,19.08.2023,us,1.0.463,0
10266927423,Bearable - Symptom Tracker,App Store,5,Highly Customizable,"A great way to track triggers and the benefits of self-care for chronic illnesses. Every symptom and possible correlation you want to study can be typed in and tracked. There’s even reminders and healthy habit tracking. The developer is very responsive and is continually taking suggestions from users to add features. The only negative is Apple indicates that the company collects your identifying health data, which is morally iffy given it’s a paid subscription.",Depression Barbie,17.08.2023,us,1.0.463,0
10261671861,Bearable - Symptom Tracker,App Store,5,Very helpful,I’ve been using this app for several months now. It really helps me stay accountable for taking my medicines and doing simple things like paying attention to how much quality sleep I’m getting. I love the features of this app and being able to add things I find important to my daily routine like taking a shower. This app is really helpful and definitely worth it.,Taisha_93,15.08.2023,us,1.0.463,0
10261058882,Bearable - Symptom Tracker,App Store,5,Love it,I’m really enjoying the gamification of discipline and new insights on correlations between my behaviors.,cmclarke90,15.08.2023,us,1.0.463,0
10254312638,Bearable - Symptom Tracker,App Store,5,"Full-featured, super useful app","I’ve been using this app a few months now and it’s amazing. The comprehensive list of handy features makes me not need to look any further for symptom tracking. It works really well too. I have yet to encounter a bug or app crashing. As far as privacy goes, I appreciate the promise not to sell users’ personal information, because data in this app is especially sensitive. So that’s reassuring. I do see room for improvement with privacy and security, though. First, I don’t see any mention of end-to-end encryption, which I’d prefer. Second, I’d like zero user tracking/profiling using device ID or email address. Thankfully, at least there seems like a way to opt out of device ID tracking.",CaliRya,14.08.2023,us,1.0.461,0
10163765616,Bearable - Symptom Tracker,App Store,5,Simply Amazing!,"I’m only scratching the surface of what this app is capable of.  I’m currently tracking my mood, food, mental health, and my sleep (linked to Apple) all in the app! I’m loving it and I love that you can make it as in depth as you want it to.  There’s so many things you can do that I’m still learning new features! 

Any plans for iPad and/or Apple Watch support?",Jak22e,21.07.2023,us,1.0.459,0
10108653699,Bearable - Symptom Tracker,App Store,5,Comprehensive!,I have been tracking some of this in my journal to share with my therapist but the app makes it so much easier. There are so many options and it’s easy to share the data. I love it,Raesunshine321,06.07.2023,us,1.0.455,0
10101683511,Bearable - Symptom Tracker,App Store,5,Incredibly helpful,"This app is truly a dynamic diary for really anything you want to keep track of. It is so easily customizable and forgiving if you want to make changes. I find a lot of value in recording and keeping track of things in my life. It is helpful for me, but also a thorough way to communicate with other people like a doctor, therapist, coach etc.
My psychiatrist recommended it to me. I have since been using it every day and telling people about it.",gatorsmomm,04.07.2023,us,1.0.455,0
10099248216,Bearable - Symptom Tracker,App Store,2,"Nice app, but no menstrual cycle tracker?",Love this app but it doesn’t have a menstrual cycle tracker and that’s a dealbreaker. Not sure why it has menstrual symptoms tracking but nowhere to track your cycle days. Doesn’t make sense to have to use another menstrual cycle app.,alexr194567,03.07.2023,us,1.0.455,0
10081939918,Bearable - Symptom Tracker,App Store,5,Great,I love this app it is AMAZING ot helped me get my feelings out,hhdbxbdbxndbxbbdxb,28.06.2023,us,1.0.454,0
10076134637,Bearable - Symptom Tracker,App Store,5,Thank You!,Thank you for specifying on the first page of you description that this is for wellness and not fitness! So many “wellness” apps push strenuous exercise it can be frustrating for those of us who do well just walk around the house some each day. Thank you for understanding the difference.,lisabfl,27.06.2023,us,1.0.454,0
10042563350,Bearable - Symptom Tracker,App Store,5,Digital Bullet Journal with Analytics!,"I don’t usually write reviews, but this app has been so awesome. 

It’s like everything I ever tried to accomplish on a bullet journal, but like digital and with analytics behind it.

It’s so EASILY customizable for like my own symptoms and my own stuff, and it’s been so much fun keeping track of stuff. Not to mention the links to the calendar, health, nutrition, reminders, etc. The experiment section is such a bonus. 

If you have any mental health stuff and want to see correlations and just learn about yourself and your habits I recommend 100/10. (Yes, I know there’s an extra 0 😉). 

I’m stoked to see what else is developed. Very very beryyyyy insightful app.",LizzleBear,17.06.2023,us,1.0.452,0
10037061297,Bearable - Symptom Tracker,App Store,5,Amazing,I have been on so many tracker apps and this is by far the best. I actually stay motivated to use it and premium is so worth it. The app is so detailed and personalized and the experiment option to look for correlation is the best part. Only thing that could be better is more accurate time stamps because for some reason mine is in military time,shlynard,15.06.2023,us,1.0.452,0
10019588181,Bearable - Symptom Tracker,App Store,5,Invisible Illness helper!,For starters I rarely if ever review apps - but this one is a life saver for me! I just downloaded this app. Paid for the premium subscription. I’ve been advocating for my health for the past 5 years and FINALLY getting the answers. I love how this is tracking everything for me. And that I can edit and add additional tracking needs! I can stop with the multipliable apps and just use one. I’m only on day 2 and I’m already in love! Thank you for coming up with an awesome app for those of us who are suffering with invisible illnesses! It’s a battle and a fight and having trackers help with advocating for the care we need!,MomOfOneAndDone,10.06.2023,us,1.0.452,0
10018808443,Bearable - Symptom Tracker,App Store,5,Best symptom tracker,It’s a little hard to set up and get the hang of using but very worthwhile once you’ve got the hang of it. I’ve used many trackers and they are either too complex or not flexible enough. I think this app gets the perfect medium.,hyperkitten357,10.06.2023,us,1.0.452,0
10016280913,Bearable - Symptom Tracker,App Store,5,Huge help,I have been struggling with mysterious multiple health issues over the last year and trying literally dozens of treatments and approaches. I could not have kept track of it all and my responses without this tool. My doctors and I thank you!,Annabanana-6,09.06.2023,us,1.0.452,0
9999004405,Bearable - Symptom Tracker,App Store,4,Great app,I’ve been using this app for 3 weeks. It has really helped me understand and visualize my emotions. I would like to see 2 things added. It would be helpful if I could track medication and my period so I could get a better understanding of how these affect me.,Sbeck1978,04.06.2023,us,1.0.452,0
9984247777,Bearable - Symptom Tracker,App Store,1,Not free,"I find it misleading when apps are “Free” but then you get through the initial set up and it’s actually a Free 7 day trial, not really free. Nothing about it is free. I think that should be in the info up front.",itsbridj,31.05.2023,us,1.0.452,0
9981071359,Bearable - Symptom Tracker,App Store,4,Needs iPad support,Very good app. I give it four stars because it doesn’t show properly on iPad.,Tonydakickboxer,30.05.2023,us,1.0.452,0
9969407026,Bearable - Symptom Tracker,App Store,5,Just what I needed,"This is a fantastic app that is easy to use and customize for people trying to sort out how various factors affect the way they feel. Track your sleep habits, diet, physical activity, stress, medicines and supplements, and more—and Bearable builds graphics to show correlations between those factors and various outcomes, like mood, energy levels, body measurements, and whatever symptoms you decide to track. 
Great for people with complex or chronic illness, athletes looking to optimize performance, or people just  interested in keeping better tabs on all the variables playing into their health.",BirdGirlinTn,27.05.2023,us,1.0.452,0
9957097549,Bearable - Symptom Tracker,App Store,5,Perfect for what I need!,This app is perfect for tracking my health and my progress with my moods and anxiety. It’s customizable exactly in the ways I need and has been a big help to me- I use it every day!!!,itsabandjoke,23.05.2023,us,1.0.451,0
9954423636,Bearable - Symptom Tracker,App Store,5,best app for people who struggle to be mindful when it comes to their health,"i really struggle to check in with my wellbeing.  my mind is thinking about so many different things at any given time that often thoughts and consideration of my health is forgotten.  more so, as a kid, i was never taught to take care of/prioritize my health.  things like keeping others happy, healthy, and safe, academic achievement, making money, and just surviving were the priorities i was taught.  this has resulted in my health, both mental and physical suffering greatly despite my young age.  
this app has been an amazing tool in learning how to be more mindful of my body and check in with my health.  thank you bearable team♥️ this app has given me something i have been missing my whole life and hopefully with its help, i’ll be able to find a little more healing and peace",lllllllliiiiiiiiaaaaaa,22.05.2023,us,1.0.450,0
9954048021,Bearable - Symptom Tracker,App Store,5,Life changing!,"I found this after being diagnosed with POTS. I hade four different apps to track metrics, so amazing to have all of them in one AND show correlations over time!! It does everything!",TexasHoya09,22.05.2023,us,1.0.450,0
