ID,Название приложения,Магазин,Рейтинг,Заголовок,Содержание,Автор,Дата,Регион,Версия,Полезность
578f8f1b-ca77-46c5-864f-5408bef1b0a9,Symptom & Mood Tracker,Google Play,1,,"I actually don't have a problem with the app itself, but rather, the lack of response with regards to a requested refund. I've reached out a few times over the last 2 weeks because I'd signed up for what I thought was the 7 day trial on the day my daughter went for surgery, but the overlay text when I'd signed up, signed me up for the annual subscription. I'm requesting a refund, as I'd only been interested in the trial. But I've still received no response on the matter.",Crystal Simpson,05.08.2025,us,7.65,0
92916bd0-fbe9-43d3-b2a4-c559db266cc4,Symptom & Mood Tracker,Google Play,2,,"I purchased the lifetime access to this app and am now regretting it. My streaks have reset on me multiple times; off and on, when I try to change the times on a check in, I'm promoted to purchase premium access (""restore purchase"" does not help); and when I check off reminders, the checks don't stay. The help articles are useless and customer service hasn't replied to my emails. I want my $100 back!",Amber Buck,03.08.2025,us,7.65,0
4976d503-4dd4-4fd9-9c58-3279c46a27f0,Symptom & Mood Tracker,Google Play,1,,complicated,M J,02.08.2025,us,,0
a80bf111-b28d-443d-9373-8172a3e8a3fe,Symptom & Mood Tracker,Google Play,5,,"I need something to help me track my blood pressure meds, my walking schedule, and my chest tightness. CareClinic allows me to review how I feel each week and gives me accurate information about my heart and blood pressure, helping me regulate my body",Hannah Pölloth,30.07.2025,us,7.65,0
9fbdd8f7-85c5-4b84-a407-bf417612c94c,Symptom & Mood Tracker,Google Play,5,,It's 2am and I just used the app to record this weird pain near my ribs. Otherwise I'll forget about it tomorrow morning. A reminder is needed and helps me sleep well.,Alexander Rajam,30.07.2025,us,7.65,0
aaafad33-6508-4b82-8665-8bbd9793d57b,Symptom & Mood Tracker,Google Play,5,,"I have multiple chronic conditions and keeping track of everything used to be a nightmare. CareClinic helps me record my symptoms, medication times and even side effects. The reports are clear and extremely helpful when discussing with my GP. This helps me feel more in control of my health.",Dustin Fox,29.07.2025,us,7.65,0
8e2334a2-8297-4da0-848b-1b879e21c56a,Symptom & Mood Tracker,Google Play,5,,"I love the simplicity of tracking my mental and physical symptoms. I have used this app for anxiety, migraines and sleep disorders. It helps me spot trends and make better treatment choices. The reminders also help me keep track of my medications. It is a lifesaver.",Robert Stephens,29.07.2025,us,7.65,0
b297b9bf-a43a-4ea2-b676-8ec3d00b0271,Symptom & Mood Tracker,Google Play,5,,"Thank you to whoever made this. I have lupus and POTS and almost lost all my data. This app keeps everything in one place. Notes on flare-ups, treatments, mental health, even water intake. I showed the chart to my rheumatologist and she loved it. Really helpful.",Emma Davies,25.07.2025,us,7.65,0
28e2f0d6-ff10-455e-bc53-a7549bc213c4,Symptom & Mood Tracker,Google Play,1,,"Ich möchte mein Kundenkonto und alle Daten löschen, was mir Ihre App unmöglich macht. Beim letzten Bestätigungsschritt angekommen bekomme ich dann die Meldung ""Please try again or tap cancel"". Bei jedem ""try again"" genau das gleiche. Ihr ""App-Help-Bot"" beantwortet JEDE einzelne Frage mit ""I apologize, but I don't have enough information in my knowledge base to assist with deleting your account and data. Please feel free to ask something else I might be able to help with."" Und nun?",Sabine,24.07.2025,de,7.65,0
7255f8a3-ab81-4091-8b49-598dc8c5ea4c,Symptom & Mood Tracker,Google Play,1,,"Website claims it has a cough tracker tool. Turns out it has a questionnaire which asks how bad I think my cough has been, not an automated tracker. So just like any other symptom tracker, many of which are free. This app offers a free 7-day trial, then requires money to keep using. It keeps asking for contact information for my friends and family. It feels like a scam.",Jari R,19.07.2025,us,,0
12735eab-9b5e-45e3-8343-f4d89572bb90,Symptom & Mood Tracker,Google Play,1,,"The app is user-hostile, constantly showing popups that try to upsell you on their subscription. It's also unusable without a paid subscription (very few features are available) which is not too bad in itself (they have to earn money somehow), but it should be possible to learn how little is available before actually creating an account.",Piotr Białecki,19.07.2025,us,,0
ecf274fc-11ca-480e-8e67-5e19851de694,Symptom & Mood Tracker,Google Play,1,,No free option after trial,Tiffany Ortiz,11.07.2025,us,7.1,0
8ae4fd5d-a225-4e4b-b643-62755c0acfa1,Symptom & Mood Tracker,Google Play,1,,"*June 2025 Update-I really love the app and the highly customizable options. I've been a paid subscriber off & on for years, due to budget constraints and less need for the features. Now paid again and none of the features are working–I get an error pop-up every time I add anything other than a med entry. I'd like a refund of my $9.99, if I can't use the app for what I need. I'd also like to get back the time I spent customizing the features for my current health needs, but my $ IS refundable.",Amber Stone,01.07.2025,us,7.1,0
51a28d77-7834-4d91-8b40-d7c30b9c2ddb,Symptom & Mood Tracker,Google Play,1,,STAY AWAY FROM THIS APP - Deleted four months of entries representing countless hours of work to put in. Very unprofessional communication from customer service.,Lorraine Odell (Studio Farrago),26.06.2025,us,7.1,0
90e303b9-1be3-43ab-9a27-85015372fa9e,Symptom & Mood Tracker,Google Play,5,,"I skip days. Sometimes weeks. This app never makes me feel bad about that. When I’m ready to check in again,it’s right there. Feels like it meets me where I’m at. That’s rare.",Alexander Springer,07.06.2025,us,7.0,0
9949639b-09d3-46f7-83e2-442326b3a2e6,Symptom & Mood Tracker,Google Play,5,,"Just want to say, whoever designed this app... thank you. I forget everything. Literally everything.But this gives me just the right nudge without being annoying. I’ve been logging pain and meds for chronic migraines. Already seeing patterns I didn’t know were there.",Kevin Nolan,07.06.2025,us,7.0,0
bf539f38-1cd8-4dff-9f62-60ea2100d7eb,Symptom & Mood Tracker,Google Play,5,,"The little character? Yeah, I smile every time. It’s simple, calm, and kind. I track energy, food, and mood, mostly for PMDD and anxiety.It keeps me grounded without pushing me to be perfect. Not something I expected from a health app.",Blaze9x,05.06.2025,us,7.0,0
d6817b88-e8f6-46fb-ae73-35c9036c8c61,Symptom & Mood Tracker,Google Play,5,,"I have lupus and tracking symptoms used to stress me out more than the symptoms themselves. This app doesn’t overwhelm me.I log pain, mood, meds, and sometimes just how my day went. It helps me notice flare patterns I was totally missing. Free version goes a long way too.",Adolp Anderson,05.06.2025,us,7.0,0
93a48880-b650-4ce1-abc7-56d46c61c93e,Symptom & Mood Tracker,Google Play,2,,"I can't seem to get the app to integrate with Google Fit. I am on the free trial, so I would think integration would be included. I use Google Fit and Health Connect. On CareClinic on the Integrations screen Google Fit is switched on as is every option of which data to share. I've been using this for about 5 days and yet the ""Last Synced"" continues to say ""Not Synced Yet"". Support is not great, I sent an email to support days ago, no response.",Dave Green,10.05.2025,us,7.0,0
27292a8f-aa92-449f-9822-15f865142a2a,Symptom & Mood Tracker,Google Play,1,,annoying to set up and was prompted to pay twice before reaching the main screen,Bella 95,06.05.2025,us,,0
034c02e7-27cb-465d-8999-8a48e267d8e0,Symptom & Mood Tracker,Google Play,1,,"I can't even deactivate.... like I downloaded to check it out(shouldn't have) opened it, logged in with google, went to set it up and saw there was a trial, was then uninterested but has to finish cause... ui.... and the Google form it takes me to when trying to deactivate my account doesnt recognize that I chose any open for the reason im deactivating, didn't want to make this public but can't even find a support email",Tristan Oller,06.05.2025,us,7.0,0
f9a4d95d-69af-4a9d-b3ec-90847c5a272e,Symptom & Mood Tracker,Google Play,5,,love love love this app! 🥹,Gabrielle C,15.04.2025,us,6.7,0
166cf277-4e4e-42e2-8c20-80e2b22b55b5,Symptom & Mood Tracker,Google Play,4,,it was good and got good sleep,Dale Rock,09.04.2025,us,,0
aa5c7fac-152b-4c3a-8a1d-478645142833,Symptom & Mood Tracker,Google Play,1,,tried to start using the app. asked me 5 times if i wanted to sign up before I even got to look at the app. and had way too many questions before I could stay using it. does not seem to be designed in a user friendly way,Dusk Dawnfable,21.03.2025,us,6.7,0
f49d8aca-fc43-442f-b614-318440a822d0,Symptom & Mood Tracker,Google Play,1,,"Avoid This App – Scam Subscription! Stay far away from this app! They advertise a ""free trial,"" but they charge you right away. On top of that, they completely ignore emails when you try to get a refund. It’s a shady business practice, and the company clearly doesn’t care about its customers. Save yourself the frustration and don’t sign up!",Thomas Swantek,24.02.2025,us,,0
c6c6e1b2-68ae-4797-aea7-75cb54e3b07c,Symptom & Mood Tracker,Google Play,4,,"This app is very helpful for tracking symptoms and treatments, and finding correlations between the two. However it can't be used as a period tracker as it currently is, and at the price per year it's just a little bit too much. Nonetheless, a great tool while you're trying to understand and manage your symptoms.",Amelia Knudsen-Clark,31.01.2025,us,6.5,0
1cc610fe-9dd1-448f-8fa4-80335b686f6c,Symptom & Mood Tracker,Google Play,1,,Unusable without paying. I ha e several chronic conditions; I couldn't add more than 5 symptoms before it tried to force me to pay.,Michie Luxx,30.01.2025,us,,0
5b0f01e7-47bf-4216-92f0-94bacefb5ee8,Symptom & Mood Tracker,Google Play,3,,"Seems like a good system so far, however I did lose my first day's logs and have had to start again. No response from the support team on why that might've happened and how I can ensure it doesn't happen again. Update: After posting this review I did quickly get a response from the support team who were very helpful.",Nick Peirson,16.01.2025,us,6.5,0
d8bc1dee-1e44-4f29-9023-8dc27ddf8e85,Symptom & Mood Tracker,Google Play,5,,"Amazing App, been using it for a while & helped my alot in tracking my day to day symptoms. Loved it !!!@",Fayiz Khan,04.01.2025,us,6.4,0
6e36e35f-3ad1-4981-8de9-377a5297d34a,Symptom & Mood Tracker,Google Play,2,,I would love to try and use this app but everytime I try and set it up I can't scroll through the full (sorted) list of symptoms before the app auto moves me on to the reminders screen and won't let me return. ~edit to respond to the devs~ i know i can do that but i want to see the symptoms sorted the way they are on that first screen. the long list directly in the symptom tracker is too difficult to scroll through looking for something when you know what you want but can't remember the word,Anna,18.12.2024,us,6.3,0
9525e3d6-9d05-475e-840d-f2efc19367ac,Symptom & Mood Tracker,Google Play,2,,"Die Sprache ist nicht durchgehend in der die ich eingestellt habe. Es wird oft nach einer Abo Version gefragt. Ich finde die Stelle nicht bei der ich das Vibrations-Feedback abstellen kann, also gibt es jedes mal wenn man auf einen der Menüpunkte tippt eine kurze Vibration. Zudem finde ich die App etwas unübersichtlich.",Andrea,15.12.2024,de,6.3,0
12c083e3-5344-4f7d-a76a-023f28bec0ff,Symptom & Mood Tracker,Google Play,2,,Just let me use the app. I don't want to sign up.,Sophie *,13.12.2024,us,6.3,0
08c18930-5797-4ac2-a681-c337ebd84d52,Symptom & Mood Tracker,Google Play,3,,"It's a 7 day free trial, and then $4.99 a month with a slightly cheaper yearly option. Not worth it for the extremely basic reminder notification functions I want to use it for. I guess if you're planning to use all the bells and whistles, you might get value out of it. (P.S. devs: You'll get fewer negative reviews if you clearly state the only payment plan is a recurring subscription on the store page, so people for whom that's a dealbreaker don't download the app.)",S Powell,17.11.2024,us,6.2,0
fc844512-3c6a-4c1d-962d-d815ff54e74e,Symptom & Mood Tracker,Google Play,2,,"I see the potential but locking everything behind a paywall is absolutely insane. I can't even delete an entry when the app has logged something at the incorrect time so I can redo it at the correct time without paying for it. I would honestly love this app if everything wasn't behind a paywall. I am deleting it and using different apps to fill my needs. Update in response to the developer: unless I can edit or delete an entry without paying for it, I won't be downloading again.",Taylor Gutierrez,16.11.2024,us,6.2,0
822fcc75-0864-45e4-9a96-1af97732ba67,Symptom & Mood Tracker,Google Play,5,,"As someone who deals with anxiety and occasional depressive episodes, CareClinic has become essential for my mental health. I like how I can rate my mood on a 1-10 scale, which feels more honest and specific than just saying “good” or “bad.” The app also lets me add my own tags and track habits, so I can see if things like exercise or meditation help. I’m finding it really useful to reflect on my day, and it’s become a core part of my routine. The design could use a little update to feel more mo",wynell kahoohalphala,09.11.2024,us,6.2,0
5ef2c67a-2509-46d9-92fc-12eee52cb445,Symptom & Mood Tracker,Google Play,5,,"CareClinic has been amazing at helping me see the connections between my diet, sleep, exercise, and overall well-being. I love that I can track different factors and see correlations in the weekly reports—it’s a wake-up call sometimes! The app is flexible, so I can add new symptoms or factors whenever I want without feeling boxed in. The support is fantastic too; they’re always asking users for feedback and seem genuinely interested in making the app better. If you want an app that evolves with",carma saxe,09.11.2024,us,6.2,0
1f7204e7-0b13-4988-8d9f-219b8760bf54,Symptom & Mood Tracker,Google Play,5,,"CareClinic is the first app I’ve consistently used for more than a few months, and it’s everything I need to stay on top of my health. It’s flexible enough to grow with me, and I really like how it syncs seamlessly with Apple Health, so I don’t have to worry about logging steps or sleep. It’s also become a great way to track my habits. Seeing my data in one place makes it easy to adjust and figure out what’s actually helping. Highly recommend for anyone serious about their health journey!",joaquina tonrey,09.11.2024,us,6.2,0
e71fd0c2-7cf3-4c00-b38d-0241dd76997a,Symptom & Mood Tracker,Google Play,1,,consistent pop up to purchase package. couldn't even get through set up. Annoying and will delete app,Jessica H,31.10.2024,us,6.1,0
5e9cddbc-79f0-4225-a472-b93ad796b3b1,Symptom & Mood Tracker,Google Play,5,,Love it,hala ismaeel,30.09.2024,us,6.1,0
66c5d727-a156-469f-acfe-728616532517,Symptom & Mood Tracker,Google Play,5,,absolute game-changer for anyone looking to manage their health effectively. symptom tracker is intuitive and helps you pinpoint issues with ease making it an ultimate companion for health awareness,Jhoy Gutierrez,29.09.2024,us,6.1,0
d34ce441-1484-41f9-8e1e-34fde511e886,Symptom & Mood Tracker,Google Play,5,,"as a medical employee, I’ve seen firsthand the importance of tracking health metrics for better patient outcomes. careclinic app is an outstanding tool that combines several essential feature in one platform",Nhorlyn Manalo,29.09.2024,us,6.1,0
11932a2e-6d6b-4301-a637-c04dcdbe34c3,Symptom & Mood Tracker,Google Play,1,,"Forces you to pay, claims to have a 7 day trial but there isn't. Took a chance on it, but it's laggy, and has too many UX issues. Defaults to setting a notification reminder whenever you add a symptom you want to track, rather than just a singular check in notification there is now as many notifications as you have symptoms. And if you want to track your menstrual cycle, your period can't be longer than 8 days. All around yikes. The emojis are cute though.",Abi Lawrence,05.09.2024,us,,0
27d7a71d-0af1-497a-a4b9-2cc5d3ae6521,Symptom & Mood Tracker,Google Play,1,,Advertises a 7 day free trial which is UNTRUE. Billed immediately for a full year. I canceled an hour after installing as it is very complicated and difficult to follow and I'm a NURSE! Don't download.,Lisa Fox,18.08.2024,us,6.1,0
d47e8c7b-67d0-4cdb-963b-37028cfb50d8,Symptom & Mood Tracker,Google Play,5,,"Finally found an app that doesn't make me feel like just another patient. The personalized care plans are ace, and I love how easy it is to log my meds.",sweetpotato,22.07.2024,us,5.9,0
1eb24f9d-ae54-4aea-91d7-fec9d1f3dcb4,Symptom & Mood Tracker,Google Play,5,,I appreciate how this app lets me share info with my family. My daughter can see how I'm doing without having to pester me all the time. Gives us both peace of mind.,kouakou paul adingra,22.07.2024,us,5.9,0
f7806e13-e0ef-4e06-a0ed-1412c62892d7,Symptom & Mood Tracker,Google Play,5,,"This app has seriously improved my quality of life. I used to forget my meds all the time, but now I'm on track and feeling so much better. Plus, the interface is pretty slick.",Abdulsalam Idris,21.07.2024,us,5.9,0
0d3de3b5-c28e-47e7-9394-c6a46803f658,Symptom & Mood Tracker,Google Play,5,,"Been using this to track my recovery progress after surgery. It's motivating to see how far I've come, and the exercise videos are actually pretty good. Thumbs up from me!",Rami Dolia,21.07.2024,us,5.9,0
367039b9-7cca-4283-8519-d97cd3556ced,Symptom & Mood Tracker,Google Play,5,,The symptom tracker is spot on. Been using it for my arthritis and it's made a real difference in how I manage flare-ups.,worsen machral,20.07.2024,us,5.9,0
beafe09a-bcc0-4546-9fd7-e44a79fa9c4c,Symptom & Mood Tracker,Google Play,1,,"It pretends to be free or at least having a free version, but in reality is $100+ or else you get spammed constantly with invasive ads.",Connor Tully,08.07.2024,us,,0
0b1036cb-5d67-4c83-bb38-856b801dc005,Symptom & Mood Tracker,Google Play,1,,"The app advertises itself as free, yet nearly every feature prompts you to subscribe. Within the first five minutes of use, I was prompted over a dozen times to activate the free trial. While the app shows potential, the aggressive subscription model significantly detracts from the user experience.",Klara Kautz,28.06.2024,us,5.9,0
09c0ee30-3709-4a1e-97a8-40770c421c54,Symptom & Mood Tracker,Google Play,5,,"CareClinic has been a game-changer for managing my POTS. From medication reminders to symptom tracking, it's like having a personal assistant for my health!",Ling Kasoy,10.06.2024,us,5.8,0
5c17a9c1-d0c5-41be-be00-dc39e7e23e7f,Symptom & Mood Tracker,Google Play,5,,"CareClinic has truly been a lifesaver for me as a caregiver. With its medication reminders and symptom tracking, I can ensure my loved one never misses a dose and monitor their health closely, significantly reducing my stress and enhancing the quality of care I provide.",Rea Untalan,06.06.2024,us,5.8,0
c9748a0c-f12f-4a2a-8ece-1a7123339cd1,Symptom & Mood Tracker,Google Play,5,,"CareClinic empowers me to take control of my health like never before. From tracking my medications to monitoring my symptoms, this app puts all the tools I need at my fingertips. It’s intuitive, user-friendly, and has truly revolutionized the way I approach my health.",Allena Joyce De Jesus,05.06.2024,us,,0
ad633488-826f-4aa5-9976-9596d34a0ee1,Symptom & Mood Tracker,Google Play,5,,"CareClinic proves that simplicity doesn’t compromise effectiveness. The straightforward interface makes it easy to navigate, and the essential features are all there. However, I would appreciate more advanced features for users with specific health needs.",Dallah sophia Diokno,05.06.2024,us,5.8,0
9aae73e7-cbb9-4a0d-bbe4-9f2cde9c6d15,Symptom & Mood Tracker,Google Play,5,,"I've been using this app for a few months now, and I'm continually impressed by its functionality and ease of use. Whether I'm tracking my daily medications or monitoring my symptoms, everything is organized and accessible at my fingertips. The ability to set reminders ensures I stay on track with my treatment plan, while the data analysis tools provide valuable insights into my health trends. Highly recommend to anyone seeking a reliable health companion!",jesusmitha rose geron,03.06.2024,us,5.8,0
adaf761e-97f6-4a20-adc1-4f8c9100b474,Symptom & Mood Tracker,Google Play,5,,"As someone with a busy schedule and a tendency to forget things, this app has been a lifesaver! The medication reminder feature ensures I never miss a dose, and the symptom tracker helps me identify patterns and triggers. The ability to sync data across devices means I can access my health information anytime, anywhere. Couldn't imagine managing my health without it!",ashera clowie unera,03.06.2024,us,5.8,0
1e032169-52d0-4c20-a200-39e1ea44251f,Symptom & Mood Tracker,Google Play,5,,I found out this app just a week ago. I am trying this now and it seems that this app is what i am looking for.,bill tan,31.05.2024,us,5.8,0
110152d3-d474-4d3f-be82-23f557112704,Symptom & Mood Tracker,Google Play,3,,"Очень странное приложение. Если сравнивать его с другими аналогичными из маркета, то это дает больше возможностей. Но сколько в нем недоработок и вопросов в функционировании! Очень сложно разобраться со старта, где что. Но очень богатый функционал. У меня противоречивые чувства от этого приложения.",Katarzyna Krasnobrodska,18.05.2024,us,5.8,0
6d2c61ff-cc64-46c8-ad88-9c7c76087fa1,Symptom & Mood Tracker,Google Play,1,,Not very user friendly. Super difficult to navigate. I even paid $10 for it and ended up deleting right away. Wouldn't let me try the free app so I wasted $10 for nothing. Rad.,Jean Nichols,18.05.2024,us,,0
15915ca7-45aa-4ea7-b2dd-b803d60f5f4e,Symptom & Mood Tracker,Google Play,2,,"(edited 5/17/24) still has potential, no $ if no update. All you need is there, but buried. Kludgey, difficult for seniors. Needs input from seniors & Docs.",Geoff Tobiasson,17.05.2024,us,5.8,0
d8479ebe-d1c7-4986-b78d-7dfa6cd2a7e2,Symptom & Mood Tracker,Google Play,5,,"i love this app its like a diary. as someone who suffered from depression, this app helped me to be active again. the improvements on my logs satisfies me so i got to move again",krissy unera,09.05.2024,us,5.8,0
08fba4da-ef0d-4ca0-b647-b6cb58338c4b,Symptom & Mood Tracker,Google Play,3,,"Once I was able to get started, it looked like it would be a huge help. Never finished entering all the info due to the price. Even on sale this is way above my price point. :(",Dana P.,24.04.2024,us,5.7,0
892838ff-05d7-4cda-8c4c-dd053fb4d36b,Symptom & Mood Tracker,Google Play,1,,Immediately uninstalled. Barely any brand choices for food tracker. No info on portions. Pushed to upgrade at every click- I would at least like a trial to learn the app b4 being continuously pushed to upgrade. Needs a lot of work.,N A,19.03.2024,us,,0
8e0dd49b-a645-4316-b7de-543fca272c80,Symptom & Mood Tracker,Google Play,2,,So many up sells it's hard to tell what you are looking at,Ada Sof,19.03.2024,us,5.7,0
9cb94aa2-0c67-430b-a7bc-9e384250906e,Symptom & Mood Tracker,Google Play,3,,"Приложение интресное с точки зрения наполнения трекеров, но зависает, не работает кнопка ""назад "" и не переведено на русский язык - 6000 рублей это слишком дорого для таких недаработок",Y Sa,03.03.2024,ru,,0
1ca7fe4d-c8b4-4da7-af0f-3c2c43557371,Symptom & Mood Tracker,Google Play,1,,"I've given them a chance for an entire year. This is absolutely not worth paying for once, let alone a subscription. The UI/UX isn't just frustrating: it actively interferes with even basic functionality like recording symptoms. Even mildly complex common use cases either don't exist or are so difficult to implement that it isn't worth the quality of life/ease of use increases. I can't decide if it was malice or incompetence that led to limiting data export to 2 months using the same filename.",Daniel Porter,25.02.2024,us,5.5,0
fcd03ef7-f30d-48ee-ab42-727f60d455ca,Symptom & Mood Tracker,Google Play,1,,Lying SOB 😭. I have nothing. I'd better not see a bill from you. I uninstalled your XXX app. and I'm blocking 🚫 you.,Judith Holbrook,24.02.2024,us,,0
3745ce52-2e31-4341-884c-b11126624044,Symptom & Mood Tracker,Google Play,1,,"Not very new, user-friendly. Also, when trying to record temperature, it only allows whole numbers. Not decimals like the normal temperature of 98.6 Fahrenheit. It looks like it could be a great app, but it needs work.",Just Me,21.02.2024,us,5.5,0
