ID,Название приложения,Магазин,Рейтинг,Заголовок,Содержание,Автор,Дата,Регион,Версия,Полезность
8271601339,Bearable - Symptom Tracker,App Store,5,So glad I finally found this,"I have been having medical challenges more and more the past few years, and bouncing between doctors and diagnoses has been hard. It can be overwhelming to try and keep track of the things that might be relevant and might not -- and even more so to remember when those symptoms happened. This app is great because it covers so many different factors that make up your medical, mental, and physical health. I just started using it, but it's such a relief. I hope they do more integrations with Apple Health and possibly MyFitnessPal!",Smurf_,23.01.2022,us,1.0.330,0
8271519120,Bearable - Symptom Tracker,App Store,5,Highly recommend!,"I never write reviews, but this is really one of the best apps I’ve ever used. Not just out of health/self improvement apps, but all apps. It is easy to stay consistent. It’s user friendly, yet programmable to cater to your own needs. It’s making me more aware and conscientious. That is extremely valuable and life-changing, for me.",Gwizzlestix,23.01.2022,us,1.0.330,0
8266258078,Bearable - Symptom Tracker,App Store,5,Super Customizable All-In-One Health Tracking,"This app is great because it is so customizable. It did require some setup time to go through each widget and create factors to track my specific health concerns, but the initial time investment was well worth it. I have the ability to remove stuff that doesn’t matter to me, and create some oddly specific categories that I doubt I could find anywhere else.

It also helps to have everything in one place. I have memory problems, but I need to track a few different symptoms, medications taken, medication side effects, sleep logging, digestive health, and a food journal. It is hard to keep up with all of that, but this app has widgets to log all of these things and more.

There are sections to track daily factors, stress, energy levels, mood, mental health, weather, menstruation, extra notes, and more. It can be as simple or as detailed as you want to make it. Bearable is also synced with my iOS health app, so it automatically logs sleep, heart rate, and step count measurements from my Apple watch.

Most importantly, I can see that the developers are listening to user feedback and constantly working on improving this app. I have suggested and voted on others’ suggestions for new features that I would like to see implemented. It is awesome that they are really involved with the community, and I’m interested to see what they come up with next.",rowanrooks,21.01.2022,us,1.0.329,0
8223929326,Bearable - Symptom Tracker,App Store,1,Can’t get listing of all symptoms,I want to see all symptoms entered on the calendars during a time period. You can only select specific symptoms,perhaps a coa,10.01.2022,us,1.0.323,0
8189399794,Bearable - Symptom Tracker,App Store,5,Sunshine,This app is amazing and I highly recommend it!,LSunshineO,31.12.2021,us,1.0.313,0
8169693279,Bearable - Symptom Tracker,App Store,5,100% recommend,"I found this up about two years ago, I was in search of an app that would allow me to track my moods. Originally I was using paper to track my mood because I kept forgetting. I tried out a few different apps but I didn’t really like any of them.Then just browsing I found this one.Quite honestly it has helped me so much, Having a mood disorder I can track symptoms andMood changes throughout the day which is helpful for me and my mental health team. I also really love this one because you can use it for both mental and physical health. Plate I use symptom tracker for not only mental health but to track side effects of my medication or of some of the other things I deal with. So I 100% recommend this app, it’s very user-friendly and easy to learn.",GothicOverlord,26.12.2021,us,1.0.313,0
8150523034,Bearable - Symptom Tracker,App Store,5,Incredible App,"This is a GREAT app I have searched far and wide for an app that let me track everything I wanted to. I’ve finally found an app that really allows me to effectively track my day to day to better understand what impact the way I feel. A really great app, so glad I found it.",Lennon Lance,20.12.2021,us,1.0.309,0
8139994344,Bearable - Symptom Tracker,App Store,5,Easy & friendly health management 🤩,"This app is so useful for tracking medication (and reminding you to take it), mood check ins, and recognizing and understanding factors that may be impacting your mood. It also syncs well with Apple Health and the Apple Watch.",Iloveallhorses!,17.12.2021,us,1.0.309,0
8137930175,Bearable - Symptom Tracker,App Store,5,Great app for the chronically ill,everything you need to monitor all in one app! couldn’t ask for a better tool in improving my health!,sallyhdhdjfjfkfjfkfkfk,17.12.2021,us,1.0.309,0
8091872801,Bearable - Symptom Tracker,App Store,5,THIS is the one!!,"Every other app I've tried for tracking has been either clunky or missing features but Bearable is exactly what I have been searching for! Tracks everything, is highly customizable, has great analytics, and has a pleasant simple interface. I absolutely love it and am so grateful for it 🤘",Ellieana,04.12.2021,us,1.0.305,0
8082346909,Bearable - Symptom Tracker,App Store,1,Way too complicated…,"I can see this has a lot of potential, but it’s way too complicated for most users(even for me). 1/10 not customer friendly.",Thouson,01.12.2021,us,1.0.304,0
8082319313,Bearable - Symptom Tracker,App Store,5,By far the best tracker I’ve used!,"Almost immediately signed up for premium when I got it because of how much I love this tracker (and it was much more affordable then other trackers). I like the app because it’s so customizable and gives me solid data about what is effecting my mood the day of, day after, week after, etc. of behaviors. You also might learn how some meds might effect your mood (but sometimes this is coincidental so always check with a doc first!) that you didn’t know even effected you before. Sometimes when I get bored and have nothing to do I go in and do a little mood check in (I try to do it at least twice a day but usually end up doing like five+ a day). Compared to other trackers this one sets the bar super high imo and I would highly recommend it. Bear in mind (pun intended) that insights won’t be as accurate but it’ll even out about a month in.",ScottieBoiJoe,01.12.2021,us,1.0.304,0
8051399124,Bearable - Symptom Tracker,App Store,5,This app has been super helpful,"I’ve been using Bearable for a little under a month now and it has been super helpful. I’ve been able to see what does and doesn’t affect my mood, keep track of meds I take, as well as track my sleep, among a hundred other things. It helps me feel more “in-control” each day. 
I really enjoy it!",theenumberfour,22.11.2021,us,1.0.299,0
7982691451,Bearable - Symptom Tracker,App Store,5,The health app I’ve wanted all my life,"Does keto affect my sleep? 
How is my mood affected by hot weather?
Am I happier on days when I do yoga, or when I run?
Is my new psych med doing its job?
Is this supplement actually making a difference?
*******
For self improvement addicts like myself or anyone struggling with mental or physical health, Bearable is an AWESOME way to record interventions like new meds and supplements and different activities or exercises to see how they affect energy and happiness on average over the long term.

There can be an awfully confusing matrix of variables playing a role in mental (and physical!) health, from social media to sleep to weather to specific places we go daily and people we see, and Bearable lets you track ALL of these. You just type them in and the app works in the background making associations (‘insights’) for you over time and showing you patterns you might not otherwise see.

They have truly thought of everything - and anything else you think of, you can add yourself! Every category is customizable - you can both add options and take away ones you don’t use. 

For instance I added Sugar Cravings to my Symptoms list and was able to see I have Fatigue 100% of the time I have sugar cravings. This is not surprising but it’s a great reminder to see in black and white that when my brain says chocolate, what I really need is a nap.

I haven’t even grazed the real depths of what this app can do in my first month using it and I look forward to exploring more of its capabilities and insights. 

I can’t think of any condition this app wouldn’t be super helpful for - weight control, depression, PMDD, anxiety, addiction recovery, migraines, chronic fatigue - and it’s great at keeping everything in one face with a fun, friendly, motivating user interface. 

I just want to say THANK YOU to the developers. I have dreamed of an app like Bearable for as long as there have been apps. I’ve used various trackers to monitor mood, health factors and habits for years but I can bring everything under one roof now.",Uhaulmyass,03.11.2021,us,1.0.291,0
7972613773,Bearable - Symptom Tracker,App Store,1,Not really good,"It’s a waist of time unless your gonna pay for premium, it would probably be good for someone with a lot of stress, anxiety, or just any mental issues, and physical to a point, but if your Simone what average it’s a waist of money, you could get a price of paper and write what you ate, your sleep schedule, and social life and it would work better than this app without premium",kaymeko,31.10.2021,us,1.0.291,0
7971058484,Bearable - Symptom Tracker,App Store,5,mindful mood tracking,"SO helpful!! bearable is the first mood tracker that i've actually used consistently. there's so many things to track, and so much room for customization in order to get what you need out of the app. i've been using the free version so far to make sure i'd actually stick to using it before committing to buying premium. i so rarely pay for premium apps, but this has been a lifesaver with my recent BPD diagnosis, so i'm going to be upgrading right after i finish writing this review. 🥰 10/10 recommend",alucasp,30.10.2021,us,1.0.291,0
7970535262,Bearable - Symptom Tracker,App Store,4,The best I’ve found,"I’ve scoured the appstore and tried numerous apps for health and symptom tracking - I can’t find anything better than Bearable. The dev is responsive and releases frequent tweaks, fixes and upgrades. Privacy is a cornerstone - if you think about it, you probably DON’T want an app scraping your most personal info and selling it to the highest bidder, right? Bearable is free to download but to really use it isn’t free - most apps these days aren’t - but the subscription is at least reasonable. Some similar apps do MUCH less and cost MUCH more. (Gyroscope, I’m looking at YOU.) Nothing is really free, but hey, I like to be paid for my work and I assume devs do as well. FWIW, I loathe subscriptions, but Bearable is one of the very few that I renew with no hesitation. Bearable is comprehensive and flexible - you can add or remove almost anything and track it according to frequency, intensity and quantity. You can hide stuff but keep it in the database - for example, if your allergies tend to flare up in the spring and fall but not the rest of the year, you can hide the entry from the main input screen and limit the clutter. I haven’t really figured out the data manipulation part yet - the app apparently does all kinds of data gymnastics, but I haven’t wrapped my head around that part. Bearable is unfortunately currently only available for iPhone. I’m not as young as I used to be - my eyes aren’t the best and I have sausages for fingers. find the small screen clumsy and unfriendly for graphs, charts and comparisons. I’d really like to see a native (landscape!) iPad app that would either sync via iCloud or allow data export/import from iPhone. Finally, while you can manually enter weather data, it would also be great to have the app automatically sync local temp, cloud cover, humidity, etc. in the same way that Bearable can already collect blood pressure, weight and such from HealthKit. Bottom line: it’s closer to perfect than any other app I’ve tried in this category or any other tracker I’ve tried to wrangle into working.",Left0verture,30.10.2021,us,1.0.291,0
7959512468,Bearable - Symptom Tracker,App Store,5,Chronic illness review,"I don’t usually write reviews for apps, but I love this one. A bit of background on why I use this: I have endometriosis and POT’s. Lately I’ve been having a flare up and decided to try this app out to track my symptoms. This app is simple and perfect for just that AND I can track my diet and factors (like exercise, etc.) and it’s helping me keep track of taking my meds. Great app, try it out if you have chronic illness, it makes staying on top of things so much easier.",m.grace.,27.10.2021,us,1.0.287,0
7910657205,Bearable - Symptom Tracker,App Store,5,One of the most helpful apps out there,"I am a woman with autism, and this app feels like it was made for me. I can track anything and everything, and quickly tell if i’m getting depressed or consistently forgetting about hygiene. this app has helped with my self awareness tenfold, and helped me realize which treatments make a tangible difference in my chronic illness. I cannot recommend this app enough.",platypuslynn,13.10.2021,us,1.0.247,0
7907695160,Bearable - Symptom Tracker,App Store,5,User friendly,"I’ve been using this app for a couple weeks now to try to get a grip on my chronic symptoms and what factors could be causing them. Originally, I was thinking of trying to find an app that could do everything for free, but because of how well this one works I actually am considering paying for a year subscription(which is saying something). It’s very quick to enter all of your data and it covers so many different metrics in a really user-friendly way that doesn’t take up too much of my time or stress me out. It gives you some analysis for free, but it seems reasonable to me considering everything that they track to pay for those extra insights long-term.",leahenoch1,12.10.2021,us,1.0.247,0
7902969893,Bearable - Symptom Tracker,App Store,5,This app is simply fabulous,"I have been struggling to keep track of my complicated and evolving health issues for over a year. Then I found Bearable and my tracking headaches have been eliminated completely! 

This app is very detailed, which helps me because my health issues can sometimes be very subtle. They also have been evolving over time, and Bearable is able to keep up with all of that. It also allows for customization, which helps me make the app fit *me,* as opposed to me having to fit the app. 

The free version of this app offers A LOT, as well. Very generous of them. I’m glad I finally upgraded to Premium, but if you are unsure or on a tight budget, you can still track a ton of things with the free version. 

I am not a tech-minded person, so I appreciate how well thought out the design of this app is. I was able to get going quickly. Everything is very user-friendly. Also, I recently hit a glitch that turned out to stem from Apple, but when I first reached out to Bearable, they answered quickly. 

This app is simply fabulous.",Clinketty,11.10.2021,us,1.0.247,0
7884681483,Bearable - Symptom Tracker,App Store,5,Easy & insightful,"The app interface is so user friendly and makes you want to log your inputs multiple times a day. Without even looking at the charts, it makes me reflect on the impacts of the variables in my life. When I do look at the charts over weeks at a time, it is illuminating when something needs to be addressed or when something is really working. Love it!",StellaJones111,06.10.2021,us,1.0.247,0
7834540360,Bearable - Symptom Tracker,App Store,5,Helps with my PMDD,This app changed my life. It’s the only app that truly helps keep track of my symptoms and moods during that difficult time of the month for me. I used this app to help identify and understand my disorder and taught me how to stay on top of it. I am very grateful t have a space to log and keep track of it all while being easily accessible and easy to understand.,Jbanks21,23.09.2021,us,1.0.247,0
7833395270,Bearable - Symptom Tracker,App Store,4,Just started using,"So I can’t give a great review yet, but please please add an option for water in liters. I drink 3 liters a day at least and it’s easier for me",Spitefullime,22.09.2021,us,1.0.247,0
7815265941,Bearable - Symptom Tracker,App Store,5,Spoon Saver & Complex Illness Savior,"I’ve used a lot of different health trackers in an attempt to get a better grip on my complex chronic illness. The problem with most apps and methods is they either lack the ability to customize the app to my specific needs or they require way too many spoons to use. Bearable is not like any other health tracker. 

I have 14 doses of meds per day and a litany of symptoms, triggers, and environmental factors that I need to track everyday. Bearable let’s me do that! Not only can I totally customize what I actually track but it takes less than 5 minutes to record everything I need to. 

Now when my doctors or medical practitioners ask about my medication adherence or symptom/trigger management I’m able to answer definitively. It’s also very helpful to be able to add major events and daily notes because brain fog will often make me completely forget when something impactful happened or what weird symptom I wanted to ask my doc about.

Overall, I cannot recommend Bearable enough. Especially if you have complex chronic illness and/or are disabled. EDS, POTS, MCAS, and etcetera are extremely difficult conditions to manage but Bearable makes it so much easier.",claraj0rdan,17.09.2021,us,1.0.247,0
7808582742,Bearable - Symptom Tracker,App Store,5,Def Recommend This App,Keeping logs is always a bit of a struggle for me. Usually it involves multiple apps or notebooks. Someone recommended Bearable and after setting it up I really started to like using it. It is very easily customizable and keeps all of the info I want to add to it. It is very comprehensive and easy to use.,Whitetulip31,15.09.2021,us,1.0.247,0
7807272312,Bearable - Symptom Tracker,App Store,5,Amazing!,"Bearable is an amazing app! I can track numerous symptoms, capture mood and energy levels and make notes as needed. The insights are super helpful when trying to compile information for a doctors appointment or to see a larger picture. Absolutely recommend for anyone dealing with chronic or ongoing health issues.",TayaShell,15.09.2021,us,1.0.247,0
7807082525,Bearable - Symptom Tracker,App Store,5,Best app ever,"I downloaded this app after being diagnosed with a thyroid disorder and needing to track my symptoms to notice any changes. After downloading, I learned that it was so much more than symptom and medication tracking. The app is so customizable you can add whatever moods or symptoms or whatever you want. I loved it so much I actually bought the subscription. I highly recommend this app to anyone looking for a tracking app for symptoms and medication and more!",Sammers28,15.09.2021,us,1.0.247,0
7807026401,Bearable - Symptom Tracker,App Store,5,So helpful & easy to use!,"I’ve been using Bearable for 6 months to track my child with PANDAS symptoms, medication, sleep, food etc. It keeps me organized and helps me see if she’s progressing or in a flare. I love that I can quickly sort each section during check ups with providers. It has really helped me to stay on top of my daughter’s issues and better help her.",harborhealthmtp,15.09.2021,us,1.0.247,0
7806258177,Bearable - Symptom Tracker,App Store,5,My Life on Track!,"Thanks for making this superior app. It had truly changed my life for the better. I can take control of my symptoms and figure out all the “whats, why’s, and how’s” of my health. I really feel ahead of the game of life. You guys are genius!!! Thanks again. I love my Bearable app",MommyTen,14.09.2021,us,1.0.247,0
7805670046,Bearable - Symptom Tracker,App Store,3,Works amazing but needs easier food tracking,"This app works really good and I wanted to love it especially with having paid for premium, but unfortunately a large amount of the symptoms I face are related to food. While I can customize the app for things like ‘high sugar’ etc, in my case this doesn’t help because I can’t discern any pattern in the foods that make me ill and being able to look at all the ingredients as patterns is essential. There just isn’t an easy way to do this and manually entering each ingredient is too time consuming to realistically do every meal. This is a huge factor and if I need to use another app like lifesum or myfitnesspal to track food it largely defeats the purpose of this app since I have to manually compare anyways-I’ll for now just stick to sticky notes :/ Which is a bummer because I really really want an app that is all in one for symptoms or food-all the apps I’ve found seem to be only one or the other. 

For now I’ve stopped using it for those reasons.  Overall though I can say I’d recommend it to anyone who is struggling with health issues unrelated to food. It works amazing for that.",Apostate_Mage,14.09.2021,us,1.0.247,0
7803502795,Bearable - Symptom Tracker,App Store,5,Very helpful,"I’ve been struggling with a chronic issue for years now, but could never claim exactly when I had symptoms and why and how. This app makes it very easy. I do have the paid version, but I think it is well worth the money.",bearable fan!,14.09.2021,us,1.0.247,0
7726567356,Bearable - Symptom Tracker,App Store,4,"Great app, Please Add More Data Syncing!!","This app is a great way to keep track of my moods. It’s a person who struggles with ADHD, depression and anxiety, I often have mood fluctuations and have no idea how to gain perspective on the issue. This app allows me to stay in touch with the bigger picture which helps me feel grounded.
I really love how many different points of data that you are able to add to this app. It is so convenient and satisfying to sync my sleep tracking app with this app so I can see how my sleep relates to my mood. Seeing how seamless this integration is makes me really really want to have more of my Apple health data sync with this app. I have an Apple Watch and constantly am curious of how things like my steps and exercise minutes factor into my mood. I feel that this integration would be so simple to include and would make this app a lot more robust.

 I also want to encourage the developers of this app to make an Apple Watch version so I can quickly input my mood on my watch. I have wanted to do this on countless different occasions because it would be such an easy way to input the data, but have to wait until I can pull my phone out instead. 

Overall, excellent app that simply tracks so many different things, but it’s only limited by the number of automatically synced integrations. If this app could sync with my Apple health data with more detail, I would give this five stars.",Booberrox392,23.08.2021,us,1.0.247,0
7673595592,Bearable - Symptom Tracker,App Store,5,Feature request: Link to myfitnesspal and other food trackers,"Love it; just hard to track food on multiple apps.

Would be good to Sync with myfitnesspal and other food trackers",zsp1234567890,09.08.2021,us,1.0.247,0
7631635990,Bearable - Symptom Tracker,App Store,3,Much better on android than iOS,"I love what this app does, however a few months ago I switched from android to iOS and there was a major drop off in reliability and performance. The biggest issues so far are that sleep sync only works sporadically, sometimes extra notes disappear, and data export is a mess. Yesterday I wrote a long, significant note early in the day, then later it was gone. I haven’t figured out a pattern, except it’s consistently terrible using voice to text. Sometimes sleep sync works fine, sometimes doesn’t show up for a couple days, sometimes never (tracked using Garmin or Sleep Cycle). Exported data used to come out neat with the android version, but the iOS version exports a disorganized mess with random symbols and missing line/paragraph breaks. This is disappointing as I used to love this app. But still worth 3 stars.",Grippox,29.07.2021,us,1.0.247,0
7581177563,Bearable - Symptom Tracker,App Store,5,Best mental health app yet,"I have schizophrenia and several other disorders and finding good apps has been difficult.  Little free features, disorganized (hard to deal with if you have schizophrenia!), and ridiculous prices to get the features you need.

Immediately upon opening I couldn’t believe how well organized it was and how nice the graphics were.  It was simple and easy to process.  Then I realized how much customization there was for the free version. You could add and edit symptoms, add symptom groups, factors, etc.

I was so impressed by what was available to me without payment that within the first day I subscribed.  The price is also very reasonable.  I do not regret it — I already absolutely love this app and use it every day. I’ve had it about a week but it’s already helped me so much, and with memory issues, it’s nice to go back and actually see what my days were really like.

10/10 Recommend",the cane & able,16.07.2021,us,1.0.238,0
