ID,Название приложения,Магазин,Рейтинг,Заголовок,Содержание,Автор,Дата,Регион,Версия,Полезность
11650209901,Medisafe Medication Management,App Store,5,I needed this…,"My daughter got me to use this app, I’m so bad at taking my meds and this helps me to push to take it. It also helps to keep track of taking it which I’m bad at. Getting old is not easy and we forget , but with a little help especially like this app, being old ain’t so bad",aliceNeric,25.08.2024,us,9.42.3,0
11645847074,Medisafe Medication Management,App Store,1,I  didn’t need a reminder,"This app really didn’t meet my need. I don’t forget my medications, ever. But I was asked to do it, and now, I’m no longer taking Dupixent due to my insurance not covering it. I called to cancel this program. They said it would automatically be removed from my apps and it has been plaguing me for over four days of canceling it.",The K. Penners,24.08.2024,us,9.42.3,0
11615931501,Medisafe Medication Management,App Store,3,Great App for 2 meds,"I was so happy with this app! After spending an afternoon learning everything about it and testing it out on 2 of my meds, for a few days, I decided it was a keeper and started adding the rest. It kept not working. I wasted a huge amount of time just trying to figure out why: no where is it mentioned that the free version has a limit. Even if I were on meds for a lifetime I don’t think $49.99 a year is justified.",meownot,16.08.2024,us,9.42.3,0
11613125479,Medisafe Medication Management,App Store,5,Dependable so far!,"I’ve only had it for a couple days but it was exactly what I was looking for. Also, I like the reminders and how you have to confirm the medication was taken.",Tahoe_97,15.08.2024,us,9.42.2,0
11609039128,Medisafe Medication Management,App Store,5,Perfect app!,"I am on a rigorous schedule of many drugs that I take six times a day. This app is the only one that has lived up to my needs over several others that I’ve tested. And it’s free! If you need drug information, prescription and dosage reminders than this is the only app you need.",Lamest update ever,14.08.2024,us,9.42.2,0
11599443298,Medisafe Medication Management,App Store,4,Love it - but this would make it even better…,"This app is immensely helpful because it’s very difficulty to keep track of 20+ different meds, but a lot of my meds call for half a pill, so it would be helpful if we could have the option when adding a dose to choose 0.5 pill,1.5 pills, etc. just a thought! Maybe in the next update?👀",highlyxquinn,12.08.2024,us,9.42.2,0
11594622419,Medisafe Medication Management,App Store,4,"Crash bug, med history gone","Update 2: To get help from the devs right in the app, go to More-> Help & Support, then look among the questions for your issue. If you can’t find it there, there’s a spot to contact support directly, and it uses whatever mail program you have installed. I’m more used to having to look for support links in the App Store. Giving 1 more star for the reply from devs below. I’ll add another if they can get this issue fixed for me and hopefully it won’t happen to others.
~~~~~~
Update 1: I was hoping that with deleting the app and re-downloading it, all my data would have saved, since I have an active account. But clearly something failed in the transmission. Did you have a server crash in there somewhere? Anyway, *all* my medication history has been wiped out. There is nothing prior to today’s date. And all the new meds I had added in the last week and change? They’re gone too. At least I don’t have to re-enter all my regular meds. Their history may be gone, but I can continue tracking them from this morning onward. Again- I am not going to re-download the Mail app, which I deleted long ago, to be able to submit a ticket. If Outlook doesn’t work, then I guess I won’t submit a ticket. I just hope this issue doesn’t happen to anyone else. ~~~~~~~~~~~~~ Original review: I can’t open a support ticket without re-downloading and using the Mail app on my iOS device, so unfortunately for me this is the only way to let support know the app currently has a crash bug. Since the last update, sometimes I can get in to track my medications, and sometimes I can’t because the app just crashes. It will crash repeatedly, no matter how I try to open it (from a notification, from a single tap on the icon, or from holding my finger on the icon & selecting “add a diary entry”). I have done everything short of delete the app and reinstall it, but it’s getting so hard to use right now that this is what I’m going to have to do. I *do* have an account, but I don’t remember my password, thus the reason for my delay in deleting & re-downloading.",Valancy,10.08.2024,us,9.42.2,0
11593662301,Medisafe Medication Management,App Store,5,Helpful and easy to Use,It was easy to set up and reminders are helpful,trise2b,10.08.2024,us,9.42.2,0
11579198635,Medisafe Medication Management,App Store,4,Good app but needs enhancements,"The app does a great job at what it’s supposed to do - track complex medication schedules, dosages, etc. I love that it allows me to customize a schedule - 2 pills for 10 days, then 1 pill for 10 days, etc. Some things for improvements and enhancements: - Stop sending reminder notifications once the meds have been marked taken on any device. My husband will mark something taken, I’ll get reminders on my device, and log in and see they’re already marked. There’s a disconnect between taken status and notifications when using multiple devices/users, but we share caretaking responsibilities. - Allow more notification customizations - I keep getting notifications to add appointments or doctors, but we don’t use the app for that. Even with premium, I’d like to opt out of some types of notifications, or set it for med reminders only. - setting up multiple users/caretakers was not intuitive- it took us a few tries. I wish that was a little easier and facilitated more than two caretakers for a person.  - allow message management in the “updates” module.  I can’t delete them or mark them read without opening each, and that little red dot is not enjoyable.",123334567,06.08.2024,us,9.42.2,0
11571781063,Medisafe Medication Management,App Store,5,What happened?,"I love this app, but when I tried to open it yesterday and today, my screen is black. I did get a reminder but still screen is black. HELP!",KathyPMsla,04.08.2024,us,9.42.1,0
11564763065,Medisafe Medication Management,App Store,3,Apple Health medication sync not available,My primary tracking &  reminder app is Medisafe at this time; however I may be forced to select another alternative. One of the frustrating items is Medisafe will not transfer medications times taken into Apple Health app. (Note: getting this info ported to Apple Health to facilitated interop w other apps on iPhone is a valued feature) DON’T WANT TO HAVE TO ENTER MED HISTORY MANUALLY INTO MULTIPLE APPS—— PLEASE MAKE THIS A PRIORITY ASAP** Fundamentally a good app with key med tracking & reminder options as well as the “interaction” info ***,g3_gTHREE,02.08.2024,us,9.42.1,0
11557583132,Medisafe Medication Management,App Store,5,Perfection,"I’ve been looking for the best APP to track my medications…I found it.
Thank you!  👍🏻😏",t43byrd,01.08.2024,us,9.42.1,0
11557543872,Medisafe Medication Management,App Store,2,Interactions Broken,This might be the best app but the interactions never loads and that’s a feature that I really need!,helenwitunes,01.08.2024,us,9.42.1,0
11557163637,Medisafe Medication Management,App Store,1,I dunno who is giving this 5 stars,"I have no clue how this app has so many 5 star reviews. Maybe it was good years ago, but in 2024 having used it for 2 months it is one of the worst apps i have ever used.

It constantly needs to be restarted, is unresponsive, the ui is unintuitive, just logging a med takes 3 or 4 clicks and then you need to restart it just to check the app has updated the status.

This isn’t rocket science, its basically a ‘to do’ list and yet its the worst app ive used and i cannot believe how many 5 star reviews it has.",crustycornholio,01.08.2024,us,9.42.1,0
11553609443,Medisafe Medication Management,App Store,1,Trava muito,O app é ótimo mas até agora só consegui usar três dias consecutivos. Trava demais! Eu continuo recebendo os alertas mas não consigo dar ok nos medicamentos que tomei,Pmferreira1989,31.07.2024,us,9.42.1,0
11552627350,Medisafe Medication Management,App Store,5,Great App,Medisafe Medication tracking is very easy to use and extremely helpful with different types of reminders to help you take your daily medications.  Plus it’s got a great reporting capability to look back at various medications changes,Medisafe app review,30.07.2024,us,9.42.1,0
11531417744,Medisafe Medication Management,App Store,2,So Slow,"Ok app, but OMG it's so slow to open..",TrueTomTom,25.07.2024,us,9.42.1,0
11530312331,Medisafe Medication Management,App Store,4,Unreliable,"I created reminders for one of my meds Reminders worked for a few days. The next time I open the phone all the reminders were erroneous, and I could not retrieve the original settings.",Alpine Meadows,24.07.2024,us,9.42.1,0
11524952596,напоминания и трекер таблеток,App Store,5,Идеальное и удобное,"Спасибо большое за такое приложение, оно идеально, учтено всё, при этом ничего лишнего, благодаря нему не ставлю миллион будильников каждый день, очень удобное пользование. Благодарю!",ДианаДВ,23.07.2024,ru,9.42.1,0
11519234184,Medisafe Medication Management,App Store,5,Essential Tool for Medication Management,Excellent app! I highly recommend Medisafe for anyone needing help managing their medication. It keeps me up to date on when to take my meds and tracks my pill count. I have it set up to remind me and inform my family if I take or miss a dose. This app has everything I need for effective medication management.,LEnchautegui,21.07.2024,us,9.42.1,0
11513513803,напоминания и трекер таблеток,App Store,5,очень хорошее приложение!,"очень нравится, что разделены препараты по времени, а не «утро» «день» «вечер». для меня это большой плюс!) 
огроменный плюс за то, что можно ОТМЕТИТЬ ВСЕ. потому что у запарке бывает выпьешь таблетки, но не до телефона совсем, и потом сидеть тыкать каждую таблетку…. а тут секунда, и все отмечено) 
хотелось бы, чтобы отчет показывался еще и в календаре. не в календаре телефона, а чтобы в приложении был календарь, по которому можно смотреть, сколько дней не пил таблетки. это очень удобно и много удобнее того отчета, что есть сейчас. 
ну и конечно же, хотелось бы, чтобы неделя начиналась с понедельника, а не с воскресенья)",nesqikspivom,20.07.2024,ru,9.42.1,0
11503597736,Medisafe Medication Management,App Store,5,Have to learn all this app does!,Keeps me accountable,Adeledenny,17.07.2024,us,9.42.1,0
11491967323,Medisafe Medication Management,App Store,5,The best assistive technology,"This app is so helpful. I have ADHD and several chronic illnesses. Medisafe helps me keep track of everything I’m taking. Having the reminder, and a record of what was taken when helps me at home and when I’m talking with my doctors.

The bit where I can customize the sound of the alerts though? Priceless. Everything is easier when it’s done with humor. I end up giggling when I get a reminder.",Inappropriate Girl,14.07.2024,us,9.42.0,0
11491557309,Medisafe Medication Management,App Store,3,Data export,How do I export my all time diary data,mm-714,14.07.2024,us,9.42.0,0
11491510015,Medisafe Medication Management,App Store,1,Apple Health sync,MediSafe still doesn’t have any support for reading/writing to medications in Apple Health. It isn’t with my time or effort to use if a health app refuses to use the HealthKit framework.,Dread Lord CyberSkull,14.07.2024,us,9.42.0,0
11483369826,Medisafe Medication Management,App Store,5,Will keep you updated! (Even when you don’t want to be),This app is so great that even when you remove your abusive stalker ex you’ll still get notifications saying he isn’t taking his meds! You’ll always know no matter how many times you remove him! (It’s been 8 times and I have a literal restraining order but support won’t remove him),JumboJuicey,12.07.2024,us,9.41.3,0
11480031678,Medisafe Medication Management,App Store,5,I’ve used this app for years,"I hate taking pills.  And I have a lot of them.  This app not only reminds me to take them, but sometimes it makes me laugh at the “voices.”  People who have been nearby when the reminder goes off have also have had a laugh.  The best part is that when I start tuning out the reminder, I can change the phrase so that it’s in my conscious again.  This app lets me look at interactions and information about my medications if I want to.  I can change the time of a single or a group of meds just for one time or even skip one or all.  I can change the looks of the meds by shapes and colors so certain ones stand out.  I can delete meds and still keep the history of the med, or even just suspend the med.  This app really does it all.
I only have one complaint.  I wish more and different voices were periodically added.  I would pay a little extra for that because I have been listening to the same ones now for many years.  All-in-all, this is truly the best medication reminder app available (and I have tried them all!)",KudBAnyone,11.07.2024,us,9.41.3,0
11476409244,Medisafe Medication Management,App Store,4,"Great app, except….","My son recently had his tonsils removed, so this app has been amazing to track his medication. However, when adding a tracker, it’s only available in Celsius. If Fahrenheit was available…it would be 5 stars.",Anna.yvonne,10.07.2024,us,9.41.3,0
11469552903,Medisafe Medication Management,App Store,4,Learning,Learning to use the app very slowly.   It can be a little hard to navigate/ set up for us seniors.   Anyway now I have Donald Trump telling me to take my meds I’m doing so much better.    If I could only remember to take my phone everywhere I go…………,Peewack20,08.07.2024,us,9.41.3,0
11466476218,Medisafe Medication Management,App Store,3,useful but slow launch time,"In general it’s a good pill reminder. Unfortunately it often takes a painfully long time to launch, which is inconvenient — mostly one wants to take one’s pills, note it quickly in the reminder app and then get on with life. One wonders what’s going on — it’s running in the background so it reminds me to take my pills. But if I tap one of its alerts to note that i took my pills, I’m stuck waiting for it to come up for like five seconds. It’s been this way for years.",supineny,07.07.2024,us,9.41.3,0
11460908165,Medisafe Medication Management,App Store,2,Does Not Save Log From Previous Days,"I’ve been using this app for some time now, and have noticed that my logs of my meds intake from previous days are not being saved correctly. For example, last night I completed my log of the meds I took. When I checked back today, I noticed that the log from yesterday changed. The evening meds showed they were not taken, when in fact the meds were taken and I logged them last night. I have a back-up to track my meds intake, so I know Medsafe did not save the log correctly. I think there are bugs in the app, or maybe it needs an update.",Applestar tech,06.07.2024,us,9.41.3,0
11451876010,Medisafe Medication Management,App Store,5,PDF emailable & printable,This app has tons of great free features and even more paid. An extremely valuable feature is being able to show doctors exactly when meds are taken. Doctors treat me much better when they can see I am adhering to prescribed medications,KatherineElisea,03.07.2024,us,9.41.3,0
11421953075,Medisafe Medication Management,App Store,5,Perfect  App!!,Simple. Easy. Exactly what I need in such a busy world.,jkerfroisbcidwweeiwondli,25.06.2024,us,9.41.3,0
11414017963,Medisafe Medication Management,App Store,5,The best medication application,I love this application. It does reminds you on time and it does keeps reminding you until you let it know that the medication has been taken. I do love the sounds that it makes to reminds me that I have to take my medication. Excellent application.,DVVSF,23.06.2024,us,9.41.3,0
11412681713,Medisafe Medication Management,App Store,5,This developers for Medisafe must be very kind!!,"I just wanted to say thanks for making most of the features accessible to everyone. Idk how I ended up installing 2 apps before this one that constantly nagged at me to pay for very basic actions… I use Medisafe to keep track of my medicine (with specific pictures/symbols for each!), log symptoms, and write notes. 

Also, the reminders to take medicine… I usually despise being notified, but for some reason the ones from Medisafe feel caring. It’s silly but the notification saying “hi how are you, hope your weekend is going well…by the way please take this drug” kind of takes away the negative weirdness of needing medicine and makes it more pleasant.",studentjenny,23.06.2024,us,9.41.3,0
11405268471,напоминания и трекер таблеток,App Store,5,Thank you!,Best app for health 💙,Пользователь45832,21.06.2024,ru,9.41.3,0
11404046652,Medisafe Medication Management,App Store,5,Works very well but,"This app works very well, I use it to track all my medication. I like how you can add the shape and color of the pill.

It would be very helpful if there were a way to add medications by Rx number.",LiquidFranky,20.06.2024,us,9.41.3,0
11403835024,Medisafe Medication Management,App Store,4,Mostly meets all my needs.,"So far I find this a much better reminder of what and when I am supposed to take each med as the 3 are all different times. I like that I check off that I have taken it so no questions and skipping meds because I literally didn’t remember whether I took it or not. Just an automatic thing I would later question. My paper system left a lot to be desired as it was not always with me.

 I also like the drug interactions part.

I do, however, wish I could make the reminder notification louder. If my phone is not in the open next to me, I can’t hear the notification.",Ritter!,20.06.2024,us,9.41.3,0
11395429690,Medisafe Medication Management,App Store,2,Forced rating,I just started using this not sure if I like it or not. Forcing rating or reviews will receive poor reviews.  The lack of opt out and only rate later nag options will receive poor reviews.  So far the app is working good and doing exactly what I need. It’s just too bad someone felt they needed to force ratings reviews,Christeon,18.06.2024,us,9.41.2,0
11383234209,напоминания и трекер таблеток,App Store,2,Не работает,"Пропала возможность добавлять новые лекарства. Выпадает окно «техническая ошибка, обратитесь в службу поддержки». 
На протяжении длительного времени данная проблема не устранена. 
Разработчики, исправьте косяк",🖕сосите твари,15.06.2024,ru,9.41.2,0
11375128589,Medisafe Medication Management,App Store,5,Best App for Medication Management,I’ve been using Medisafe for a few years now. I’m chronically ill and take around 20 pills per day. This app is a lifesaver at keeping me on track and reminding me when to take my next dose! I recommend it to anyone taking medication!,krisrating,13.06.2024,us,9.41.2,0
11351315032,Medisafe Medication Management,App Store,5,Fantastic for my Mother!!,Thank you so much for this app!! I use it to track my mother’s medication. She has Alzheimer’s so it helps me to keep up. Only wish that there were more options for notes.,KJP2U,06.06.2024,us,9.41.2,0
11350698493,Medisafe Medication Management,App Store,5,Error with marking time,"Hello! This app is perfect in every way possible, and I love to use this - was recommended by my therapist needed to mark my meds and that there were free apps out there. It’s helped ever since! The only issue is my iPhone is what I use it on- when I go to mark the time the time jumps to a whole other hour like it’s scrolling to times I didn’t. And the am/pm slot keeps changing on me too. My iPhone is fully updated and I’m not low on storage. Is there any there you can do about this? I’d appreciate it very much!",sophiebeanzee,06.06.2024,us,9.41.2,0
11346350561,Medisafe Medication Management,App Store,4,Timing Pop-up Menu,"This app has been very useful in keeping track of daily medication. However, the pop-up menu that allows the user to choose the timing of their doses—“now, on time, other”—appears inconsistently, showing some of the time but not others. Ideally this menu would appear every time you enter your latest dose. Otherwise, users are sometimes forced to enter the wrong time and then manually edit to the correct time. Not difficult but very tedious.",Sarahbee31,05.06.2024,us,9.41.2,0
11343653178,Medisafe Medication Management,App Store,2,Importing meds and other profile info,Would be helpful if when you click on 'import meds' if it would bring up instructions on how to import medications from my other device.,Tinta33,04.06.2024,us,9.41.2,0
11343040454,Medisafe Medication Management,App Store,1,Final straw,"The app has been buggy, slow and unstable for years, but the most recent versions have been so crash-prone that they have basically been unusable. In a last-ditch effort to salvage the situation, I uninstalled and reinstalled the app. When I relaunched it, all the data in the app was severely outdated—meaning it hadn’t even been saving my info to the cloud properly. I’ve been a paid subscriber for nearly a decade. No more. I’ve begun using EveryDose instead. It’s not as comprehensive as Medisafe but it launches quickly, syncs reliably and doesn’t crash every few seconds. Bye, Medisafe. Your software engineering is an absolute joke. You’ve lost a loyal customer.",James Baxter,04.06.2024,us,9.41.2,0
11337856400,напоминания и трекер таблеток,App Store,4,"Good application, but...","There is still no option to turn off annoying to take medication reminders. Also, there is no extension for Apple Watch faces. 
Given the above, your app has unfortunately moved into second place. In first place for me was Apple Health Medications.",Gary Dredd,03.06.2024,ru,9.41.2,0
11329156925,Medisafe Medication Management,App Store,1,BUG IN APP IS VERY DANGEROUS,There is a bug in this app that’s been around for years now that’s gonna cause someone to take there meds twice.  All the time if I check my meds a little earlier before the timer actually goes off it will go and say I need to take my meds or even after the fact I checked it it goes off and says u need to take my meds please fix this. This timer should not be able to go off once you have check off taking you meds,LarryAllenW,01.06.2024,us,9.41.2,0
11327338900,Medisafe Medication Management,App Store,4,Re-add dose modification,Used to be able to modify dosage but that is no longer an option. Please add this option again.,qhchctekrvxuctdhebd)83',31.05.2024,us,9.41.2,0
11315448151,напоминания и трекер таблеток,App Store,4,"0.5, 1, 1.5","Why dont you add icons for pills showing how much you need to take (half a pill, 1.5 pill and so on) ?",lSpiny,28.05.2024,ru,9.41.2,0
11309001797,напоминания и трекер таблеток,App Store,5,Приложение,Очень удобно и просто. Справится любой.,пушандрик,26.05.2024,ru,9.41.2,0
11306969810,Medisafe Medication Management,App Store,1,Doesn’t want to work anymore,"I have used this app for years. However I have had to uninstall and reinstall it twice this year. When you click on the icon, it just appears blank. Ready to try a new app!",dakelly12345678,26.05.2024,us,9.41.2,0
11299413647,Medisafe Medication Management,App Store,5,AHA! Amazing Health App,Must have for everyone,NicMasters,23.05.2024,us,9.41.2,0
11296445243,Medisafe Medication Management,App Store,5,Easy,Wonderfully easy to use. I love the “pill shaker” alert.,8057J,23.05.2024,us,9.41.1,0
11293352044,Medisafe Medication Management,App Store,4,Love the app but hate the start up,App is fantastic.  However the MOST frustrating thing is waiting for it to open.  They REALLY need to speed that up a lot.  I don’t know what it is checking for but it takes forever to actually start up.  Maybe an update? Not sure but it would be nice if it would ask if we wanted to update at that particular moment or after our meds are on-board.,jkdurden,22.05.2024,us,9.41.1,0
