ID,Название приложения,Магазин,Рейтинг,Заголовок,Содержание,Автор,Дата,Регион,Версия,Полезность
a40f9589-c062-4df3-a397-baa4c2c1cf7b,Symptom & Mood Tracker,Google Play,5,,"i have chronic conditions that require daily management, and CareClinic helps me keep track of everything in one place. It's easy to use and had lots of great features, like the ability to set reminders and track my progress over time via graphs that it generates with correlations. I highly recommend this app to anyone who is struggling to keep on top of their health conditions. it has literally saved my life!",Ruksana islam,26.10.2022,us,4.1,0
af70b066-d657-414e-bc05-b2b1970ae3de,Symptom & Mood Tracker,Google Play,1,,"Premium app only! You are lured into creating a free account. Afterwards you are immediately forced to choose a PAID Plan. The only free going is a 7-day trial so this internet a Freemium app. Unistalling right away, if you cent be straightforward with users then it is not the kind of company I would trust. I wish Google created a teue classufication to avoid this kind of deceipt.",Didi G.,03.10.2022,us,3.91,0
1498314d-64c0-4284-abac-0b248bedbada,Symptom & Mood Tracker,Google Play,1,,The inability to be able to track medication that isn't daily makes this app totally unable for many. The main treatments for most autoimmune conditions are monthly injections that we need reminders for- this app promised to help with that but lacks the ability to. Its only suitable for very common conditions,Ruaridh Sam kerr,30.09.2022,us,3.95,0
9631113b-38cb-46ff-b71b-8f7219debf87,Symptom & Mood Tracker,Google Play,1,,So I entered the app for the first time and had to add my email. The next screen said there was a 7 day free trial and then a subscription. I couldn't work out how to go back and delete my email so I got out and uninstalled immediately. 5 minutes later I received a welcome email. I'll let you all know if I start getting charged a subscription fee. Not happy so far... another piece of rubbish email received from this company. Don't install,Kuppykayke K,30.09.2022,us,,0
4c1ddf2a-9631-4cdd-a230-f89292706124,Symptom & Mood Tracker,Google Play,5,,"Great app! It really helped me with my mental health support, very useful health tracker, and helped with female health support. I highly recommend this app!",Lavi M,29.09.2022,us,3.91,0
d08c0be1-30bf-4df8-95d6-a0aad1c99fcc,Symptom & Mood Tracker,Google Play,1,,"Shortly after installing this app it became glitchy, then wouldn't open at all. After several troubleshooting attempts and contact with the developer, I was told that it was because I have a Huawei phone that the last update didn't include for ""political reasons"". More attempts were made to resolve the issue but they have been unsuccessful. It's been less than a month since installing the app. I have requested a refund. I am waiting for confirmation from the developer.",April Kingsley,28.09.2022,us,3.91,0
afed35a6-a178-4ae6-878f-0caee933a7fe,Symptom & Mood Tracker,Google Play,1,,"I like the concept. I have 2 complaints: 1 it's crazy slow. I post a check in and wait ridiculous long for it to load. 2 approximately 50% of my check-ins that say they posted, don't actually post. This compounds my frustration with issue 1 - I sit and wait, only to find I have to do it again and sometimes a third time I paid for this. Restarting the app and my phone does not help. Updating doesn't either. Wish I could get my money back! Told to update to v3.9 to fix. Already using that version.",D W,21.09.2022,us,3.9,0
68c94dae-3828-4b5a-8721-1d8a24fd4f5b,Symptom & Mood Tracker,Google Play,4,,"Updated rating (was 3 stars) More features are being added and glitches are slowly being worked out. I love that there are so many metrics to track. I do wish the free version had a little more flexibility and fewer popups to pay for premium. Overall, tons of features but the free version is quite limited and the full version has lots of little glitches. Great potential to be the best medical tracking app, needs debugging and refining.",Kate F,19.09.2022,us,3.9,0
3d9aed91-a66f-4909-a32c-cdb0e8dd81b1,Symptom & Mood Tracker,Google Play,1,,"Scam, app will not open after paying for the pro version.",Nikky Jay,15.09.2022,us,3.9,0
d8aa91e5-05b5-4bdc-bf3e-a36328a097b8,Symptom & Mood Tracker,Google Play,3,,Some basic features are missing that is present in other apps such as being able to set no end date or set frequency for X days. It will improve quality of life experience without to constantly edit these settings.,Eric,14.09.2022,us,3.85,0
7c676266-1217-4ddc-803a-e494cfe9fa49,Symptom & Mood Tracker,Google Play,1,,"Downloaded, sign in through my Google account and got stuck in a weird set up loop. No matter what I tried I got a ""retry or upgrade"" message. Fastest Download to Uninstall ever.",Sarah Robison,08.09.2022,us,,0
3824fcf7-ee86-4f06-8019-04ca852f0ffd,Symptom & Mood Tracker,Google Play,1,,"К сожалению, нет русского языка",Катерина Горбунова,03.09.2022,ru,,0
38dedb7a-dd45-4fff-8e6e-e45146a4801b,Symptom & Mood Tracker,Google Play,2,,"Response from developer to review from 4 months ago says, ""our app always has been & will remain free for most functionality...."" Funny, because I couldn't sign up without subscribing, either $60/year with a 7-day trial or $7/month. The trial FAQ says canceling is easy, but the instructions they give don't align with the possible things you can do, so it's unclear how to actually cancel the trial. If I were loaded, maybe the app would be useful, but it's not worth $60.",Amy Katuska,02.09.2022,us,3.8,0
66e06d8a-3b67-46a9-8f28-b5f8ccfe65c1,Symptom & Mood Tracker,Google Play,3,,Check-ins sometimes get stuck and do not show up on the report for that day. When you go to do the same check in again to note them on the report (since the first appear not to have taken) the earlier stuck check-ins show up along the new check-ins i.e. there are duplicates. When this happens one must delete the duplicate check-ins. Is there a way to solve this issue?,Robert Newman,31.08.2022,us,3.8,0
bfaac245-214a-4c0f-ae25-c48009ce4a8a,Symptom & Mood Tracker,Google Play,3,,"a very good start, very complex and great functionality. The German translation is not horrible but should be improved a lot. Google fit sync is not possible as Google claim that they haven't checked this company until now - this makes the input of all the measurements very time consuming - this is why I canceled my test abo ... The app knows only US medicine, the input of new custom medicine didn't work as there is a malfunction in the app.... I wonder whether the German recessions are real.",Wolfgang N,28.08.2022,de,3.8,0
93b6cb4f-7382-4470-96ca-d7401b135a40,Symptom & Mood Tracker,Google Play,1,,Extremely user Unfriendly,Sofia Polydor,13.08.2022,us,3.7,0
97742ad1-261c-4cca-a62f-67e8559f719b,Symptom & Mood Tracker,Google Play,5,,Very Thorough,Matt Airey,12.08.2022,us,3.7,0
1e875a84-ec42-4972-96b3-668b719333db,Symptom & Mood Tracker,Google Play,5,,Great tech support! I am utilizing this to track medications and symptoms for a cancer patient. There is a learning curve however I emailed for support and within a days time I had answers so I could maintain the information I needed to record.,Angela Spohr,11.08.2022,us,3.7,0
7a5032ad-5441-40ff-bfad-9b3052f41faf,Symptom & Mood Tracker,Google Play,1,,Daten-Registrierungspflicht,Pennywise,08.08.2022,de,3.7,0
e23dbd93-e862-46a2-8b38-dd71f9039659,Symptom & Mood Tracker,Google Play,5,,"Love the app! Especially the symptom tracking as it helps to have an overview of effects of medication. Having autoimmune disease, it was helpful to keep track of exhaustion, fatigue and skin problems. I also love the sleep tracker since it not only has an input for hours of sleep, but also quality and other factors affecting sleep - as well as different sounds to help me fall asleep!",Sara Sohail,05.08.2022,us,3.7,0
03d4edd7-6e88-4ff5-8862-f8bfd0a07377,Symptom & Mood Tracker,Google Play,5,,"This is all I want for a healthcare app - not only a health tracker but it also provides mental health support, female health support etc. I'm relying on this app for my own care routines and medication reminders. Great UX, handy and easy to use. Strongly recommend!",Yongbei Li,03.08.2022,us,3.7,0
efc2fc2f-7b01-47eb-9f94-e0cb52caffe5,Symptom & Mood Tracker,Google Play,3,,"Seems like what i need however google says it is not verified so not willing to pay 60 without verification. Also a little buggy .... six days left on trial, do not think i will keep",Carl Farrington,31.07.2022,us,3.7,0
76054e6a-57b1-480e-a802-215d8c7f1508,Symptom & Mood Tracker,Google Play,3,,"Весит тонну. Сразу после регистрации требует оплату, даже не попробовав. Странное приложение.",Андрей Петров,22.07.2022,ru,,0
7e5370dc-6ed3-465d-8448-e700b0d5bcfa,Symptom & Mood Tracker,Google Play,1,,Its worst application isnt work,bahador.sama01 Hooshi,18.07.2022,us,,0
5d8d55b9-33b7-4b36-96a7-3cdd43a8fa0b,Symptom & Mood Tracker,Google Play,5,,"Приложение с огромным функционалом. Но. Зачем регистрация при входе, если я его скачала, чтобы просто посмотреть, что это за фрукт, подойдёт или нет.",Ольга Лео,14.07.2022,ru,3.7,0
6298d4ae-12ca-431f-afdf-3c17537ce9b8,Symptom & Mood Tracker,Google Play,2,,"Update: Devs, i still cannot deactivate/delete my account. The display doesn't show fully. I can log out just fine. I could email a screenshot if that helps? ... A little complicated, good if you want something with a lot of coverage. Also, I (still) can't delete my account; the display is cut off after I select a reason and enter in the text box, then it doesn't scroll anymore so I don't know if there is any button below to confirm account deletion. I can only just log out and that's it.",Aurora L,12.07.2022,us,3.6,0
c2d1cbfe-d572-4fa0-988f-dfd28f6138c0,Symptom & Mood Tracker,Google Play,4,,It took me ages to find an app that could track so many health variables so that I can find trends and see what does and doesn't work,Georgina Vuksanovic,11.07.2022,us,3.6,0
55321626-15ae-4364-9f74-89e63e18c6fa,Symptom & Mood Tracker,Google Play,2,,"constant popups to pay a subscription, lots of basic functions locked behind a paywall. pretty annoying to use.",Austin Witherspoon,09.07.2022,us,3.6,0
0e138a72-b885-471b-8415-35c2020579fa,Symptom & Mood Tracker,Google Play,1,,Paywall. No feature preview available. Too complex to start.,Aliaksandr Gulyuta,05.07.2022,us,,0
836ede45-1662-4abc-a710-e2d6a370e127,Symptom & Mood Tracker,Google Play,2,,"The app itself is nicely built and has a lot of tracking options, but about 70% of the things you click on will trigger a pop-up asking you to upgrade to use that feature. I'm okay with buying apps when it's a one-time payment, but I generally don't use tracking apps often enough to justify an annual payment. The app is nearly unusable in it's free state because of the pop ups.",Lindsey Grafe,05.07.2022,us,,0
6abfede4-b1fb-43ec-8617-3b8c78c94914,Symptom & Mood Tracker,Google Play,1,,Too many prompts to subscribe and keeps giving me 'error try again' message when I attempt to deactivate and delete my profile. Even after uninstalling it still shows up and won't delete.,Roxy Cherry,01.07.2022,us,3.6,0
fae661ed-aa2f-4ff5-a68b-d86d50e403d8,Symptom & Mood Tracker,Google Play,5,,very impressed so far.,Faz Moosa,26.06.2022,us,3.6,0
23d94d05-6c66-4ab5-833b-2c1af615a3b3,Symptom & Mood Tracker,Google Play,1,,"I downloaded this app to track symptoms for myself and a baby. I can't do much anything without paying for a subscription, and I can't find anywhere to add a second person. App is cumbersome and it's hard to find what I'm looking for without a pop-up asking me to try the free trial. I'm not interested in paying for a service, and especially not interested in paying for functions that are handled locally on my phone.",Joshua Crowell,22.06.2022,us,,0
6a27fc6e-06f0-4fb4-aba4-069876c787dd,Symptom & Mood Tracker,Google Play,1,,Findet nicht mal einfache herzmedikamente........nicht zu gebrauchen.,KPT. Yumoshin,21.06.2022,de,,0
0967472d-e86a-44ee-89a2-fba2de8f0489,Symptom & Mood Tracker,Google Play,5,,Excellent app for improving mental health and physical health. I use it to as a pill tracker and to log my workouts. The best digital health health tracker I've used so far!,Chris,19.06.2022,us,3.55,0
7ae4f0fd-e755-4d31-a7a6-3cf1dc463cbd,Symptom & Mood Tracker,Google Play,5,,"This app is an amazing health platform to help keep track of my overall well-being on a day to day basis. The aesthetic is simple and makes it easy for me to track my symptoms, acts as a pill manager, record my mental health and create a healthcare plan. Reminders are always consistent, on time and the dairy feature allows me to analyze my health patterns efficiently. Highly recommend!",Alina Khan,03.06.2022,us,3.55,0
b6de17a4-72c1-4402-8fc7-d9a14c539259,Symptom & Mood Tracker,Google Play,1,,It is an ok app but very expensive subscription for what it offers.,ROGER VM,27.05.2022,us,3.55,0
77c006cc-ac1d-4b61-9d8b-0896fe251678,Symptom & Mood Tracker,Google Play,5,,Annoying . I gave this app 5 stars because to be honest i didnt even try it. Thats because before i even get to trying it i have to register. Sorry but that doesnt fly. Tired of it. This is not the only app on the planet. You need to figure out a better way of letting prospective customers see your product before you press them to create an account. Thx.,Baa Ram Ewe,26.05.2022,us,,0
6c29c56e-078e-4b1f-bbe1-1904276118e0,Symptom & Mood Tracker,Google Play,1,,Looks like it could have nice features but getting my meds entered is so glitchy that I don't think I will be able to use it. I am generally good with tech and super patient about adds but these adds prevent me from using the app. If you have only 1 or 2 meds to track maybe it will work. I will never know.,Leeanne Branham,22.05.2022,us,3.5,0
473bcabf-496e-4507-be53-d56761113add,Symptom & Mood Tracker,Google Play,3,,Does not track sodium and I need to track sodium,Jenni Crawford,21.05.2022,us,3.5,0
5a8fe809-deab-4c93-90c9-ae52f8a150ed,Symptom & Mood Tracker,Google Play,1,,Too many features locked behind a too expensive subscription.,Kenmore Chalfant,20.05.2022,us,3.5,0
d51f42ec-d3a3-47ef-895d-a2433a33cbeb,Symptom & Mood Tracker,Google Play,1,,Hallo ich finde keine Kontaktdaten also mache ich es so magenda.24 gmx.de möchte wissen ob diese App etwas kostet? Das ist sehr wichtig Danke,Marita Schlüter,20.05.2022,de,3.5,0
072d805b-d2e1-4166-adb8-4648f6bad4c2,Symptom & Mood Tracker,Google Play,1,,have to pay for so much to even use,Bonnie Joyner,30.04.2022,us,3.4,0
ad581bc1-e127-471e-9230-263474702350,Symptom & Mood Tracker,Google Play,5,,"I like that it can log a few different things that I was looking for. I may be using it for a 'off-label' use, which is for PTSD not necessarily for managing my meds or recording my activity, but it does provide ample functionality for tracking blood pressure and mood so I'm a happy camper.",Kruchten Delinda,29.04.2022,us,3.4,0
c0f47bc1-c099-42b6-9d3e-278b25cc457b,Symptom & Mood Tracker,Google Play,5,,Très pratique mais l'application ne fonctionne plus suite à la mise à jour de ce jour.,Rocky Gil,26.04.2022,fr,3.4,0
7671443e-fe91-4ee5-83a2-d4d3e0d81451,Symptom & Mood Tracker,Google Play,4,,"Fantastic App! Great for tracking symptoms. I use it for tracking my adhd symptoms alongside my menstrual cyle and other factors. Great to observe effectiveness of treatment. Works fine free, with certain limitations, obviously.",Dimpho Pine,19.04.2022,us,3.35,0
23edc56b-571d-416c-81db-d76f281da458,Symptom & Mood Tracker,Google Play,3,,first time learning/ trying,T B,15.04.2022,us,3.35,0
ebad7dca-7c38-4610-bc8a-b66df98efb65,Symptom & Mood Tracker,Google Play,1,,"I liked this app at first. I even chose to pay. So I'll be canceling the payment before it goes through unless this issue is fixed. It is only allowing me to add 5 providers to my care team. I have PLENTY more doctors than just 5. Every time I try to add another, it continues to tell me that ""This user already exists in your CareTeam!"" Which is obviously bull. I'm insanely frustrated because I thought I FINALLY found an app for what I'd need, but naturally that's not the case.",Suzanne Larancuent,08.04.2022,us,3.35,0
62ff860d-1602-470f-98e7-2dbee29005f3,Symptom & Mood Tracker,Google Play,2,,"Great idea, poor execution. Data duplicates and is nearly impossible to clean up, the app randomly loses your plan, and the app crashes randomly.",Erik Schick,07.04.2022,us,,0
732f11d5-2b07-498b-ba37-79bf703afbf3,Symptom & Mood Tracker,Google Play,1,,the cost of this app is way too expensive they want $80 a year to store this information for you. there is no way to justify these costs. just another company being greedy and overcharging for simple storage of data,Steve Main,31.03.2022,us,,0
eaa74f1d-9a03-4203-9c6f-33083265714a,Symptom & Mood Tracker,Google Play,5,,Great app for tracking all your health care needs. Clean navigational layout. Easy to record and analyze your data entry. It gives you back control of your health information,Stratos G,21.03.2022,us,,0
67284097-1181-43c4-a64b-a3cde894e28c,Symptom & Mood Tracker,Google Play,1,,"Five months after being put off by first impressions (dear reader, please tap ""View edit history"" in the menu to the right of this review) - hindered by many things - I'm finally able to look at this properly. But seriously, £56 per year?! I'll keep exploring the free/reasonably priced rivals thanks. AND if CareClinic really offers anything worth donating my email address(!) for, a 3-day trial is nothing like enough to find out. 2-4 weeks would do. I'm ill; it'll take me 3 days to input my meds.",Mand,15.03.2022,us,2.65,0
ab24f5fd-bfa6-47b3-aa94-0f89879b89c0,Symptom & Mood Tracker,Google Play,2,,"would add an extra letter at beginning of entry, and I can't even track my blood sugar levels - something that should be standard and NOT a 'premium subscription feature'.",Isaac Roetcisoender,14.03.2022,us,2.50,0
8e14f820-b468-41fb-8ee1-60b65404bd5b,Symptom & Mood Tracker,Google Play,4,,Similar to apps like Daylio or Curable but appears more focused on chronic disease management. It’s useful for a way to manage an illness and have a timeline of how your treatment is progressing,E,27.02.2022,us,3.1,0
319adeb4-7daa-42cf-8bed-4c617cf79603,Symptom & Mood Tracker,Google Play,5,,This App is great for keeping a tab on your medications etc. ! You can even note down any symptoms you have before and after to help you see patterns and pinpoint problems. Great tool!,Simmi Sidhu,24.02.2022,us,3.0,0
c5bc574f-d65a-4a04-9992-010e5cf78e34,Symptom & Mood Tracker,Google Play,5,,"I just started using it and overall it seems to be quite complete! Had a couple little glitches entering meds, where it kept restarting, but it went away. I have high hopes for it.",P Z,17.02.2022,us,3.0,0
4c599543-c833-4174-b950-ac1ed4574770,Symptom & Mood Tracker,Google Play,5,,Very handy medical tracker. Lots of options to track basics like water; to dailies like multi-vitamins,Nelson Ing,10.02.2022,us,3.0,0
4fc8f577-8b8d-459e-9fc1-b15da816a4c0,Symptom & Mood Tracker,Google Play,4,,I signed up for Premium but it won't upgrade. I need a refund cause it will not work.,Pixie Lent,07.02.2022,us,2.95,0
18f7e7e3-ad25-4f37-8f2e-9d9640100974,Symptom & Mood Tracker,Google Play,1,,Signed up for the 3 day free trial and it immediately charged me for a year.,Quynn T,04.02.2022,us,2.95,0
8afb825d-2395-4b5a-bdb0-add6a613939e,Symptom & Mood Tracker,Google Play,1,,Too frequent and intrusive notification reminders.,Yanis Kyr,30.01.2022,us,2.95,0
01f2ac24-e709-4893-9a18-6ec51b73e88f,Symptom & Mood Tracker,Google Play,4,,Overall happy with the App but be aware of hidden fees.,Kayla Buchholz,27.01.2022,us,2.95,0
556c9e23-b9cc-4bb5-9bb2-ba3af4346751,Symptom & Mood Tracker,Google Play,4,,is detailed,kim Jose,22.01.2022,us,2.95,0
19e3d4b0-31f9-49bb-8491-3150f13ee335,Symptom & Mood Tracker,Google Play,3,,"The free features are adequate with keeping track of medication, symptoms, and other relevant measurements. I'm not a huge fan of the app's design putting the paid for features in the user's face but this whole ""review/share our app to see your data as a graph"" is skivy.",Erica M,17.01.2022,us,2.90,0
87ab43fb-451a-4f55-8ad8-f1c575ee122f,Symptom & Mood Tracker,Google Play,1,,Not free,Andrew Telford,14.01.2022,us,2.90,0
27f980f6-d88f-4bef-bebd-a1bdb9a96dd3,Symptom & Mood Tracker,Google Play,1,,Keep messing up with my daily check ins and reminders,Susy Neuhauser,04.01.2022,us,2.90,0
721335cc-fd69-45fa-92a1-50cde0958972,Symptom & Mood Tracker,Google Play,2,,Poor usability. Had to switch to another app.,Ahmed Kamal,28.12.2021,us,,0
439ed8c4-03b1-482b-984e-67aee64a15e8,Symptom & Mood Tracker,Google Play,4,,I have only been in the app for 10 minutes so I don't have a handle on it yet but so far it looks good and has been easy to understand,Erin,25.12.2021,us,2.80,0
eb58b9d3-5e40-4032-95cf-6785e396ea6c,Symptom & Mood Tracker,Google Play,1,,"paid for a subscription to this app l, and am forced to rate it to unlock features that I'm paying for. so. here we are.",Scott,01.12.2021,us,2.75,0
6ec21be2-b0f5-4317-ae10-0fc1a536ba94,Symptom & Mood Tracker,Google Play,3,,"I can't believe that an app can lock features and require a rating... I've used it for 5 minutes, i don't know how I like it yet.",Cassie Kunkel,23.11.2021,us,2.75,0
a032ad85-aaed-4b8f-afac-82e04afda01a,Symptom & Mood Tracker,Google Play,1,,"This app is a scam. I downloaded it and then decided it wasn't what I wanted. They locked me out repeatedly, wouldn't answer emails or calls to customer service to unsubscribe. Don't download, I think this is a money scam, seriously.",Bennett Kirkpatrick,14.11.2021,us,,0
5d4e5f13-3366-429b-afe0-61c276219e33,Symptom & Mood Tracker,Google Play,3,,I'm still trying to figure out if this app will be useful for me using just the free version. I'm trying to find something that can help me keep track of medications and any symptoms I'm having. I wanted to see what kind of report it generates because that is what I was looking for to send my Dr before my appointment but it required me to post a review before I could view it. I'm currently already using an app that tracks meds and symptoms but it doesn't provide any kind of report.,Rachel Elizabeth,10.11.2021,us,2.70,0
9624c362-be99-4b30-9305-38eca7238dc3,Symptom & Mood Tracker,Google Play,1,,Too much of what I was not looking for,Joanna B,09.11.2021,us,,0
86ab9b07-a1da-43d3-82d9-c53546d9fa84,Symptom & Mood Tracker,Google Play,2,,It wasn't good enough for my needs. It was lacking detail.,Leigh Kappa,08.11.2021,us,2.70,0
71b508c4-2b69-49dd-8fd3-4781ad02df3a,Symptom & Mood Tracker,Google Play,1,,Don't Do This App,Sean Davis,06.11.2021,us,,0
3f350516-c688-4166-ae8c-53429eaad2ea,Symptom & Mood Tracker,Google Play,1,,J'ai été obligée d'y renoncer quand j'ai vu le prix. Il aurait été plus honnête de le signaler avant ☹☹☹,Blandine Laforge,29.10.2021,fr,,0
097acc96-7a39-4d5f-9808-ea614b138bf9,Symptom & Mood Tracker,Google Play,3,,Needs a rating to use features,Marista de Jager,20.10.2021,us,2.70,0
eb46e7fc-023b-4167-9981-3babcc7a602e,Symptom & Mood Tracker,Google Play,4,,"all features are great, except editing previous logs is a pro feature.",Simon Stevens,19.10.2021,us,2.70,0
dac96e04-45a4-4450-8ef0-cbeacddab2a0,Symptom & Mood Tracker,Google Play,1,,"They said it's free, ITS NOT.",ToKnowU IStoLuvu,14.10.2021,us,,0
4875eccd-2402-4aef-895e-2a1bb9fe46ad,Symptom & Mood Tracker,Google Play,5,,Works great as long as you know what you want to do. There is not too much educational content for diabetics.. but I know what I need to measure and what nutrition things I need to track so this works well for me.,Jillayne Mazzarino,10.10.2021,us,2.65,0
2a8b8cc4-5767-46df-a483-44d4145d7f9a,Symptom & Mood Tracker,Google Play,5,,"One of the best medical tracker ever that ai have come across. Not that ai have used much of those but this app keeps one hooked with its user-friendly interface. The best way to keep your mental health monitored. Great features like Journal, symptom tracker and medicine tracker. Journaling feature is probably one of their pluses, as it has prompts to get you started on writing!",honey patel,05.10.2021,us,2.65,0
1d8e143a-ce28-4d4f-9e48-e342ff23858c,Symptom & Mood Tracker,Google Play,2,,"The app has potential to be useful, but a lot of the useful features are locked behind the premium feature. The app has just started to block me from seeing any data from more than a week ago with no warning, so now I have to pay for premium if I want to see my data. Don't bother with the free version",Bethany Allen,27.09.2021,us,2.65,0
f575e062-337a-4932-8289-dd44ccb21e30,Symptom & Mood Tracker,Google Play,5,,"The CareClinic app provides an impeccable service! In addition to medical tracking, it also tracks my nutrition goals & fitness activity to supplement my rehabilitation process. Working from home & gym restrictions has limited my discipline to stay on track, so this function is extremely helpful for me. Not to mention, the pill reminders I set aid me in my recovery process and ensures I do not miss anything important. This app is the most simple, effective healthcare diary I have used.",suraj bhola,21.09.2021,us,2.60,0
e17ec49a-09a8-497c-9ec0-bfdfec982e41,Symptom & Mood Tracker,Google Play,1,,You have to pay for everything to have a useful app aside from medication reminders,Allen Lat,15.09.2021,us,2.60,0
