ID,Название приложения,Магазин,Рейтинг,Заголовок,Содержание,Автор,Дата,Регион,Версия,Полезность
12969459416,Bearable - Symptom Tracker,App Store,5,mental relief,I suffer from severe anxiety and my adhd makes me forgetful. This app has been helping with both!,Chris_Thinks_Apple_Sucks,03.08.2025,us,1.0.560,0
12940063777,Bearable - Symptom Tracker,App Store,5,Actually fun to use,"I love this app! It is so thorough, and makes it so easy to log changes throughout the day. I feel like I’m gonna be recommending this to all my chronically ill friends. It really helps to have a record of my patterns.",margotmoropheus,26.07.2025,us,1.0.558,0
12939161504,Bearable - Symptom Tracker,App Store,5,Good app!,Good stuff! I love the ability to add any factor I can think of instead of being limited to preset options!,Lionman6384,26.07.2025,us,1.0.558,0
12934726296,Bearable - Symptom Tracker,App Store,5,Needs an improvement,"Great app so don’t want to give it anything but 5 stars but the tracking feature is lacking some tracking - feels limited 

Also can you please alphabetically sort everything? 
It takes too long to find everything I’ve imputed myself 
For example if I added mustard, it takes me so long to scroll through all the foods and find mustard, if everything inputted got alphabetized it would be so much easier to find, INCLUDING symptoms",ChloTheShow!,25.07.2025,us,1.0.558,0
12927073425,Bearable - Symptom Tracker,App Store,5,LOVE,I actually love this app so much it is the perfect health journal,MGator06,23.07.2025,us,1.0.558,0
12895826683,Bearable - Symptom Tracker,App Store,5,Amazing!!,My favorite thing about it is how customizable it is.,Rattzie,15.07.2025,us,1.0.556,0
12888488858,Bearable - Symptom Tracker,App Store,4,Family Share Availability,"This app was made with us in mind, finally. It’s functional, it’s cute, it’s got an extensive symptom list - and I was able to trial the premium which offered more unlimited features - and using the free version is really suitable. 

Why the four stars: 
As someone with multiple chronic illnesses, I would absolutely invest in premium if family sharing were available. My mother and daughter both suffer as well and would benefit from this immensely- $20 is doable, $60 just is not. 
We make choices as a family that benefit us all in this financially unstable world. Perhaps in the future, if availability changes, we may come aboard. Thank you for creating such an important app!",alestri,14.07.2025,us,1.0.556,0
12877550232,Bearable - Symptom Tracker,App Store,5,The best tracking across many categories,Love getting to begin to track day-to-day influences using multiple different types of data points. Would love a local-weather and moon phase integration! Still fab overall.,c.carroll,11.07.2025,us,1.0.556,0
12869117818,Bearable - Symptom Tracker,App Store,5,"Good, basic app for tracking symptoms","The format is aesthetically pleasing and it is easy to log information, as well as add personalized moods and symptoms, which has been very helpful for me as I’m tracking several different things. Plenty to access with the free version, but also much to explore with the paid version. Some features feel a little tedious and my only complaint is that I wish the categories were more intricate or tailored specifically for chronic illnesses.",completelyunoriginal,09.07.2025,us,1.0.556,0
12868086116,Bearable - Symptom Tracker,App Store,5,Such a GREAT APP!,"This app has helped me to keep track of my over all well being! Knowing my overall health (physically, emotionally and mentally) daily and then looking at the trends has been such a great help to my seeing what, where and how it’s being affected as well as by what. I’d suggest this app to anyone who is wanting to keep track of their overall well being! I get a reminder daily to do my tracking as well which helps tremendously due to my cognitive issues. (Memory issues are so terrible) So yes absolutely I encourage anyone who is wanting to keep track to absolutely get this app!!! So so so worth it. Thank you to the team who created this app for people like me!",Blisser777,08.07.2025,us,1.0.556,0
12861790080,Bearable - Symptom Tracker,App Store,5,Helped a lot!!!!,I don’t have all the disorders/disabilities I listed in the app but this is very useful to track symptoms of my day to day life and help work towards some diagnosis’s. Thanks a lot is very useful and helps me understand myself too.,object show fan2763,07.07.2025,us,1.0.556,0
12852969781,Bearable - Symptom Tracker,App Store,5,One of the best apps I’ve ever owned!,"Bearable has allowed me to quantify changes to my nutrition, exercise, and body. Measuring my inputs and how they correlate to my outputs has helped me optimize my health very quickly. My symptoms are down -54% in 30 days and energy is up 48%!",Mattdim805,05.07.2025,us,1.0.556,0
12847558109,Bearable - Symptom Tracker,App Store,5,Undiagnosed pain,"I used the app to track symptoms so as to better explain symptoms and severity to health professionals. The summary graph helped the Physical Therapist see progress and confirm treatment plan. It was also useful in cutting back on pain killers—managing the rotation of various pain killers. Of great importance, it helped me see progress thus keeping hope alive.",Vifavjiuyffvhjo,03.07.2025,us,1.0.556,0
12840959279,Bearable - Symptom Tracker,App Store,2,Misleading,"This app had me make an account, answer a bunch of questions and set up a profile. Only after 10-15 minute of doing such did it decide to share that it is $50/yr. Very misleading and a waste of my time. Should have lead with the price.",Chronicillnss1031,02.07.2025,us,1.0.556,0
12832429269,Bearable - Symptom Tracker,App Store,4,Really cool!,Great app for checking on all the little things throughout the day. I’ve had some medication adjustments recently and it’s been awesome to help me track how those changes have affected everything from how I am feeling physically to how I am feeling emotionally! My only issue with the app is that I wish it explained the correlations that it is finding a little bit more. Sometimes I find the percentages are confusing for me.,CLB1745,29.06.2025,us,1.0.556,0
12832190855,Bearable - Symptom Tracker,App Store,5,great for tracking symptoms!,"it can difficult to keep track of symptoms and medication for doctor’s appointments, but bearable makes it…well, bearable. there’s a bunch of options to customize the experience, from all of your symptoms, mood, gratitude, medication, energy levels, etc etc etc. you only put in however much information you want, which i appreciate: it can feel daunting committing to tracking how bad you feel every single day and it often gets repetitive and overwhelmingly negative, but this app makes it simple, easy, and quick. i’m so happy i found this app!! thank you devs for making my life a little bit easier amidst my pain :)",bellebonk,29.06.2025,us,1.0.556,0
12825354290,Bearable - Symptom Tracker,App Store,5,So helpful,I use this because I have epilepsy for the most part. It’s controlled on medication and I’m fine but there are some days I need to document.,Reinavia,28.06.2025,us,1.0.556,0
12819730531,Bearable - Symptom Tracker,App Store,3,Optimistic but needs some work,"I’ve paid for a year membership and like the app overall but there are definitely a few areas that it needs to some tweaking, especially with sleep. As an app for patients with chronic conditions I would think it common that users may nap or even have unsettled sleep patterns due to their symptoms, but this seems to be a problem with recording our data accurately in Bearable as of now. I’ve reported it as a bug to the development team, received communication & have been told they are working on it but as of now it was suggested that it’s best to turn OFF sync with my Apple Health for sleep. That’s a bit disappointing but I will be cautiously optimistic for now. Hoping to see improvement in future updates which may influence if I continue to subscribe.",KRKapple,26.06.2025,us,1.0.556,0
12814292696,Bearable - Symptom Tracker,App Store,3,Negative changes,"the time period aspect of the nutrition section was removed. I’m no longer able to track When I had certain things (sugar, protein, meat, etc). If this happens to any other part of the app, I’ll just delete. I was hoping to upgrade when I could afford it, but if they’re taking away aspects I need, even if I’d get them back by upgrading, I’ll skip it.",ElijahSibastien,25.06.2025,us,1.0.556,0
12808886412,Bearable - Symptom Tracker,App Store,4,Great data and tracking but VERY LAGGY,Love the app and the concept. Only reason the review isn’t a five is because the app is so insanely laggy. Hoping this gets fixed in further updates because I still think it’s worth using !! Id also love to see it pull in more info like the actual pollen count and atm pressure from your location instead of having to manually input.,Maggsryan123456789,23.06.2025,us,1.0.554,0
12804624310,Bearable - Symptom Tracker,App Store,1,It’s not free,"This was marketed as just having in app ads or purchases, only to have a fee once you download and set up the app. I’m upset at the bait and switch, preying on a community that’s already struggling.",RSto-Review,22.06.2025,us,1.0.554,0
12798177147,Bearable - Symptom Tracker,App Store,5,LOVE IT,So far it has been amazing and it helps me figure out my feelings. I had it for 2 days now and I I can’t wait to do so much with it!,Shksiwkdbduqhl,21.06.2025,us,1.0.554,0
12775042059,Bearable - Symptom Tracker,App Store,3,"Love, but pricey :(","I absolutely am loving this free trial so far, just felt so let down when I thought I discovered a free app then hit with the 34.99 a year part 😭",bgclark1514,15.06.2025,us,1.0.554,0
12771973037,Bearable - Symptom Tracker,App Store,5,Great all day tracker,"This app has all the pros and only one con and it’s not even a con it’s more like a suggestion to upgrade. 
1 and only upgrade/con
In the medication section I wish there was a way to put in the time pre day the medication is taken. And set a reminder for each dose. But Thank You so much for a great app all the daily activities on one sheet and he just have to go down the sheet to put in all your info from your medication supplements, list to your symptoms your mood bowel movements your activities nutrition, and the way you can put in all the stuff in nutrition and favorite certain meal so you can just add it in if you have it again that is awesome. Then there’s the other factors where you can go in and you can set exactly how you want to rate those factors and what those factors are. The energy level and you can do that periodically throughout the day. You don’t just have to do it once or twice you can do it morning midday and evening if you like it’s all at your discretion or just as your mood changes. Then there’s your health which has like your blood pressure your weight, your heart rate your HRV, which is also connected to whichever kind of phone you have health app so that connects through your watch or whatever you have connected to that to this this app, so everything’s in one section and then it has a place where you can print all of this out for when you go to your next doctors appointment like I said the pros to this app are way more than any Con I could find and it’s the only one, I have.",faithangel3,14.06.2025,us,1.0.553,0
12771180003,Bearable - Symptom Tracker,App Store,1,Unauthorized charges,"I did a free trial and realized it wasn’t for me, cancelled before my trial was up and I’m still getting charged for a month, $37.",FREAKINFEDUP,14.06.2025,us,1.0.554,0
12766640255,Bearable - Symptom Tracker,App Store,1,Create an account not working,I downloaded this app because I have possible POTS and my doctor wanted me to track my symptoms. I was extremely hopeful for until I tried to create an account. It wouldn’t let me. It was super annoying and just kept saying “could not create account”. Might edit the review if I get it to work. Disappointed.,BagelTheDuck,12.06.2025,us,1.0.554,0
12758388481,Bearable - Symptom Tracker,App Store,5,Great for Chronic illness,"I have MCAS, EDS, POTS, & PCOS and this app is amazing for keeping track of my always changing symptoms.",Eleven cats no shower,10.06.2025,us,1.0.554,0
12748883433,Bearable - Symptom Tracker,App Store,5,So helpful,"This app really helps me understand my triggers and the patterns that affect my mental health. I think the level of tracking it provides (for free) provides incredible insight into why I feel the way I do. I also like that I can schedule reminders, since I forget to do this kind of stuff.",LuxeG,08.06.2025,us,1.0.553,0
12729659199,Bearable - Symptom Tracker,App Store,5,Overall best habit tracker,"It’s the most customizable of all the free trackers and includes everything from tracking meds to meals, physical activity literally anything all in one place in a organized way",MurdaBurga,03.06.2025,us,1.0.553,0
12727364967,Bearable - Symptom Tracker,App Store,4,Had to edit my review,"It’s a nice day by day and I found the event tracking. While it’s a little out of the way, I’d like for it to be similar to the bm section where it’s an easy + sign for time and frequency",FeaDThiccy,02.06.2025,us,1.0.553,0
12720539490,Bearable - Symptom Tracker,App Store,5,"great for physical, mental, and emotional health","app is easy to use with clean formatting; helps me track with consistency and accuracy. customizable and supportive without being over the top. insightful, validating, and  empowering in the journey thru chronic illnesses, and life in general. export capacity is extremely helpful to further analyze trends.",mayhemmmace,31.05.2025,us,1.0.553,0
12692337043,Bearable - Symptom Tracker,App Store,5,Secretary in hand,"Since I am ADHD, PTSD and a lot more issues going to the doctor is going to be less frustrating trying to answer his questions and keeping track of pain and symptoms. This is awesome for me keeping track before trying to remember was happening nor writing it down I would loose the paper or miss place had lost every where then forget them for the app being on the phone it’s right there easy to find and keep track . 
Thks Jo",JodieLaine,24.05.2025,us,1.0.552,0
12673609701,Bearable - Symptom Tracker,App Store,1,Could be good but,If you offer it for free they let me use it for free and stop promoting all over the app to upgrade. I am about ready to chuck it. Why must apps be so complicated.,GigiRedUK,19.05.2025,us,1.0.551,0
12673500110,Bearable - Symptom Tracker,App Store,5,Helpful,"I am finding this so helpful to be able to track bristol scale bowels, gratitude, and general symptoms from
Hormones or surgery or anything else of the day.",Chillinwithsaki,19.05.2025,us,1.0.551,0
12656910127,Bearable - Symptom Tracker,App Store,1,Wont even let me shake a account,I tried to sign in for like an hour and it wouldn’t let me…,Kaykaynapollo,15.05.2025,us,1.0.550,0
12652688848,Bearable - Symptom Tracker,App Store,5,Cancer Tracker,I love this app. I will be able to now go to my oncologist. Say here look because charts & data don’t forget. My Cancer brain does. Thank you.,KPistolB,13.05.2025,us,1.0.550,0
12651338548,Bearable - Symptom Tracker,App Store,3,Not Actually That Great,"I was hopeful when I started using this that it might find correlations for me that would be helpful. I haven’t been using it for more than a couple of weeks at this point so maybe I need to give it more time. It seems to only be helpful if you track things perfectly, which I don’t know if anybody can do. I’ll find that I accidentally overlook one thing one day and then suddenly it’s made a correlation that makes no sense. Like it thinks I feel better when I am really stressed and my mood is better when I have more screen time. I see the value in tracking all the information and so I’m gonna keep using it, but so far the correlations have been ridiculous. I was hoping to that they might make correlations with the food I’m eating help me recognize if anything is bothering my system. So far, I have not seen any correlations like that. I’m putting lots of time into this so far with very little gotten out of it.",EFJ42,13.05.2025,us,1.0.550,0
12644756580,Bearable - Symptom Tracker,App Store,5,Helps bipolar symptoms,Been using for a few months and enjoy seeing my trends and messages. A positive resource on my road of recovery.,Mangumhead1945,11.05.2025,us,1.0.550,0
12631360066,Bearable - Symptom Tracker,App Store,5,Best Symptom Tracking App,"This app is a cute, visual way to see your symptoms and how they are affecting your everyday life with  new weekly health status update every week to see if certain symptoms improved or not with a cute, little polar bear that says a little message once your done recording g your symptoms.",Flowermilks03,08.05.2025,us,1.0.550,0
12629808495,Bearable - Symptom Tracker,App Store,2,The tracking is ok but the function & service is horrible!,"I started using the app in 10/2024. In April of 2025 I got a new phone and followed their instructions for transfer from one device to another. Everything I had been tracking was lost. I have contacted them SEVERAL times with not as much as a confirmation that they received my help request. 
They are in the process of adding and updating the function and organization but currently some things are a mess and hard to navigate for continuous use. 
I started using it for helping track symptoms and cause and effect of health issues. I lost months of charting things for my doctor (which was what this app was heavily advertised for). I wanted to work to a solution but it’s clear that no one will be helping me. I have no way to get my money back for the year but I will not renew. 
It’s sad because though a work in progress it had potential.",Alicia Lowry,07.05.2025,us,1.0.550,0
12626562877,Bearable - Symptom Tracker,App Store,5,Great for tracking,"This has replaced the tracking I do in my physical planner. I got the subscription so I could track even more stuff. I wouldn't take it's ""insights"" too seriously early on. Haha, I don't think pollen helps my mood. But it's been great having so many things I can track all in one place. I'd love it if it had more health data options to sync and some themes just for aesthetics. I'm glad there's no gamification in here either. Can't stand that stuff for things like this.",Sunday Morning Rain,06.05.2025,us,1.0.550,0
12625280381,Bearable - Symptom Tracker,App Store,4,LANGUAGE!!!,PLEASE add more languages!!! (Russian)😭😭😭,uvioss,06.05.2025,us,1.0.550,0
12593204564,Bearable - Symptom Tracker,App Store,5,Please bring in weather,"Great app!  Please bring in weather.  Heat impacts my symptoms and I have to track it separately.  Outside of that, everything is great.",The Duder 2.0,27.04.2025,us,1.0.549,0
12586473962,Bearable - Symptom Tracker,App Store,5,Perfect easy check in,I love how you customize it so you aren't overwhelmed by it. Great reminder to stop and take inventory of your body and mind.,RunMama104,26.04.2025,us,1.0.549,0
12575149042,Bearable - Symptom Tracker,App Store,5,Really Great!!,"I can't say enough how much I like this app! It is fun and helpful. Good feel to the layout, not complicated, but still detailed. Nice to be able to make connections and understand myself better :-)",Martimoyi,23.04.2025,us,1.0.549,0
12564038685,Bearable - Symptom Tracker,App Store,5,Really good,Good app,chimmers12345,20.04.2025,us,1.0.549,0
12560346033,Bearable - Symptom Tracker,App Store,5,Life-changing,"I literally recommend this app to all of my friends. I don’t shut up about how much I love it. As someone who struggles to identify patterns, this app has been invaluable for me. I have a much better understanding of my health since I started using it 3 months ago. I love the customizability of the app and how I can explore specific trends/relationships between various factors  to better understand how certain behaviors/medications/habits/etc affect me. I rarely pay for apps, but this one was very worth it.",AriSofie,19.04.2025,us,1.0.549,0
12552585063,Bearable - Symptom Tracker,App Store,5,Support system,Excellent tool to keep me on track with self-care goals!,CholSerp,17.04.2025,us,1.0.549,0
12552191356,Bearable - Symptom Tracker,App Store,4,Easy to Use,"Good app, the free features are useful and Bearable is pretty generous I think with the features they give you for free.  I like the simplicity.  I’d like to see more Apple health integrations.  As of this writing only sleep and a few other data points can be synchronized with Bearable.  If water, nutrition, exercise, meditation, and medication data could be synchronized, that would be awesome and make the insights from Bearable more powerful.",JSB1120,17.04.2025,us,1.0.549,0
12536913593,Bearable - Symptom Tracker,App Store,5,The very best app I have used to track my health!!,"I have tested multiple apps for tracking health issues. I have multiple health problems and autoimmune issues that I need to track for triggers. This app is WAY beyond any of the others! There are so many options to specialize all the options. Easy and fun to use!! I will definitely be purchasing a subscription. The free version is great, too!",Chelle Sparkles,13.04.2025,us,1.0.547,0
12534881164,Bearable - Symptom Tracker,App Store,5,Easiest app I’ve tried,"I’ve loved this app so far. It’s definitely the easiest tracking app I’ve had, especially since it automatically gets some data from my Fitbit. I feel like you do have to get the premium for this app to even matter, and I hate premiums, but it was so cheap I figured it was worth it to start keeping track of all my different health problems. It’s extremely customizable so I’m able to keep track of ALL of my different symptoms, all in one app which is SO useful and helps me actually keep track instead of just having too low of energy to care enough. It just doesn’t show my heart rate on a graph, or at least I haven’t figured out where, but I just use cardiogram free for that, which isn’t much of a bother. I hope to still love this app after a few months and still be tracking my symptoms :)",Kai_whitney,12.04.2025,us,1.0.547,0
12528455496,Bearable - Symptom Tracker,App Store,4,Love the new setup,"This app is making it easy for me to track so much pertinent data in one place. Been using it for almost two weeks now. Still trying to figure out how to use it in some respects, but it’s very helpful to have the notifications, helps me remember to track things I would normally forget. Just getting the data recorded is half the battle. I appreciate the different methods you can set to record info but wish more options were available for more data points. I especially like the new set up for the daily check in, it makes it so much easier to find each section and record data quickly before I can forget. Thank you to the creators and team!",Bearly hanging in,11.04.2025,us,1.0.547,0
12526991154,Bearable - Symptom Tracker,App Store,5,MY SAVIOR!!,"I’ve never written an app review before but I needed to give Bearable 5 stars. It has made such a different in my life. I have chronic migraine which comes with a whole slew of symptoms many of which are constantly changing. Bearable helps me keep track of how I’m feeling as well as track any correlations, which is a total game changer and something I always wished I could do!!! I’ve recommended it to everyone and all my doctors. Hands down the best app I’ve ever used for my migraines. I love the bear, that is super cute and love to see it when I feel bad. Can’t recommend it enough.",jfparrott09,10.04.2025,us,1.0.547,0
12524822180,Bearable - Symptom Tracker,App Store,5,Best symptom tracker out there!!,"This app helped me get a diagnosis i’ve been struggling with my entire life!! the continuous updates and adjustments show how well the team listens to feedback. i’ve recommended this app to so so many people, and i hope it helps others as much as it’s helped me",lberggren01,10.04.2025,us,1.0.547,0
12524758865,Bearable - Symptom Tracker,App Store,5,Really helpful app,"Bearable was recommended to me as a tracking app for energy, sleep and mood and helping find correlations that impact these things. I am terrible at tracking data consistently but find bearable reminders and UI easy to use and have been successful tracking data for about a month. The correlations are helpful as are the graphs.",JustSayN4RF,10.04.2025,us,1.0.547,0
12522541936,Bearable - Symptom Tracker,App Store,5,I ♥️ Lists and Rating Systems,"This app (ESPECIALLY for the price: ~$40/yr right now I think?) allows you to do so much and to customize so much. 

If the number of list items seems too many and is overwhelming, you can hide them. One of the absolute best features of Bearable is that you can write in your own items and your own lists, AND you can choose to do them on two types of ranking scales or simply a yes/no. 

For someone with chronic migraine disorder and a complicated slew of other autoimmune symptoms, I really don’t think I could ask for something better than this!! 

I hope more than anything they don’t end up doing the gradual price increases that lead to high prices before you know it, as some of my other apps have done. As it is right now (April 2025), I am so happy for this app as it is.",SD1166,09.04.2025,us,1.0.547,0
