ID,Название приложения,Магазин,Рейтинг,Заголовок,Содержание,Автор,Дата,Регион,Версия,Полезность
cef6f5f1-ce7f-4ce9-a9c8-28baf0c90d4b,Symptom & Mood Tracker,Google Play,1,,"1. Installed the Trial 2. Found it difficult to configure 3. Deleted my account after a couple of days and left a middling review. 4. Received multiple emails from the CEO and the the response below within 24 hours. 5. Was charged for the app after I deleted my account. 6. Requested a refund and offered to give constructive feedback as I was asked. 7. Was ignored after they took my money. If I could give this app 0 stars, I would. Predatory desperate businessfolk.",Aubrey Robertson,06.02.2024,us,5.3,0
af93292c-3369-4171-bb65-a1eacbc2b7f9,Symptom & Mood Tracker,Google Play,5,,Best experience,Shishir Ahmed,02.02.2024,us,5.5,0
a5b0fb9e-bace-4b69-8001-efc95504083c,Symptom & Mood Tracker,Google Play,5,,Guten Tag ich habe mit der App nur gute Erfahrung gemacht und kann die App nur weiteremphelen,Mirjam Winiger,29.01.2024,de,5.5,0
691eed9d-8095-42fb-a51c-1fdcce9ddb97,Symptom & Mood Tracker,Google Play,2,,"The features of the app are very useful and comprehensive for tracking chronic illnesses. However the sluggish speed is very frustrating & hasn't been improved despite several updates. It also hangs very often. For checking in, the dates will be automatically changed to the current date and if you want to check in for previous dates, you have to keep manually changing it back on every item.",Fairuz Hanim,14.01.2024,us,5.45,0
bd669169-ff9f-4fc8-a117-b7fe8d831d04,Symptom & Mood Tracker,Google Play,1,,"This is NOT user friendly. There's also a paywall pop up at nearly every keystroke (can't even test the app features - literally every 3-4 taps or letter that's typed). No setting to change the date format to MM/DD/YY. The ease of use is just not there when making entries, especially for adding medications or typing into any ""Notes"" section (no return key to go to the next line even). The text does not allow for consecutive capitalized letters (i.e. AM, PM, IR, XL, etc.). Here's your sign! ⚠️",Jessica Randall,10.01.2024,us,,0
12e03bb7-ce3b-489b-aad6-e75579906116,Symptom & Mood Tracker,Google Play,2,,"I was hoping to use this for my fibromyalgia. However, I did not even get through the setup of the free version. Every time I started to set up a feature, I got a pop-up to sign up for their free trial of the premium. I was continually exiting out of it. It was too annoying. Removed app.",Asetmoonglow,08.01.2024,us,5.45,0
85d18701-b1a2-47d0-9f3e-195821443da0,Symptom & Mood Tracker,Google Play,5,,Very good app to keep myself informed on my behaviour. I have severe ADHD I make use of the app to not get distracted and focus more. The paid features are worth every penny.,Dasunashanka Shanka,05.01.2024,us,5.45,0
c84369a0-1b44-463a-b282-360470335302,Symptom & Mood Tracker,Google Play,5,,"As someone who struggled a lot due to unstable mental health, I've tried almost all of the mental health trackers that exist in this store. This is the best one yet. Not only does it help with my mental health, it also helps me keep an active lifestyle. It includes exercises that I used to get started on my ""staying fit"" journey!",Kyle Ramiel Dalangin,03.01.2024,us,5.45,0
c46ed6af-0d15-4ec7-95c2-177661f2f6cd,Symptom & Mood Tracker,Google Play,3,,"I had really high hopes for this app---it's very thoughtfully designed and totally customizable, and can export data to .CSV--it's just really buggy. I'm doing the premium trial now and was more than happy to pay for the app, but half of the things I'm entering won't save, create many duplicates, and a lot of buttons just don't do anything. Hoping these get lined out and that I can call this my Holy Grail tracker soon.",Rose Kent,21.12.2023,us,5.45,0
ec34c83a-b987-4127-85fc-f92127e68e9b,Symptom & Mood Tracker,Google Play,5,,"Good App for tracking medicine, nutrition, mood, symptoms, physical activity, etc. It works as health journal to track and analyse my health",vishal kashyap,20.12.2023,us,5.45,0
29a811df-b7fe-4c12-a90a-a1d796b3c548,Symptom & Mood Tracker,Google Play,5,,So far the app is doing what I pictured in my head in terms of ease of UX as well as what it covers health wise. Flareup for instance sucked in both of those ways. This seems pretty comprehensive and easy to figure out. I especially like that it automatically records weather pressure and temperature because unfortunately those DO have a worsening effect on my pain and stiffness. I also like that you can share your entries with a caregiver if accountability helps keep you on track.,Tracie Howell,15.12.2023,us,5.4,0
d230008b-9bfa-4fd3-91a5-47279a1843e2,Symptom & Mood Tracker,Google Play,1,,not free,Sydney Beaumont,06.12.2023,us,5.3,0
ceae3c49-4d0d-48e5-9c8b-a516c4ae49cf,Symptom & Mood Tracker,Google Play,1,,wants cc # right away to just explore the application ain't doing that trick..,My yM,30.11.2023,us,5.3,0
9fef7ff5-198f-4f05-a1b6-7de2e7f1d00f,Symptom & Mood Tracker,Google Play,2,,"Have to create an account to test out. There's a free and paid version based on the other reviews, but I couldn't see if it fits my needs unless I made an account. And I don't trust that it'd be easy to delete my account if it didn't suit my needs, because a lot aren't",K,29.11.2023,us,,0
a00cba2b-3288-4db1-b369-67d5c99efbd8,Symptom & Mood Tracker,Google Play,1,,"Meds cannot be deleted. There is no delete button, even if you follow the instructions in the app. edit: delete button was moved without the help section being updated and the new delete button doesn't work at all.",Richard Sparks,22.11.2023,us,5.3,0
c4a45dd9-7f1f-432c-a0aa-709935726cfd,Symptom & Mood Tracker,Google Play,3,,I've already made my decision reading the reviews,Ptl,18.11.2023,us,5.3,0
ff61231c-8b9b-41c7-a8e3-383863858726,Symptom & Mood Tracker,Google Play,1,,Please guys don't download this app it's just wasting of time,Mintesinot Kebede,17.11.2023,us,,0
a0872ab4-a6da-4d5e-b25f-bba7db4b470b,Symptom & Mood Tracker,Google Play,1,,No option to take temperture,Saundra Cherenfante,10.11.2023,us,,0
b6452b64-b50a-485e-912c-7ea7f9af47f3,Symptom & Mood Tracker,Google Play,1,,"Free version is useless. Edit: I accidentally added this app again, not realizing I've already tried it. It's still useless. I'm disabled, I live on poverty wages: I can't just upgrade to make this app worth using. I would've watched ads. But my cash needs to go to things I NEED, not quality of life things. You can't add symptoms or moods, multiple medications, basically anything shown in the pictures. You're lucky if you get one or two. Waste of time downloading this app imo.",Darkest Love,09.11.2023,us,5.3,0
8354b5e1-e085-45ff-83ad-0b6900687cd8,Symptom & Mood Tracker,Google Play,5,,"As a healthcare professional, I find this app's detail and adaptability to be top-notch. It's proved to be a fantastic resource for patients with cognitive challenges. The ability to annotate symptoms and identify potential triggers is a standout feature.",M Nazim,07.11.2023,us,5.3,0
db4d7627-1fca-4d67-97ac-6f176b52137c,Symptom & Mood Tracker,Google Play,1,,"not free, false advertising",Trish Lee,07.11.2023,us,5.3,0
5819ad76-5ab8-4256-b468-db3006a3cf6d,Symptom & Mood Tracker,Google Play,1,,why do you let me download the app and upon opening the app you require me to provide payment method. no mention of that...,louise pienaar,04.11.2023,us,5.3,0
af5983ae-0261-4d41-83b3-e458bc4417f9,Symptom & Mood Tracker,Google Play,5,,"Over the course of a year, the CareClinic app's evolution has been remarkable, a testament to the development team's commitment to user feedback. As someone managing chronic illness, the app has been instrumental in monitoring medication effects and symptom patterns, offering a visual representation of my health journey.",Rintu Mondal,03.11.2023,us,5.3,0
3d1e115b-592a-4262-b08f-59344de7ea11,Symptom & Mood Tracker,Google Play,5,,"As a mature user in search of a comprehensive health, mood, and fitness tracking application, I've found the CareClinic app to be nearly impeccable. Its intuitive user interface and appealing aesthetics, from button design to font choice, enhance the user experience. While it presently lacks certain features such as a heart rate monitor and fitness routines, its extensive offerings are commendable.",hawu musa kafinta,03.11.2023,us,5.3,0
4711ebc3-1c96-4f5b-963b-8c852c394b17,Symptom & Mood Tracker,Google Play,5,,"The CareClinic application has demonstrated robust performance, enhancing user engagement with customizable health tracking options. Even with minimal issues encountered, the support team has been exceptionally responsive, providing swift solutions and ensuring continued app functionality through diligent follow-ups.",A Google user,03.11.2023,us,5.3,0
3ac3006f-a276-4d69-a8d5-88d6045d4982,Symptom & Mood Tracker,Google Play,5,,"I’ve been using this app to manage my chronic pain and arthritis, and it’s been really helpful! The pain tracking and medication management features are intuitive and detailed. I use the symptom journal, which helps me correlate daily activities with pain levels.",Mike Rehan,05.10.2023,us,5.2,0
c37de989-2110-4548-8449-8e9c31a19172,Symptom & Mood Tracker,Google Play,5,,"I'm changing my review, because the developers worked with me to fix all the issues I was having. This is a very cool app that has a lot of features, more than I've fully explored. The med reminders are awesome.",Caitlin O'Shea,02.10.2023,us,5.2,0
360a390a-a0d9-42c2-93b6-1d8d8104b8fc,Symptom & Mood Tracker,Google Play,1,,requires annual subscription,Elizabeth Councill,05.09.2023,us,4.9,0
e1b45d34-32ac-426c-b6d3-2037f4d6f667,Symptom & Mood Tracker,Google Play,2,,"Without subscribing, this app lets me add 3 medical conditions and 3 symptoms. If you only want to track something like migraine, this is a great app without the subscription. However if you have any complex chronic condition with multiple symptoms, the subscription is very expensive and 3 symptoms doesn't even cover 1%",R O L,10.08.2023,us,,0
21164cc4-6504-49d4-9fbe-35c7a7e79a1d,Symptom & Mood Tracker,Google Play,1,,It's only for record. Not to measure body temperature as it mentioned.,Cordy Chung,06.08.2023,us,,0
def11019-7033-4d7d-bd33-4b53a78cfeb2,Symptom & Mood Tracker,Google Play,1,,"Dear CareClinic, I love the features of your app, but med notifications are broken and a support request has gone unanswered for over a week now. Your lack of response is deeply concerning and prevented me from continuing with a paid subscription after my trial ended.",Ed Glorioso,23.06.2023,us,4.7,0
b57d0e81-defe-4a13-8b9b-42cb79b20800,Symptom & Mood Tracker,Google Play,1,,immediately tries to get you to spend $50+,Gillian Myers,23.06.2023,us,4.7,0
40c85625-af14-4583-8ac4-5b7570a8fca2,Symptom & Mood Tracker,Google Play,1,,sucks,Randy Simpson,01.06.2023,us,4.7,0
04b14032-8399-4641-8f9c-2c46a8a44924,Symptom & Mood Tracker,Google Play,1,,"it says FREE, you enter your login, password and ASKS for credit card info!! I intentionally do not have my credit card info with the get apps... there are sooo many that are just scams! for instance, it says free when you get into the app, it's $59.99 FOR A YEAR.. I didn't even bother reading anything further!!! WARN!!! SCAM!!! If I could rate a negative star, I would!!! complete lies abd SCAM!!!",Karen Krusaders,24.05.2023,us,4.7,0
27909e19-918d-4cb6-a389-8928337d541d,Symptom & Mood Tracker,Google Play,1,,Finding this app extremely difficult to configure. Tried to free app thought maybe that was the problem. Bought the full app and none of the problems were resolved with buying the app. You can't delete a broken care plan and somehow I've managed to attach months of historical data to a broken care plan and I've lost everything and it looks like I'll have to uninstall the application to rebuild it. It's a great idea and if they ever get it all working it'll be a wonderful tool but at this point,Tim Montgomery,04.05.2023,us,4.6,0
59fcc5d4-8376-491b-914c-82fc2f8cf012,Symptom & Mood Tracker,Google Play,1,,"I uninstalled this immediately because there is no free trial on the monthly pay option. I've already missed so much work due to my multiple chronic illnesses, I can't afford the annual subscription option, but I'm not going to sign up for a Premium/Paid option without a free trial to see if it actually works for me.",Heather Randall,02.05.2023,us,4.6,0
7739880b-36f8-4eb8-a3b9-ac3ea4e2d6d1,Symptom & Mood Tracker,Google Play,1,,I'm not paying 60 bucks per year,Wendy White,25.04.2023,us,4.6,0
f9320bb7-6c89-4962-a6ca-a18d5422ae19,Symptom & Mood Tracker,Google Play,1,,Customer service is awful. Not answering my emails. Won't allow me to delete account and I keep on being charged despite contacting since April 2022.,Batsheva,24.04.2023,us,4.5,0
6804603e-98e8-4254-a3cf-bd1779a1e087,Symptom & Mood Tracker,Google Play,5,,"I do find the app very useful and easy to use, used the it partly because have a chronic illness (fibromyalgia), but there are also symptoms I can't explain such as weight loss, stomach pain, etc, and I've been trying for years to find out what is the cause. I unfortunately had to cancel my subscription since I can't afford it however. I would have been interested in getting a student discount since my income is limited.",Nix E. Love,23.04.2023,us,4.5,0
9038e100-e121-4264-b967-2eaa693a38f9,Symptom & Mood Tracker,Google Play,2,,It's a great idea too bad I've had to ad all my many conditions numerous times because for some reason the app automatically deletes them after I've spent all that time setting it up very disappointing,Brittany Hall,23.04.2023,us,,0
5bfe0d9d-9a7a-48b5-a3be-56125d771ed2,Symptom & Mood Tracker,Google Play,5,,"I've been struggling with chronic fatigue for quite some time, and it's been a rollercoaster of ups and downs. The CareClinic app has been such a blessing in my life! It's super easy to track my symptoms, energy levels, and even my mood. I particularly love the daily reminders to check in on my well-being. Since I started using the app, I've been able to identify patterns and triggers that affect my fatigue.",Op soनी,20.04.2023,us,4.5,0
5f2eb58e-f20f-4eb1-9ac1-eb95d8ff1fa6,Symptom & Mood Tracker,Google Play,5,,"Dealing with endometriosis is never easy, but CareClinic has become my best friend in managing this condition. The app allows me to log my pain levels, mood swings, and even my menstrual cycles. With this information, I've been able to communicate more effectively with my doctor and make the necessary adjustments to my treatment plan...",nastia605,20.04.2023,us,4.6,0
f3926ed2-7930-4928-83e3-7efc325a925f,Symptom & Mood Tracker,Google Play,2,,The app is ok at the moment still trying to get a feel for it but my wife like to keep track of things with me to help me because I have a rare muscle disease and it wants her to pay too as my family member so that may keep me from night buying it and why its has a 2 star right now that is a big deal. (Response...I am a paid member so that doea not hel0 my situation),Jet King,20.04.2023,us,4.5,0
82786491-3f9c-4eca-ae9c-a11fe715594f,Symptom & Mood Tracker,Google Play,1,,"Here I am, April 2023 and STILL PAYING and STILL NO way to stop it! I have looked on my google and it doesn't show up so I can't stop it there. I need to STOP THE PAYMENTS, PLEASE!!! Downloaded and didn't like it or use it. Cancelled. Tried to call the number listed on my CC and says it's not a good number. I want them to stop billing me! No where does it show up in my subscriptions to cancel again or stop it",Kris Martin,18.04.2023,us,,0
d133d24b-579c-438a-83e6-618f0bb47289,Symptom & Mood Tracker,Google Play,1,,"Why? Please, Tell me WHY? Create an account and then it immediately asks ""do you want to pay money?"" NO I don't! Delete immediately, I'm afraid of things that want me to spend money to get ""more features"" and the features I need aren't free.",AnnMarie Carfagno,03.04.2023,us,,0
fd60b7d4-3d33-4e61-9e3b-8e4b57d61b66,Symptom & Mood Tracker,Google Play,3,,"The app itself is fantastic. Incredibly money grabby though. You need to pay for like 75% of the features. And if you wanted to share with a family member or doctor like it advertises you BOTH have to pay for the premium version of it. It constantly tries to get you to buy new ""health plans"" for one thing or another. Great app but definitely more here to make money than help you.",Gabriella Ruiz,31.03.2023,us,4.5,0
8416dea9-2025-4c19-a283-d7b320ac2014,Symptom & Mood Tracker,Google Play,3,,"I want to like this. It's so close to what I need, but just doesn't work. The reminders only go off sometimes and then just don't other times, even though they are always turned on. I've been missing meds because of it. App in general is very glitchy and takes time to load. I wish I didn't get the subscription.",Maddie Emerson-White,26.03.2023,us,4.5,0
a1915dc0-f827-4229-b3ef-10a1c7d74d3a,Symptom & Mood Tracker,Google Play,2,,"gave it 5 stars first but now 2 because i can't see nor check in with my custom care plan anymore. i spent like 2 hours customizing my plan. then i saw there was a manage anxiety free guided plan and clicked to start it. it set itself as the default plan, and then let me know i can only see 1 plan or upgrade my account. there is no way to select my custom plan as default, or even see it. and there is no way to delete the new plan. there was no warning of this, had i known would've kept my custom",Dawn,25.03.2023,us,4.5,0
88ff6000-442e-4a49-b473-4b0733d0dc11,Symptom & Mood Tracker,Google Play,1,,Tried the free trial and thought this was a really good app. Upgraded and paid the yearly fee and now the app is awful. Have lost 2 days and then 4 days of check ins. Initially customer services were responsive and I felt reassured. After the 2nd data loss I requested a refund and now no response at all. Very disappointed and do not recommend wasting your money.,Sam Clayton,18.03.2023,us,4.4,0
bd5ae187-5fc8-4401-b5cf-bbdb81cea4f4,Symptom & Mood Tracker,Google Play,1,,can't even track anything because whenever i try to type it tries to force me to buy a prescription!,Min Billing,11.03.2023,us,4.4,0
7b16026b-6ee7-49d5-92fc-08d685ea4f3d,Symptom & Mood Tracker,Google Play,1,,Spammt mich voll,Bö Ottaviani,06.03.2023,de,,0
fbed58e7-e065-41ae-aaaa-bcc86520cb5b,Symptom & Mood Tracker,Google Play,5,,Verynise,Lingam. Nagabhushanam,04.03.2023,us,,0
9ddad6eb-dc70-43ed-8910-bf16103748b2,Symptom & Mood Tracker,Google Play,2,,Every time I go to top in something and it get to long the app freezes then crash. Making Me do it all over again,Alexia Hardy,04.03.2023,us,4.36,0
4ecb055e-f9a3-4da6-a8cb-344be3183649,Symptom & Mood Tracker,Google Play,1,,So much of the apps functionality requires premium. Every time you try and do something that's a premium feature you get a pop-up. It's super annoying and I didnt even get one days worth of entries before I uninstalled.,Jenn ifer,02.03.2023,us,4.36,0
7d79e907-d213-4e3f-8b78-663f8d4b9eef,Symptom & Mood Tracker,Google Play,1,,"Free version was awful. Can't edit an entry of you've made a mistake, constant ads and I couldn't get a feel for if I wanted to pay or not due to the constant pop ups. Deleted within ten minutes.",Amelia Poole,22.02.2023,us,,0
faee8e69-3308-4d36-87a5-6e5bfda54aee,Symptom & Mood Tracker,Google Play,1,,"I can't even register for an account as it's having connection issues. I was really hoping this would be the one to pull me away from P Tracker, but alas, I can't even try it out. It's such a bummer as I'm fairly certain I'm perimenopausal, and most menstrual tracking apps don't account for the irregularities and symptoms, and this app promised itself to.",Melissa Gizewski (xkillbot2000x),22.02.2023,us,4.36,0
af6aa793-8850-4061-a236-8ab8d0b274d9,Symptom & Mood Tracker,Google Play,4,,"A bit difficult to navigate and definitely complicated to set up, but that is due to the abundance of features, which I appreciate compared to many other apps I have tried. Once you figure out what features you need, using the app is a breeze. Minus one star, however, due to many bugs that will lag the app or make ""check-ins"" difficult to fill in and post to your log. There are also some UI bugs, but that might be due to the extended aspect ratio of my phone (Samsung Galaxy S22 Ultra).",Caitlin Smith,19.02.2023,us,4.36,0
a510b7bd-5fd7-4fde-9e40-cd10ea2596ac,Symptom & Mood Tracker,Google Play,3,,Promising concept. Not quite polished yet,Fredrik Seglem,08.02.2023,us,4.36,0
e844c406-637d-4bc1-9d71-3f7d1eb52ca1,Symptom & Mood Tracker,Google Play,1,,Terrible. It puts up a two page ad for the subscription literally every time the app is opened so if you're trying to track symptoms happening in the middle of the night you'll have serious trouble. Un installed.,Rich Crawford,03.02.2023,us,4.36,0
da3849a9-215d-445d-b7ae-37374fc5f0e2,Symptom & Mood Tracker,Google Play,1,,"I downloaded this application because it sounded like I was looking for to continue monitoring my health and the the reviews sounded good. After downloading it and starting to setup an account, I realized there is a monthly subscription charge to use this app. I am uninstalling it now! I don't need nor want to have to pay monthly to track my meds and stats. I started using Care Zone years ago & they were replaced by Walmart Wellness & now that going away on the 31st. Need replacement",Denise Brooks,28.01.2023,us,4.36,0
dfd238aa-bd74-4ccd-baa0-f6da4070dca4,Symptom & Mood Tracker,Google Play,5,,Very useful app for keeping track of your own health and learning about different health problems.,Dimitri Yang,26.01.2023,us,4.36,0
7674574c-f4d8-41d6-9428-178abcff5a5d,Symptom & Mood Tracker,Google Play,2,,"The incessant pop-ups and nudges for upgrading to premium make it really hard to use the app even just to evaluate whether premium is worth it. They use dark UX patterns like switching the position of the ""exit"" button on the upgrade prompt, and the prompts seem to appear almost every time you open the app. Uninstalling now.",Alex Taylor,14.01.2023,us,,0
77dc6e36-4b25-4fe9-8061-28d6e40eda63,Symptom & Mood Tracker,Google Play,2,,The main feature that I downloaded this app for is behind a paywall. I want to track my medication and edit the time. Editing the time you took a medication is a basic feature and for some reason they want to make you pay for it. I will be downloading another app in the meantime that lets me do that for free.,peaches,05.01.2023,us,4.25,0
a1e8ef54-dd15-4f03-9e23-4cc831b74098,Symptom & Mood Tracker,Google Play,5,,"I use this app for symptom tracking and tying it all together with nutrition, sleep, and physical activity. The app is easy to use. I appreciate the customizable symptom tracker and well designed UI!",BeckyW Teladochealth,03.01.2023,us,,0
5cd3df90-8af0-45d4-9dcf-b9316f43986b,Symptom & Mood Tracker,Google Play,1,,Won't Refund my money,Jamie Jamie,13.12.2022,us,,0
420e2f6a-0623-4367-9258-857e2dbeb492,Symptom & Mood Tracker,Google Play,2,,Good if you like keeping track of your symptoms; TERRIBLE FOR REMINDERS TO TAKE MEDICATION! Does not give a notification to your phone when you set a reminder at a set time. Do not rely on this app to remind you to take your medication. Also every time I open the app it's trying to get me to subscribe to their premium version. That's annoying.,Tori Venter,07.12.2022,us,4.2,0
3bf0080f-5a02-408e-8395-ad245cc61999,Symptom & Mood Tracker,Google Play,1,,Charged me for a year and i didn't even know it was going to. Now I can't find where I can request a refund after a long search.,Amy Yvonne,05.12.2022,us,4.0,0
ea146aeb-04da-4cd0-a58a-df6e49b805a8,Symptom & Mood Tracker,Google Play,1,,"I just installed it. Similar to a user below me I couldn't even look around the app wo being inundated with subscription offers. Couldn't use any feature unless I signed up for ""free"" trial but given other reviews indicating issues with ending their subscription I decided not to. I hate pushy sales people hence I avoided malls.. now pushy app sales. Sorry $75 isn't cash I throw around ..without even getting a peak. At least at the mall you got to try things on ...",angela fabisiak,28.11.2022,us,4.15,0
dac0e09c-b528-4dc3-b1a9-ad789e2e41c9,Symptom & Mood Tracker,Google Play,1,,Very hard to use!,Jill Cox,25.11.2022,us,4.15,0
a7b6f55f-b284-4cfb-8d8c-04f3248c32a2,Symptom & Mood Tracker,Google Play,2,,"Honestly, with some fine tuning and better organizational skills, this could be one of the better tracker apps. So, what kills it? The pop-up to subscribe to it after every single click! I have been browsing trying to find the best app. I plan on paying for the ONE I subscribe to. Thereare better, and cheaper apps and so far none of them harass you to subscribe quite as aggressively as this one does. Sad the developers ruined a good app by making it unusable unless you pay.",Raven Darhk,18.11.2022,us,4.15,0
66d7ab0a-afe1-4cfb-af0c-1dc15837ef9c,Symptom & Mood Tracker,Google Play,5,,"This healthcare app has been a game changer for me and my family. It’s been a tremendous benefit to use as a health tracker for my mental health, as I’ve used it to help track my wellbeing, sleep patterns, diet and overall well-being. Highly recommend!",Imran Khan,07.11.2022,us,4.1,0
5897e289-af12-4e97-ba22-c753deb79ba0,Symptom & Mood Tracker,Google Play,1,,"Maxed out at 5 chronic conditions, before they started pushing me to buy an in app purchase.",Kade Stevens,27.10.2022,us,,0
